title_pt;title_en;year;rating;genre;sinopse;image
O Mensageiro do Diabo;245. O Mensageiro do Diabo;1955;8.0;Policial;Um fanático religioso se casa com uma viúva cujos filhos pequenos relutam em dizer-lhe onde seu pai verdadeiro escondeu os 10,000 dólares que ele havia roubado.;https://m.media-amazon.com/images/M/MV5BMGZjNDE2OGQtMDA5My00ZTU3LWI1NGItZjk1YjRjN2IyMWNjXkEyXkFqcGdeQXVyODc0OTEyNDU@._V1_QL75_UY562_CR9,0,380,562_.jpg
O Planeta dos Macacos;246. O Planeta dos Macacos;1968;8.0;Aventura;Uma tripulação de astronautas choca com un planeta num futuro distante, onde os macacos são inteligentes e a espécie dominante.;https://m.media-amazon.com/images/M/MV5BZjczYWFmODItNjMyMy00ZjI5LWExZTUtYzJhN2ZiYTE0M2M5XkEyXkFqcGdeQXVyMTAyOTE2ODg0._V1_QL75_UY562_CR6,0,380,562_.jpg
Os 12 Macacos;247. Os 12 Macacos;1995;8.0;Mistério;Em um mundo futuro devastado por doenças, um condenado é enviado de volta no tempo para coletar informações sobre o vírus produzido pelo homem que destruiu a maior parte da população humana do planeta.;https://m.media-amazon.com/images/M/MV5BMWZlMTI4NTctNjI0NS00YmNmLTgwMGQtYjFkMWM3OTRhODFjXkEyXkFqcGdeQXVyMTAyOTE2ODg0._V1_QL75_UY562_CR5,0,380,562_.jpg
Diamante de Sangue;248. Diamante de Sangue;2006;8.0;Aventura;Um pescador, um contrabandista e um sindicato de empresários se enfrentam sobre a posse de um diamante de valor inestimável.;https://m.media-amazon.com/images/M/MV5BZDMxOGZhNWYtMzRlYy00Mzk5LWJjMjEtNmQ4NDU4M2QxM2UzXkEyXkFqcGdeQXVyNTA4NzY1MzY@._V1_QL75_UX380_CR0,0,380,562_.jpg
Papillon;249. Papillon;1973;8.0;Biografia;Um homem faz amizade com um colega criminoso quando os dois começam a cumprir sua pena em uma terrível ilha-prisão, o que o inspira a planejar sua fuga.;https://m.media-amazon.com/images/M/MV5BZGRjZjQ0NzAtYmZlNS00Zjc1LTk1YWItMDY5YzQxMzA4MTAzXkEyXkFqcGdeQXVyMjI4MjA5MzA@._V1_QL75_UX380_CR0,9,380,562_.jpg
Ela;250. Ela;2013;8.0;Drama;Num futuro próximo, um solitário escritor tem uma relação pouco comum com um sistema operacional destinado a atender todas as suas necessidades.;https://m.media-amazon.com/images/M/MV5BN2Y5NTU5OWQtN2YwMS00NDBiLTk0ZmUtYzBjMTczYzA5NWY0XkEyXkFqcGdeQXVyMTAzMDM4MjM0._V1_QL75_UY562_CR2,0,380,562_.jpg
Oppenheimer;Oppenheimer;2023;8.6;Biografia;A história do cientista americano J. Robert Oppenheimer e o seu papel no desenvolvimento da bomba atômica.;https://m.media-amazon.com/images/M/MV5BMjg4OTkxNzUtOGQ0My00MzQxLWIyZmItMzIyY2FlZTRhMDcxXkEyXkFqcGdeQXVyMTA3MDk2NDg2._V1_QL75_UX380_CR0,20,380,562_.jpg
Barbie;Barbie;2023;7.2;Aventura;Viver na Terra da Barbie é ser um ser perfeito em um lugar perfeito. A menos que você tenha uma crise existencial completa. Ou que você seja um Ken.;https://m.media-amazon.com/images/M/MV5BZGExZWM4YzItMDkyNS00ZWRlLWJjY2UtMTE1Mjg2YmJiYzEzXkEyXkFqcGdeQXVyNTk2MDQ0MjA@._V1_QL75_UX380_CR0,0,380,562_.jpg
Você Não Tá Convidada pro Meu Bat Mitzvá!;Você Não Tá Convidada pro Meu Bat Mitzvá!;2023;6.0;Comédia;Stacey Friedman se prepara para seu bat mitzvah, mas seus planos se desfazem comicamente e ameaçam arruinar o evento.;https://m.media-amazon.com/images/M/MV5BZWQ3ZDQ3MTYtZWUyOS00YmFhLTllOWItNzNmNjE0ZDI5YWE5XkEyXkFqcGdeQXVyMTUzMTg2ODkz._V1_QL75_UX380_CR0,0,380,562_.jpg
O Protetor: Capítulo Final;O Protetor: Capítulo Final;2023;7.1;Ação;Robert McCall se sente em casa no sul da Itália, mas descobre que seus amigos estão sob o controle do crime local. À medida que os eventos se tornam mortais, McCall sabe que deve tornar-se o protetor de seus amigos enfrentando a máfia.;https://m.media-amazon.com/images/M/MV5BNDIyNDA5NTgtNTQ0Ny00OTdmLWE2N2ItODEyMzI5NDZjOTg3XkEyXkFqcGdeQXVyNzAwMjU2MTY@._V1_QL75_UY562_CR1,0,380,562_.jpg
A Pequena Sereia;A Pequena Sereia;2023;7.2;Aventura;A filha do rei Tritão, Ariel, se apaixona loucamente por um príncipe que salvou de um naufrágio. Ela decide ir procurá-lo em terra firme e pede ajuda à bruxa do mar, Úrsula.;https://m.media-amazon.com/images/M/MV5BYTUxYjczMWUtYzlkZC00NTcwLWE3ODQtN2I2YTIxOTU0ZTljXkEyXkFqcGdeQXVyMTkxNjUyNQ@@._V1_QL75_UX380_CR0,0,380,562_.jpg
Pobres Criaturas;Pobres Criaturas;2023;8.0;Romance;A incrível história sobre a evolução fantástica de Bella Baxter, uma jovem trazida de volta à vida pelo brilhante e não convencional cientista Dr. Godwin Baxter.;https://m.media-amazon.com/images/M/MV5BNGIyYWMzNjktNDE3MC00YWQyLWEyMmEtN2ZmNzZhZDk3NGJlXkEyXkFqcGdeQXVyMTUzMTg2ODkz._V1_QL75_UX380_CR0,0,380,562_.jpg
A Freira 2;A Freira 2;2023;6.0;Terror;França, 1956. Um padre é assassinado. Um mal está se espalhando. A irmã Irene, mais uma vez, fica cara a cara com a força demoníaca Valak, a Freira.;https://m.media-amazon.com/images/M/MV5BNTIyNzQ5M2MtYTA2Ny00ZWM1LTlmNzYtNjhjNDkxYjBkNjhkXkEyXkFqcGdeQXVyNzAwMjU2MTY@._V1_QL75_UX380_CR0,0,380,562_.jpg
Jawan;Jawan;2023;7.8;Ação;Um thriller de ação de alta octanagem que descreve a jornada emocional de um homem que está determinado a corrigir os erros da sociedade.;https://m.media-amazon.com/images/M/MV5BOTE5YjY5MTItYTBmZi00NDhhLWFiOTItYjdjODRhZDA1YjM4XkEyXkFqcGdeQXVyMjMyMzI4MzY@._V1_QL75_UY562_CR6,0,380,562_.jpg
As Tartarugas Ninja: Caos Mutante;As Tartarugas Ninja: Caos Mutante;2023;7.3;Animação;Os irmãos Tartaruga trabalham para conquistar o amor da cidade de Nova York enquanto enfrentam um exército de mutantes.;https://m.media-amazon.com/images/M/MV5BZDZjZTc2MjgtNjA4Ny00YmEzLWE5OWMtMTgxMWUzZTdmZmMxXkEyXkFqcGdeQXVyMTEzNTE3MjE4._V1_QL75_UX380_CR0,0,380,562_.jpg
Indiana Jones e a Relíquia do Destino;Indiana Jones e a Relíquia do Destino;2023;6.7;Ação;O famoso arqueólogo e professor Jones regressa com novos desafios, perigos e aventuras, mas desta vez ele tem o sangue de uma nova geração para o ajudar nas suas descobertas e na sua luta contra um novo vilão.;https://m.media-amazon.com/images/M/MV5BNDJhODYxYzItOGIwZC00ZTBiLTlmN2MtMjM2MzQyZDVkMGM4XkEyXkFqcGdeQXVyMTUzMDA3Mjc2._V1_QL75_UY562_CR35,0,380,562_.jpg
Que Horas Eu Te Pego?;Que Horas Eu Te Pego?;2023;6.4;Comédia;Maddie, à beira da falência, é contratada por pais superprotetores para ajudar seu filho introvertido a se tornar mais confiante antes da faculdade. Ela tem apenas um verão para completar sua missão.;https://m.media-amazon.com/images/M/MV5BYmM2ZDE2MDItNTEwYy00M2E2LTk0NmQtMGUxNWJlOWNmYzRlXkEyXkFqcGdeQXVyMTY1OTA3NjAx._V1_QL75_UY562_CR35,0,380,562_.jpg
The Bikeriders;The Bikeriders;2023;8.7;Policial;Acompanha a ascensão de um clube de motociclismo do meio-oeste ao longo da vida de seus membros.;https://m.media-amazon.com/images/M/MV5BNTg3OTM0NTktMWJlMC00YWVhLWI0ODEtZTQ2NjExOTYwYjNjXkEyXkFqcGdeQXVyMDA4NzMyOA@@._V1_QL75_UX380_CR0,0,380,562_.jpg
Drácula: A Última Viagem do Deméter;Drácula: A Última Viagem do Deméter;2023;6.1;Fantasia;"Baseado no livro ""Drácula"" de Bram Stoker, a história se passa a bordo do navio Demeter, onde uma tripulação condenada enfrenta eventos estranhos e aterrorizantes durante a viagem.";https://m.media-amazon.com/images/M/MV5BMzMxZTJiMjEtOWU1Ny00M2Y2LWIzOTUtMDg0ZjkyMTJhNGNmXkEyXkFqcGdeQXVyNzAwMjU2MTY@._V1_QL75_UY562_CR35,0,380,562_.jpg
The Flash;The Flash;2023;6.8;Ação;Barry Allen usa sua supervelocidade para mudar o passado, mas sua tentativa de salvar sua família cria um mundo sem super-heróis, forçando-o a correr por sua vida para salvar o futuro.;https://m.media-amazon.com/images/M/MV5BODEzODI4YTQtOGY2Ny00NjE0LTg2YjktZDk4OWJlN2I4ZWU1XkEyXkFqcGdeQXVyNzAwMjU2MTY@._V1_QL75_UX380_CR0,0,380,562_.jpg
Ruim Pra Cachorro;Ruim Pra Cachorro;2023;6.3;Animação;Um cachorro abandonado se une a outros vira-latas para se vingar de seu antigo dono.;https://m.media-amazon.com/images/M/MV5BNWE0MWJkN2QtZDgzNS00MmU1LTljZGItYzA1MzEyOWU4Y2NlXkEyXkFqcGdeQXVyMDM2NDM2MQ@@._V1_QL75_UX380_CR0,57,380,562_.jpg
Bottoms;Bottoms;2023;7.6;Comédia;Duas garotas queer e nada populares decidem começar um clube da luta para conseguir fazer sexo antes de suas formaturas.;https://m.media-amazon.com/images/M/MV5BZWZkZjE2OGYtN2RiMS00ZDE5LWFlZGQtYzI1OTNhZDZkYzM3XkEyXkFqcGdeQXVyODk2NDQ3MTA@._V1_QL75_UX380_CR0,0,380,562_.jpg
A Noite das Bruxas;A Noite das Bruxas;2023;6.7;Policial;Na Veneza pós-Segunda Guerra Mundial, Poirot, agora aposentado e vivendo em seu próprio exílio, relutantemente vai a uma sessão espírita. Mas quando um dos convidados é assassinado, cabe ao ex-detetive descobrir mais uma vez o assassino.;https://m.media-amazon.com/images/M/MV5BMGNjMTNjMDEtOGFkMi00N2ZlLTgyMTUtYmRiMjcxMzcyMDc3XkEyXkFqcGdeQXVyNzAwMjU2MTY@._V1_QL75_UY562_CR7,0,380,562_.jpg
Som da Liberdade;Som da Liberdade;2023;7.9;Ação;A incrível história real de um ex-agente governamental que se transforma em um vigilante e que embarca em uma missão perigosa para resgatar centenas de crianças das mãos de traficantes sexuais.;https://m.media-amazon.com/images/M/MV5BMzBkMjc1MGItOGRiYi00YzY0LWE4NDMtYmJlZTQyYTQxYTM0XkEyXkFqcGdeQXVyNzAwMjU2MTY@._V1_QL75_UY562_CR35,0,380,562_.jpg
Besouro Azul;Besouro Azul;2023;6.7;Ação;Jaime Reyes, um adolescente de origem mexicana que encontra um artefato alienígena que lhe dá um exoesqueleto mecanizado e poderes, tornando-o no Besouro Azul.;https://m.media-amazon.com/images/M/MV5BNjliMTY1OWUtOWZjZi00MjQ3LWJmODktY2RkMzNiOWU2M2UxXkEyXkFqcGdeQXVyNzAwMjU2MTY@._V1_QL75_UX380_CR0,0,380,562_.jpg
Gran Turismo - De Jogador a Corredor;Gran Turismo - De Jogador a Corredor;2023;7.4;Ação;A história real da realização de um sonho de um jogador de Gran Turismo, cujas habilidades no jogo o levaram a vencer uma série de competições da Nissan e a se tornar um piloto profissional de corrida. Baseado em uma história real.;https://m.media-amazon.com/images/M/MV5BNGE4YjYwODUtYzUyZC00ODMzLWFjZjUtOTAwZGEwYmI2OTAwXkEyXkFqcGdeQXVyNzAwMjU2MTY@._V1_QL75_UY562_CR35,0,380,562_.jpg
Não Se Preocupe, Querida;Não Se Preocupe, Querida;2022;6.3;Drama;Uma dona de casa dos anos 1950 que mora com o marido em uma comunidade experimental utópica começa a se preocupar com a possibilidade de sua empresa glamorosa estar escondendo segredos perturbadores.;https://m.media-amazon.com/images/M/MV5BMzFkMWUzM2ItZWFjMi00NDY0LTk2MDMtZDhkMDE2MjRlYmZlXkEyXkFqcGdeQXVyNTAzNzgwNTg@._V1_QL75_UX380_CR0,0,380,562_.jpg
Fale Comigo;Fale Comigo;2022;7.4;Terror;Um grupo de amigos descobre uma mão embalsamada que lhes permite conjurar espíritos. Viciado na emoção, um deles vai longe demais e abre a porta para o mundo espiritual.;https://m.media-amazon.com/images/M/MV5BY2I5YzJjODYtNzcxNS00YTU2LWFiN2EtN2VlNmU4MTM1ZmFkXkEyXkFqcGdeQXVyNzAwMjU2MTY@._V1_QL75_UY562_CR2,0,380,562_.jpg
Megatubarão 2;Megatubarão 2;2023;5.2;Ação;A viagem de uma equipe de pesquisa nas profundezas do oceano se transforma em um caos quando uma operação de mineração os força a entrar em uma batalha pela sobrevivência, enfrentando Mega Tubarões e saqueadores ambientais implacáveis.;https://m.media-amazon.com/images/M/MV5BNjAxZTU2ODEtMWNhYy00YjE4LTg2NmUtOTYyNjdiYzQ5Y2U4XkEyXkFqcGdeQXVyNzAwMjU2MTY@._V1_QL75_UX380_CR0,0,380,562_.jpg
Homem-Aranha: Através do Aranhaverso;Homem-Aranha: Através do Aranhaverso;2023;8.7;Animação;Miles Morales, o amigão da vizinhança Homem-Aranha, é transporado através do multiverso para unir forças com Gwen Stacy e um novo time de Pessoas-Aranha para enfrentar um vilão mais poderoso do que qualquer coisa que já tenham encontrado.;https://m.media-amazon.com/images/M/MV5BZDNhMjVmZWItN2M2OS00YzlmLWJlOTUtNjVjMGQ0Nzk2MDkwXkEyXkFqcGdeQXVyMTM1MjYzNjQ5._V1_QL75_UY562_CR39,0,380,562_.jpg
Guardiões da Galáxia Vol. 3;Guardiões da Galáxia Vol. 3;2023;7.9;Ação;Após a perda de Gamora, Peter Quill ainda está chateado e deve reunir os Guardiões da Galáxia em uma missão para defender o universo e proteger Rocket.;https://m.media-amazon.com/images/M/MV5BZmYwODVhZGYtNjc5MC00NmUwLWE0NDUtOWNhMTcwMjQ1NWIxXkEyXkFqcGdeQXVyMTA3MDk2NDg2._V1_QL75_UY562_CR7,0,380,562_.jpg
O Protetor;O Protetor;2014;7.2;Ação;Robert McCall, um homem misterioso que costumava trabalhar como oficial da polícia, motivado pelas injustiças sociais, ajuda vítimas e qualquer pessoa em perigo. A protegida da vez é Teri, jovem explorada sexualmente por mafiosos russos.;https://m.media-amazon.com/images/M/MV5BMmRmZjdiZTUtNDFmYy00NDU4LTlhZmUtYzA5ZTUzOTEzYzc0XkEyXkFqcGdeQXVyNzAwMjU2MTY@._V1_QL75_UY562_CR2,0,380,562_.jpg
O Assassino;O Assassino;2023;7.5;Ação;Um assassino começa a colapsar psicologicamente enquanto começa a desenvolver uma consciência, mesmo enquanto seus clientes continuam a solicitar seus serviços.;https://m.media-amazon.com/images/M/MV5BZGJkMDUwZWQtYTMzMS00NTg5LWE1ZTYtOTVhMDI4NGI1YjMyXkEyXkFqcGdeQXVyODk4OTc3MTY@._V1_QL75_UX380_CR0,0,380,562_.jpg
Dungeons & Dragons: Honra Entre Rebeldes;Dungeons & Dragons: Honra Entre Rebeldes;2023;7.3;Ação;Um ladrão encantador e um grupo de aventureiros improváveis embarcam em uma jornada épica para recuperar uma relíquia perdida, mas as coisas saem perigosamente do controle quando eles se envolvem com as pessoas erradas.;https://m.media-amazon.com/images/M/MV5BNmQ2N2M5ODQtMmVkMS00YTgxLWE4NmQtNzUzMGJjMTk4ZDZjXkEyXkFqcGdeQXVyNzAwMjU2MTY@._V1_QL75_UY562_CR2,0,380,562_.jpg
Vermelho, Branco e Sangue Azul;Vermelho, Branco e Sangue Azul;2023;7.0;Comédia;Quando sua mãe foi eleita presidente dos Estados Unidos, Alex Claremont-Diaz se tornou o novo queridinho da mídia estadunidense. Bonito, carismático e com personalidade forte, Alex tem tudo para seguir os passos de seus pais.;https://m.media-amazon.com/images/M/MV5BOTFhNzc2MGMtZGUwYi00ZWFjLThlOWEtNDdmYTQyZjc3NDQ4XkEyXkFqcGdeQXVyMDM2NDM2MQ@@._V1_QL75_UX380_CR0,0,380,562_.jpg
A Freira;A Freira;2018;5.3;Terror;Um sacerdote e uma noviça são enviados pelo Vaticano a investigar a morte duma joven freira e se confrontar com uma demoníaca força.;https://m.media-amazon.com/images/M/MV5BYzc4ZGIwY2QtNTZjMi00NDhlLThiNjktNmUwOWFmMDk5NWFjXkEyXkFqcGdeQXVyMTA3MDk2NDg2._V1_QL75_UX380_CR0,0,380,562_.jpg
Ferrari;Ferrari;2023;6.9;Biografia;A história de vida do empreendedor italiano de carros esportivos Enzo Ferrari.;https://m.media-amazon.com/images/M/MV5BNDMxMjQ4ZGEtMGU5ZC00ZWU4LWExYzEtZjZhMzFkNGYxZTkwXkEyXkFqcGdeQXVyMTA2MDU0NjM5._V1_QL75_UX380_CR0,7,380,562_.jpg
O Amor Mandou Mensagem;O Amor Mandou Mensagem;2023;5.8;Comédia;Uma jovem tenta aliviar a dor da morte de seu noivo enviando mensagens românticas para seu antigo número de telefone celular, e forma uma conexão com o homem para o qual o número foi transferido.;https://m.media-amazon.com/images/M/MV5BZTI5NGE4MTYtZjdlMy00NjU4LTliMDUtNmViOTlhMjRlZmMzXkEyXkFqcGdeQXVyNzAwMjU2MTY@._V1_QL75_UX380_CR0,4,380,562_.jpg
Boogeyman: Seu Medo é Real;Boogeyman: Seu Medo é Real;2023;6.0;Terror;Ainda se recuperando da trágica morte de sua mãe, uma adolescente e sua irmã mais nova se veem atormentados por uma presença sádica em sua casa e lutam para fazer com que seu pai de luto preste atenção antes que seja tarde demais.;https://m.media-amazon.com/images/M/MV5BZTcxYzA3OTItZDRjNi00NzZmLWFkOWEtNjc1NGJhNzlhOGNkXkEyXkFqcGdeQXVyNzAwMjU2MTY@._V1_QL75_UY562_CR35,0,380,562_.jpg
X: A Marca da Morte;X: A Marca da Morte;2022;6.6;Terror;Em 1979, um grupo de jovens cineastas se propôs a fazer um filme adulto na zona rural do Texas, mas quando seus solitários e idosos anfitriões os pegam em flagrante, o elenco se vê lutando por suas vidas.;https://m.media-amazon.com/images/M/MV5BMjI4NGEwNDctOWY3YS00MWI4LWE3ZGMtNGU2MTVhMWIxMmJkXkEyXkFqcGdeQXVyNzAwMjU2MTY@._V1_QL75_UY562_CR3,0,380,562_.jpg
Vidas Passadas;Vidas Passadas;2023;8.1;Drama;Dois amigos de infância, Nora e Hae Sung, são separados quando a família de Nora emigra da Coreia do Sul. Vinte anos depois, eles se reencontram e exploram o amor e o destino.;https://m.media-amazon.com/images/M/MV5BOTkzYmMxNTItZDAxNC00NGM0LWIyODMtMWYzMzRkMjIyMTE1XkEyXkFqcGdeQXVyMTAyMjQ3NzQ1._V1_QL75_UX380_CR0,0,380,562_.jpg
Casamento Grego 3;Casamento Grego 3;2023;5.4;Comédia;Embarque com os Portokalos em sua viagem rumo à Grécia para um reencontro familiar inesquecível. Será uma jornada hilária e comovente, cheia de reviravoltas e muito amor, como sempre.;https://m.media-amazon.com/images/M/MV5BMDcyZTJmNmEtYzAyMS00MWZmLWFhZmItMmM2MTFiMjQyOTgwXkEyXkFqcGdeQXVyMTM1NjM2ODg1._V1_QL75_UX380_CR0,0,380,562_.jpg
Agente Stone;Agente Stone;2023;5.7;Ação;Uma agente de inteligência de uma sombria agência global que trabalha pela manutenção da paz corre para impedir um hacker de roubar sua arma mais valiosa e perigosa.;https://m.media-amazon.com/images/M/MV5BYjA0NjU4OTQtNzYxYy00NjRiLTk3NDEtYjIwNzE1ZjFkNzFmXkEyXkFqcGdeQXVyMTY4MjE1MDA@._V1_QL75_UX380_CR0,0,380,562_.jpg
Missão: Impossível - Acerto de Contas Parte Um;Missão: Impossível - Acerto de Contas Parte Um;2023;7.9;Ação;Ethan Hunt e seu grupo do IMF embarcam na missão mais arriscada até agora: localizar uma nova arma aterrorizante que ameaça toda a humanidade antes que caia nas mãos erradas.;https://m.media-amazon.com/images/M/MV5BNmQ3NDE0OGQtYWM0ZC00NjkyLTk3YzQtNmYyMWQ5OTVjZTZmXkEyXkFqcGdeQXVyMTI5MDk0MzM3._V1_QL75_UY562_CR21,0,380,562_.jpg
Batman;Batman;2022;7.8;Ação;Sinopse desconhecida.;https://m.media-amazon.com/images/M/MV5BMDdmMTBiNTYtMDIzNi00NGVlLWIzMDYtZTk3MTQ3NGQxZGEwXkEyXkFqcGdeQXVyMzMwOTU5MDk@._V1_QL75_UX380_CR0,0,380,562_.jpg
Asteroid City;Asteroid City;2023;6.6;Comédia;O itinerário de uma convenção Junior Stargazer é espetacularmente interrompido por eventos que mudam o mundo.;https://m.media-amazon.com/images/M/MV5BYWM2M2M2YzQtYTEwMC00Yjk3LWFjOWUtMzE2NzMwZTA5YzRiXkEyXkFqcGdeQXVyNzAwMjU2MTY@._V1_QL75_UY562_CR35,0,380,562_.jpg
Jailer;Jailer;2023;7.2;Ação;Um carcereiro aposentado sai em uma caçada para encontrar os assassinos de seu filho. Mas o caminho o leva a um lugar familiar, embora um pouco mais sombrio. Será que ele conseguirá sair dessa situação complexa com sucesso?;https://m.media-amazon.com/images/M/MV5BNzFkNmZkMTctYjRhMS00ODZiLWFlNjQtZmZmN2IzMDJlNmVkXkEyXkFqcGdeQXVyMTY1MzAyNjU4._V1_QL75_UX380_CR0,15,380,562_.jpg
Hypnotic - Ameaça Invisível;Hypnotic - Ameaça Invisível;2023;5.4;Ação;Enquanto busca incansavelmente por sua filha desaparecida, o detetive Danny Rourke se vê envolvido em uma conspiração criminosa que desafia a realidade.;https://m.media-amazon.com/images/M/MV5BNmNmNWNiMjUtZmYyMC00OWVhLThmMTItNjkxYzU4Yzk2NTdlXkEyXkFqcGdeQXVyMDc5ODIzMw@@._V1_QL75_UX380_CR0,1,380,562_.jpg
Super Mario Bros. - O Filme;Super Mario Bros. - O Filme;2023;7.1;Animação;Um encanador chamado Mario precisa salvar seu irmão Luigi das garras do rei dos Koopas, Bowser. Para isso, ele conta com a ajuda da princesa do Reino dos Cogumelos, Peach, e de seus amigos Toad e Donkey Kong.;https://m.media-amazon.com/images/M/MV5BYjQ5NTRkNDktZWM2Zi00YjI4LTlkYzEtMTYxMTY3ZTRlZTEwXkEyXkFqcGdeQXVyNTk2MDQ0MjA@._V1_QL75_UX380_CR0,4,380,562_.jpg
Elementos;Elementos;2023;7.0;Animação;Em uma cidade onde cidadãos de fogo, água, terra e ar vivem juntos, Ember, uma jovem impetuosa, e Wade, um cara que segue o fluxo da vida, irão descobrir algo elementar: o quanto eles têm em comum.;https://m.media-amazon.com/images/M/MV5BZGM1NTFjYjctNzdmOC00YmJkLWE4ZDktYzA1YjIwMWE2OTE2XkEyXkFqcGdeQXVyMTI5MDk0MzM3._V1_QL75_UY562_CR35,0,380,562_.jpg
Saltburn;Saltburn;2023;6.0;Comédia;A student at Oxford University finds himself drawn into the world of a charming and aristocratic classmate, who invites him to his eccentric family's sprawling estate for a summer never to be forgotten.;https://m.media-amazon.com/images/M/MV5BMmMzMWE4ZTctYzU0My00ZWEyLTg2NWEtOTg5ZDYwMmZmMjkxXkEyXkFqcGdeQXVyMTEyMjM2NDc2._V1_QL75_UX380_CR0,0,380,562_.jpg
As Ruínas;As Ruínas;2008;5.9;Aventura;Um grupo de amigos cujas férias tranquilas no México se tornam horríveis quando eles, junto com outro turista, embarcam em uma escavação arqueológica remota na selva, onde algo maligno vive entre as ruínas.;https://m.media-amazon.com/images/M/MV5BYzQyODAyYzctMjg5YS00NmY3LTljZjctMDNkNGU1MjdmN2RlXkEyXkFqcGdeQXVyNTIzOTk5ODM@._V1_QL75_UX380_CR0,1,380,562_.jpg
Máfia da Dor;Máfia da Dor;2023;7.8;Policial;Sempre lutando para dar uma vida melhor à filha, uma mulher começa a trabalhar em uma startup farmacêutica, mas acaba envolvida em um perigoso esquema de negociatas.;https://m.media-amazon.com/images/M/MV5BNzQwZDBlYjctZWQzNy00MDVlLWI1ZmQtZDA0YTNlZjRhYjU5XkEyXkFqcGdeQXVyNzAwMjU2MTY@._V1_QL75_UX380_CR0,0,380,562_.jpg
Interestelar;Interestelar;2014;8.7;Aventura;Uma equipe de exploradores viaja através de um buraco de minhoca no espaço, na tentativa de garantir a sobrevivência da humanidade.;https://m.media-amazon.com/images/M/MV5BMzg0NzYyNDMtZTkxMS00NmYzLWJkMDAtMmNlYTY1MTRmM2IwXkEyXkFqcGdeQXVyMTYzMDM0NTU@._V1_QL75_UY562_CR5,0,380,562_.jpg
Noite Passada em Soho;Noite Passada em Soho;2021;7.0;Drama;Uma jovem apaixonada por design de moda pode entrar misteriosamente nos anos 60, onde conhece seu ídolo, um cantor deslumbrante. Mas a década de 1960 em Londres não é o que parece, e o tempo parece desmoronar com conseqüências sombrias.;https://m.media-amazon.com/images/M/MV5BYjc5NDNiNjUtNWJmOS00OTZlLWE4ZTgtMDI4Njg5YjFhZmY0XkEyXkFqcGdeQXVyMjcwMzM0OTI@._V1_QL75_UX380_CR0,4,380,562_.jpg
Toc Toc Toc: Ecos do Além;Toc Toc Toc: Ecos do Além;2023;5.9;Terror;Peter, de oito anos, é atormentado por um barulho que vem da parede de seu quarto, que seus pais insistem estar só em sua imaginação. Conforme o medo de Peter se intensifica, ele acredita que seus pais podem estar escondendo um segredo.;https://m.media-amazon.com/images/M/MV5BNDcyZmVjNzgtNjJjNS00ZmE4LTk4NTAtZGFkMjUzZmE2MjY0XkEyXkFqcGdeQXVyNzAwMjU2MTY@._V1_QL75_UY562_CR3,0,380,562_.jpg
O Protetor 2;O Protetor 2;2018;6.7;Ação;Robert McCall é um justiceiro implacável que defende os explorados e os oprimidos, mas até onde ele irá se um deles for alguém que ele ama?;https://m.media-amazon.com/images/M/MV5BZTJjOGI1YTktNTQ1Zi00MTZhLTgxYWMtZWVmOTA4ZTY1YTZmXkEyXkFqcGdeQXVyNzAwMjU2MTY@._V1_QL75_UY562_CR2,0,380,562_.jpg
O Menu;O Menu;2022;7.2;Comédia;Um jovem casal viaja para uma ilha remota para comer em um restaurante exclusivo onde o chef preparou um cardápio farto, com algumas surpresas chocantes.;https://m.media-amazon.com/images/M/MV5BYjEzNjVkYzgtN2VlNy00ZTEzLWFiZWMtMzhjMjM1ZTcwOGExXkEyXkFqcGdeQXVyMjAwNzczNTU@._V1_QL75_UX380_CR0,4,380,562_.jpg
Babilônia;Babilônia;2022;7.1;Comédia;Um conto de ambições exageradas e excessos escandalosos, ele traça a ascensão e queda de múltiplos personagens durante uma era de desenfreada decadência e depravação no início de Hollywood.;https://m.media-amazon.com/images/M/MV5BZDY0OGRhMWItNjY0Ni00Nzg2LWIxZDEtNjk5MTAyOGZlYWUzXkEyXkFqcGdeQXVyMjcwMzM0OTI@._V1_QL75_UX380_CR0,0,380,562_.jpg
Batman: O Cavaleiro das Trevas;Batman: O Cavaleiro das Trevas;2008;9.0;Ação;Quando a ameaça conhecida como O Coringa surge de seu passado, causa estragos e caos nas pessoas de Gotham. O Cavaleiro das Trevas deve aceitar um dos maiores testes para combater a injustiça.;https://m.media-amazon.com/images/M/MV5BM2E1ZjEyYWQtMjgyMy00ZTkwLThkM2QtN2YwM2NmYzAyYjE0XkEyXkFqcGdeQXVyMTAzMDM4MjM0._V1_QL75_UY562_CR21,0,380,562_.jpg
John Wick 4: Baba Yaga;John Wick 4: Baba Yaga;2023;7.8;Ação;John Wick descobre um modo para derrotar a Alta Cúpula. Mas, antes que possa conquistar a sua liberdade, Wick deve enfrentar um novo inimigo com alianças poderosas no mundo todo e forças que transformam velhos amigos em inimigos.;https://m.media-amazon.com/images/M/MV5BZDBiZmNkMGEtZjM4My00YTkwLTk0ZmMtODA5ODY0YWFlNjQ1XkEyXkFqcGdeQXVyNzAwMjU2MTY@._V1_QL75_UX380_CR0,0,380,562_.jpg
Priscilla;Priscilla;2023;6.3;Biografia;When teenage Priscilla Beaulieu meets Elvis Presley, the man who is already a meteoric rock-and-roll superstar becomes someone entirely unexpected in private moments: a thrilling crush, an ally in loneliness, a vulnerable best friend.;https://m.media-amazon.com/images/M/MV5BOTQyZTBiMjAtZTNjZi00ZjU0LWFkMTQtMDE3Nzc1MjVmMTM4XkEyXkFqcGdeQXVyMTM1NjM2ODg1._V1_QL75_UY562_CR1,0,380,562_.jpg
A Chegada;A Chegada;2016;7.9;Drama;Um lingüista trabalha com os militares para se comunicar com formas de vida extraterrestres depois que doze naves espaciais misteriosas aparecem ao redor do mundo.;https://m.media-amazon.com/images/M/MV5BMTczYjJiYzQtZGZjYi00NDU2LWEwMDUtYmVhN2RkMzIxZmJjXkEyXkFqcGdeQXVyMTAyOTE2ODg0._V1_QL75_UX380_CR0,4,380,562_.jpg
O Exorcista do Papa;O Exorcista do Papa;2023;6.1;Terror;Baseado nos arquivos reais do padre Gabriele Amorth, conhecido como o exorcista chefe do Vaticano, que enquanto investigava a posse de um jovem, descobre que durante séculos no Vaticano tentaram a todo custo manter a verdade escondida.;https://m.media-amazon.com/images/M/MV5BZjM0OTU3YTItM2NkMi00MDdkLThmZTQtZjdhZDc5N2NhZDcxXkEyXkFqcGdeQXVyMTYzMTY3OTE3._V1_QL75_UY562_CR35,0,380,562_.jpg
Um Dia e Meio;Um Dia e Meio;2023;5.8;Ação;Em uma tentativa desesperada de se reunir com sua filha, um homem armado invade o centro médico onde sua esposa afastada trabalha e a sequestra.;https://m.media-amazon.com/images/M/MV5BYjc2MjNhNDMtMWI4ZC00ZGNhLTk0ZGUtOGFkOTMwODI2ZTA1XkEyXkFqcGdeQXVyNTM2OTU2NjY@._V1_QL75_UY562_CR91,0,380,562_.jpg
Um Sonho de Liberdade;Um Sonho de Liberdade;1994;9.3;Drama;Dois homens presos se reúnem ao longo de vários anos, encontrando consolo e eventual redenção através de atos de decência comum.;https://m.media-amazon.com/images/M/MV5BNDE3ODcxYzMtY2YzZC00NmNlLWJiNDMtZDViZWM2MzIxZDYwXkEyXkFqcGdeQXVyNjAwNDUxODI@._V1_QL75_UX380_CR0,4,380,562_.jpg
As Escolhas do Amor;As Escolhas do Amor;2023;5.1;Comédia;O namorado atual, o primeiro amor ou o astro do rock... Qual deles Cami deve escolher? Nesta comédia romântica interativa, quem decide é você.;https://m.media-amazon.com/images/M/MV5BYjIwOWYwMjktYzhlZS00ODg0LTgwZDYtYTY1MGQ3NGQ2YjIxXkEyXkFqcGdeQXVyMTQ4MDUxMTk1._V1_QL75_UY562_CR34,0,380,562_.jpg
