title_pt;title_en;year;rating;genre;sinopse;image
A Felicidade Não se Compra;20. A Felicidade Não se Compra;1946;8.6;Drama;Um anjo é enviado dos céus para ajudar um homem de negócios desesperado em sua frustração, e mostra a ele como seria a vida se nunca tivesse existido.;https://m.media-amazon.com/images/M/MV5BMTYyOTAzZDUtMWUzYS00MjY4LTlmMTgtMGI5NzdmMWI5Y2FmXkEyXkFqcGdeQXVyODc0OTEyNDU@._V1_QL75_UY562_CR10,0,380,562_.jpg
Seven: Os Sete Crimes Capitais;22. Seven: Os Sete Crimes Capitais;1995;8.6;Policial;Dois detetives, um novato e um veterano, perseguem um assassino em série que usa os sete pecados capitais como motivos.;https://m.media-amazon.com/images/M/MV5BZDgyZmY5MmItY2I3Ny00NjA4LWFhNmItMGQ4ZGJhZDk5YjU3XkEyXkFqcGdeQXVyMTAzMDM4MjM0._V1_QL75_UY562_CR8,0,380,562_.jpg
O Silêncio dos Inocentes;23. O Silêncio dos Inocentes;1991;8.6;Policial;Uma jovem deve receber a ajuda de um assassino canibal manipulador e preso para ajudar a capturar outro assassino em série, um louco que ataca suas vítimas.;https://m.media-amazon.com/images/M/MV5BMzNkMGM2OWItYmNiYS00YmZhLTg0ZjctOGYxMTE2ODZmNGFiXkEyXkFqcGdeQXVyMTAzMDM4MjM0._V1_QL75_UY562_CR21,0,380,562_.jpg
O Resgate do Soldado Ryan;24. O Resgate do Soldado Ryan;1998;8.6;Drama;Depois de chegar a Normandía, um grupo de soldados precisam encontrar ao unico irmão vivo de tres que morreram na guerra.;https://m.media-amazon.com/images/M/MV5BMTYyMDRiNTQtNjY4NC00MWI1LWIyZTAtYjQ1ZDJjMjdkYzM0XkEyXkFqcGdeQXVyODc0OTEyNDU@._V1_QL75_UY562_CR10,0,380,562_.jpg
À Espera de um Milagre;25. À Espera de um Milagre;1999;8.6;Policial;As vidas dos guardas de corredor da morte são afetadas por um dos detidos: um homem afro-americano acusado pelo assassinato e estupro de uma criança, mas com um presente misterioso.;https://m.media-amazon.com/images/M/MV5BODM5ODQxYWYtYjViYy00ZTYzLWI2YmQtZDMyYzUzZDE5M2M4XkEyXkFqcGdeQXVyMTAzMDM4MjM0._V1_QL75_UY562_CR8,0,380,562_.jpg
Star Wars: Episódio IV - Uma Nova Esperança;26. Star Wars: Episódio IV - Uma Nova Esperança;1977;8.6;Ação;Luke Skywalker une forças com um cabaleiro Jedi, um arrogante piloto é dois dróides para salvar a galaxia enquanto tentam salvar a princesa Leia do misterioso Darth Vader.;https://m.media-amazon.com/images/M/MV5BOTA5NjhiOTAtZWM0ZC00MWNhLThiMzEtZDFkOTk2OTU1ZDJkXkEyXkFqcGdeQXVyMTA4NDI1NTQx._V1_QL75_UX380_CR0,9,380,562_.jpg
O Exterminador do Futuro 2: O Julgamento Final;27. O Exterminador do Futuro 2: O Julgamento Final;1991;8.6;Ação;Um ciborgue, idêntico àquele que não conseguiu matar Sarah Connor, deve agora proteger seu filho adolescente, John Connor, de um ciborgue mais avançado e poderoso.;https://m.media-amazon.com/images/M/MV5BM2U5ODMyNDMtODEzZC00NWM0LWFlMTYtMTkyZTYxNjkzZGRjXkEyXkFqcGdeQXVyMTY4MjE1MDA@._V1_QL75_UY562_CR0,0,380,562_.jpg
De Volta para o Futuro;28. De Volta para o Futuro;1985;8.5;Aventura;Marty McFly viaja para 1955 com a máquina do tempo do cientista Dr. Brown. Ele deve garantir que seus pais se apaixonem, para não arriscar sua própria existência.;https://m.media-amazon.com/images/M/MV5BYzA0YTY4NTctYTg2Mi00MzNhLWJiMmYtNjNhMTk1MTBmZDU3XkEyXkFqcGdeQXVyMTAzMDM4MjM0._V1_QL75_UY562_CR3,0,380,562_.jpg
O Pianista;29. O Pianista;2002;8.5;Biografia;Um musico judeu luta para sobreviver a destruição de Varsóvia durante a segunda guerra mundial.;https://m.media-amazon.com/images/M/MV5BZTQ5MmY1M2EtNGIwNy00N2E2LTg3YTQtYTZkNjlhYTYwMzk5XkEyXkFqcGdeQXVyMTAzMDM4MjM0._V1_QL75_UY562_CR6,0,380,562_.jpg
Psicose;31. Psicose;1960;8.5;Terror;Uma secretária de Phoenix desvia dinheiro de um cliente de sua empresa, foge e vai a um motel remoto gerido por um jovem sob o domínio da mãe.;https://m.media-amazon.com/images/M/MV5BY2QzYTNmN2QtMmM3MC00NWRhLThiOWYtZGJkMTEyMjI3YTkxXkEyXkFqcGdeQXVyMTAyOTE2ODg0._V1_QL75_UY562_CR21,0,380,562_.jpg
O Rei Leão;32. O Rei Leão;1994;8.5;Animação;Um pequeno lion é obrigado por seu tío a fugir de casa e anos depois se da conta da sua identidade e suas responsabilidades.;https://m.media-amazon.com/images/M/MV5BOWMwNzYzMjAtMDUwMS00YzEyLTlmZGQtNzUwNGVlMDkwNTcwXkEyXkFqcGdeQXVyMTAzMDM4MjM0._V1_QL75_UY562_CR25,0,380,562_.jpg
Gladiador;33. Gladiador;2000;8.5;Ação;Um general romano planeja a melhor vingança contra o imperador corrupto que matou sua familia e o fez escravo.;https://m.media-amazon.com/images/M/MV5BZjdiZTI5YTgtZDdiNi00YzhmLTllMWEtZDM1ZjJiMzUyYTc5XkEyXkFqcGdeQXVyMTAyOTE2ODg0._V1_QL75_UY562_CR9,0,380,562_.jpg
O Profissional;34. O Profissional;1994;8.5;Ação;Mathilda, uma menina de 12 anos é levada por Léon, um assassino profissional, depois que sua família é assassinada. Léon e Mathilda formam uma relação incomum, desde que ela se torna sua protegida.;https://m.media-amazon.com/images/M/MV5BZjZhNjU0Y2ItNDhmMC00NzhhLWJlMmMtZDAwMWU5MzU3Zjg3XkEyXkFqcGdeQXVyMTAyOTE2ODg0._V1_QL75_UX380_CR0,4,380,562_.jpg
A Outra História Americana;35. A Outra História Americana;1998;8.5;Policial;Um neonazista tenta evitar que seu irmão mais novo tome o mesmo caminho errado que ele.;https://m.media-amazon.com/images/M/MV5BMDk4OTcwMjQtOWRiOS00OTM0LWIxZDgtOWFmNjdlYTIyMDc2XkEyXkFqcGdeQXVyMTAyOTE2ODg0._V1_QL75_UY562_CR9,0,380,562_.jpg
Os Infiltrados;36. Os Infiltrados;2006;8.5;Policial;Um policial disfarçado e um espião estão tentando se identificar enquanto se infiltram em uma gangue irlandesa no sul de Boston.;https://m.media-amazon.com/images/M/MV5BYTUxMGZhYjUtYWFiMC00NDE2LTkwMzMtM2U0ZjA4ZTg4MjI1XkEyXkFqcGdeQXVyMTAzMDM4MjM0._V1_QL75_UY562_CR9,0,380,562_.jpg
O Grande Truque;37. O Grande Truque;2006;8.5;Drama;Depois de um trágico acidente, dois magos do palco se engajam em uma batalha para criar a ilusão final enquanto sacrificam tudo o que têm para enganar um ao outro.;https://m.media-amazon.com/images/M/MV5BYjljNGQ2OWMtZWI2NC00NGQ5LWE3MTctODg3ZDllNGMxZGZiXkEyXkFqcGdeQXVyMTAzMDM4MjM0._V1_QL75_UY562_CR9,0,380,562_.jpg
Whiplash: Em Busca da Perfeição;38. Whiplash: Em Busca da Perfeição;2014;8.5;Drama;Um jovem e promissor baterista se matricula em um conservatório de música onde seus sonhos são guiados por um instrutor que não pára por nada para perceber o potencial de um aluno.;https://m.media-amazon.com/images/M/MV5BZjZiNTFmNzAtMzFiMi00ZmFmLTkzZDItZWQzNGJkZjk5NGNlXkEyXkFqcGdeQXVyMTAyOTE2ODg0._V1_QL75_UY562_CR6,0,380,562_.jpg
Casablanca;40. Casablanca;1942;8.5;Drama;O proprietário cético de uma boate protege um antigo amor e seu marido dos nazistas no Marrocos.;https://m.media-amazon.com/images/M/MV5BY2IzZGY2YmEtYzljNS00NTM5LTgwMzUtMzM1NjQ4NGI0OTk0XkEyXkFqcGdeQXVyNDYyMDk5MTU@._V1_QL75_UX380_CR0,5,380,562_.jpg
Tempos Modernos;41. Tempos Modernos;1936;8.5;Comédia;Um vagabundo luta para viver na sociedade industrial moderna com a ajuda de uma jovem.;https://m.media-amazon.com/images/M/MV5BYzk1MDkxMWUtMTFmYS00YzA0LWE1YjctZjAxNjUwZTJkNTZkXkEyXkFqcGdeQXVyMDUyOTUyNQ@@._V1_QL75_UX380_CR0,4,380,562_.jpg
Janela Indiscreta;42. Janela Indiscreta;1954;8.5;Mistério;Um fotógrafo em uma cadeira de rodas espiona seus vizinhos pela janela de seu apartamento e está convencido de que um deles cometeu um assassinato.;https://m.media-amazon.com/images/M/MV5BMjE4YjMxZGEtYTBmMi00OTQwLThjN2EtN2Y0ZGJjMmMxOWM4XkEyXkFqcGdeQXVyMTAyOTE2ODg0._V1_QL75_UY562_CR10,0,380,562_.jpg
Alien - O 8º Passageiro;43. Alien - O 8º Passageiro;1979;8.5;Terror;Depois que um navio mercante do espaço percebe uma transmissão desconhecida como uma chamada de socorro, encontra um dos tripulantes atacado por um misterioso modo de vida, e logo percebem que seu ciclo de vida simplesmente começou.;https://m.media-amazon.com/images/M/MV5BNWU3NjhmY2MtODE0Zi00OWNhLWIyN2ItYzJmYTkwZGE1ZTNmXkEyXkFqcGdeQXVyNDQ5MDYzMTk@._V1_QL75_UX380_CR0,1,380,562_.jpg
Apocalypse Now;44. Apocalypse Now;1979;8.4;Drama;Um oficial do exército dos Estados Unidos no Vietnã é encarregado de assassinar a um coronel que acredita ser um deus.;https://m.media-amazon.com/images/M/MV5BYmQyNTA1ZGItNjZjMi00NzFlLWEzMWEtNWMwN2Q2MjJhYzEyXkEyXkFqcGdeQXVyMjUzOTY1NTc@._V1_QL75_UX380_CR0,11,380,562_.jpg
Django Livre;45. Django Livre;2012;8.5;Drama;Com a ajuda de um caçador de recompensas alemão, um escravo libertado sai para resgatar sua esposa de um brutal dono de uma plantação no Mississipi.;https://m.media-amazon.com/images/M/MV5BZGVjNDhlYmQtMzZkMS00ZjkxLTg5Y2MtYzk4ZjI5NzBhMDJmXkEyXkFqcGdeQXVyMTAzMDM4MjM0._V1_QL75_UY562_CR2,0,380,562_.jpg
Amnésia;46. Amnésia;2000;8.4;Mistério;Um homem com perda da memória de curto prazo tenta investigar o homicídio da sua esposa.;https://m.media-amazon.com/images/M/MV5BNWQ5YjRkYTEtZWJmNi00ZjhjLWE2YTgtMDE5ODlkNzdhYTRhXkEyXkFqcGdeQXVyMTAyOTE2ODg0._V1_QL75_UY562_CR6,0,380,562_.jpg
Os Caçadores da Arca Perdida;47. Os Caçadores da Arca Perdida;1981;8.4;Ação;Em 1936 o archeologista e aventurero Indiana Jones é contratado pelo governo dos Estados Unidos para procurar pelo Pacto da Arca, antes que os nazis o tenham primeiro.;https://m.media-amazon.com/images/M/MV5BZWE3OGQwYWMtNjAxMi00YjI4LWI3OWUtZjhkZTgxYjdkZDA4XkEyXkFqcGdeQXVyNzg5MzIyOA@@._V1_QL75_UY562_CR11,0,380,562_.jpg
WALL·E;48. WALL·E;2008;8.4;Animação;Num futuro distante, um pequeno robô faz uma viagem que decidirá o destino da humanidade.;https://m.media-amazon.com/images/M/MV5BMjExMTg5OTU0NF5BMl5BanBnXkFtZTcwMjMxMzMzMw@@._V1_QL75_UX380_CR0,0,380,562_.jpg
Crepúsculo dos Deuses;49. Crepúsculo dos Deuses;1950;8.4;Drama;Um roteirista estabelece uma relação com uma fracasada estrela de cinema que quer voltar aos filmes.;https://m.media-amazon.com/images/M/MV5BMTU0NTkyNzYwMF5BMl5BanBnXkFtZTgwMDU0NDk5MTI@._V1_QL75_UX380_CR0,5,380,562_.jpg
Testemunha de Acusação;50. Testemunha de Acusação;1957;8.4;Policial;Um veterano advogado britânico deve defender seu cliente em um julgamento de assassinato que tem surpresa após surpresa.;https://m.media-amazon.com/images/M/MV5BNjU2ZWI0NGYtYWRiZC00Nzc0LWJmYzgtZWJkNTZhYTg1YzA4XkEyXkFqcGdeQXVyMTAyOTE2ODg0._V1_QL75_UY562_CR7,0,380,562_.jpg
Glória Feita de Sangue;51. Glória Feita de Sangue;1957;8.4;Drama;Depois de se recusar a atacar uma posição inimiga, um general acusa os soldados da covardia e seu comandante deve defendê-los.;https://m.media-amazon.com/images/M/MV5BMDZmMDQzNTctZDBjNy00MjE5LWFiNjktMmRjMWQxNTZlZjlkXkEyXkFqcGdeQXVyMTAyOTE2ODg0._V1_QL75_UY562_CR10,0,380,562_.jpg
Vingadores: Guerra Infinita;52. Vingadores: Guerra Infinita;2018;8.4;Ação;Os Vingadores e seus aliados deverão sacrificar tudo em uma tentativa de derrotar o poderoso Thanos antes que sua explosão de devastação ponha fim ao universo.;https://m.media-amazon.com/images/M/MV5BYTg2YTMyMTQtOGQ3Ni00NDExLTgxYTctOTczYWQ0NDI2MDlmXkEyXkFqcGdeQXVyMTAyOTE2ODg0._V1_QL75_UX380_CR0,4,380,562_.jpg
O Grande Ditador;53. O Grande Ditador;1940;8.4;Comédia;O ditador Hynkel tenta expandir seu império enquanto um pobre barbeiro judeu tenta evitar a perseguição do regime de Hynkel.;https://m.media-amazon.com/images/M/MV5BMmExYWJjNTktNGUyZS00ODhmLTkxYzAtNWIzOGEyMGNiMmUwXkEyXkFqcGdeQXVyNjU0OTQ0OTY@._V1_QL75_UY562_CR0,0,380,562_.jpg
Homem-Aranha: No Aranhaverso;54. Homem-Aranha: No Aranhaverso;2018;8.4;Animação;Um jovem se torna o Homem Aranha de sua realidade, cruzando seu caminho com cinco colegas de outras dimensões para impedir uma ameaça a todas as realidades.;https://m.media-amazon.com/images/M/MV5BMmM0YWUyZjktNGZhOS00Njk1LTk5NWItODE0ZDY2N2I1YzNlXkEyXkFqcGdeQXVyMTAzMDM4MjM0._V1_QL75_UX380_CR0,0,380,562_.jpg
O Iluminado;55. O Iluminado;1980;8.4;Drama;Uma família se dirige a um hotel isolado para o inverno, onde uma presença sinistra influencia a violência do pai, enquanto seu filho psíquico vê presságios horríveis do passado e do futuro.;https://m.media-amazon.com/images/M/MV5BZGExY2QxNjYtZGNkZi00ZThiLWI0MWMtZjEyOGY4MDkyZWUzXkEyXkFqcGdeQXVyMTAzMDM4MjM0._V1_QL75_UY562_CR41,0,380,562_.jpg
Aliens, O Resgate;56. Aliens, O Resgate;1986;8.4;Ação;Ellen Ripley é salvada depois de estar dormida por 57 anos. A luna que o Nostromo visitou foi colonizada mas o contado se perdeu.;https://m.media-amazon.com/images/M/MV5BMDVjMzMyZGEtOGZlNC00MTEwLTk5NTQtMzM0NDU1MDRiNzY4XkEyXkFqcGdeQXVyMTY4MjE1MDA@._V1_QL75_UY562_CR9,0,380,562_.jpg
Batman: O Cavaleiro das Trevas Ressurge;57. Batman: O Cavaleiro das Trevas Ressurge;2012;8.4;Ação;Oito anos depois da anarquia do Coringa, Batman com ajuda da Mulher Gato, tentam salvar Gotham do terrorista Bane.;https://m.media-amazon.com/images/M/MV5BZTY5MzJmMTEtM2I2MC00M2UzLTg1NzktOWMzOTVmNzg2MTIxXkEyXkFqcGdeQXVyMTAyOTE2ODg0._V1_QL75_UY562_CR2,0,380,562_.jpg
Dr. Fantástico;58. Dr. Fantástico;1964;8.4;Comédia;Um general alienado provoca um potencial holocausto nuclear que uma sala de guerra cheia de políticos e generais tenta freneticamente parar.;https://m.media-amazon.com/images/M/MV5BYWM4NDkwNDAtMmZjZC00YTIxLWI0Y2QtOGYyNzdlMTBhMjc5XkEyXkFqcGdeQXVyMTAyOTE2ODg0._V1_QL75_UY562_CR25,0,380,562_.jpg
Vingadores: Ultimato;59. Vingadores: Ultimato;2019;8.4;Ação;Após os eventos devastadores de Vingadores: Guerra Infinita , o universo está em ruínas, e com a ajuda de aliados os Vingadores se reúnem para desfazer as ações de Thanos e restaurar a ordem.;https://m.media-amazon.com/images/M/MV5BNTRkZDU0NDQtYzdkNS00MGMzLTk3MmEtYjgyMWNhYzRkZDc4XkEyXkFqcGdeQXVyMTI5ODk3NDU1._V1_QL75_UY562_CR2,0,380,562_.jpg
Viva: A Vida é uma Festa;60. Viva: A Vida é uma Festa;2017;8.4;Animação;Miguel entra na terra dos mortos para encontrar a seu bisavó quem era um lendário cantante.;https://m.media-amazon.com/images/M/MV5BMDUzZjgzOGUtZmNjOS00NTVlLWI4ZjAtZDg1MTc0NDQyMzU5XkEyXkFqcGdeQXVyMTYzMDM0NTU@._V1_QL75_UY562_CR7,0,380,562_.jpg
Amadeus;61. Amadeus;1984;8.4;Biografia;A vida, sucessos e tribulações de Wolfgang Amadeus Mozart de acordo com Antonio Salieri, um compositor que era contemporâneo, que sempre teve ciúmes dele e que alegou tê-lo matado.;https://m.media-amazon.com/images/M/MV5BNzI2MjM5NDEtNjJmZS00NTJiLTlkY2UtYjJhOGViYmU2ZTIxXkEyXkFqcGdeQXVyMTU3NTI2OTky._V1_QL75_UX380_CR0,4,380,562_.jpg
Bastardos Inglórios;62. Bastardos Inglórios;2009;8.3;Aventura;Na França ocupada pelos nazistas durante a Segunda Guerra Mundial, um plano para assassinar líderes nazistas por parte de um grupo de soldados judeus dos EUA coincide com os planos de vingança da dona de uma sala de cinema.;https://m.media-amazon.com/images/M/MV5BM2M5YzVlMDctZWI2ZC00MjdlLWE1YzctMTQ5OGQ1NGJhZWMyXkEyXkFqcGdeQXVyMTAzMDM4MjM0._V1_QL75_UY562_CR9,0,380,562_.jpg
Coringa;63. Coringa;2019;8.4;Policial;Um comediante falido enlouquece e se torna um assassino psicopata.;https://m.media-amazon.com/images/M/MV5BZTk2YmY1OTMtN2NhYi00OGE4LWEwZWEtZDI4YWEyZWJmMWNmXkEyXkFqcGdeQXVyMTAyOTE2ODg0._V1_QL75_UX380_CR0,0,380,562_.jpg
Beleza Americana;64. Beleza Americana;1999;8.3;Drama;Um pai sexualmente frustrado tem uma crise existencial depois de conhecer a melhor amiga da sua filha.;https://m.media-amazon.com/images/M/MV5BNDk1NWNjMzQtYjEzYy00YzhmLWEzYzgtMGU1NWZiYzljMWNjXkEyXkFqcGdeQXVyODc0OTEyNDU@._V1_QL75_UX380_CR0,2,380,562_.jpg
Coração Valente;65. Coração Valente;1995;8.3;Biografia;Quando sua noiva en segredo é assassinada, William Wallace comença uma revolta contra o rey Eduardo I da Inglaterra.;https://m.media-amazon.com/images/M/MV5BYmVmYWQ1YzMtYzZmNC00MDFmLWIwNGItOTczZTc0ODM1NDJiXkEyXkFqcGdeQXVyNjgxNzM0NDI@._V1_QL75_UY562_CR9,0,380,562_.jpg
Toy Story;66. Toy Story;1995;8.3;Animação;Um brinquedo do cauboi se sente profundamente ameaçado e celoso quando um brinquedo patrulheiro espacial passa a ter mais atençao do garoto.;https://m.media-amazon.com/images/M/MV5BMmRmZjgxZDMtYzc1Ny00ZDc3LWEwNjYtM2MwOTAwMDllYzAwXkEyXkFqcGdeQXVyMTQ5OTc4MTU5._V1_QL75_UY562_CR5,0,380,562_.jpg
Era uma Vez na América;67. Era uma Vez na América;1984;8.3;Policial;Um ex criminal judeu da época da proibição volta a Manhattan onde deberá confrontar seu pasado.;https://m.media-amazon.com/images/M/MV5BMmQzZjdmZDAtOGE2Yy00MmUwLTljYzgtZTMwMjk3ZDdiOWUyXkEyXkFqcGdeQXVyNjc5NjEzNA@@._V1_QL75_UX380_CR0,4,380,562_.jpg
Gênio Indomável;68. Gênio Indomável;1997;8.3;Drama;Will Hunting, um zelador duma Universidade, tem habilidades para a matemática, mas precisa da ajuda dum psicólogo para encontrar seu propósito.;https://m.media-amazon.com/images/M/MV5BOTM0ZmYxMzktNGEwNy00YjUxLWJkZTgtMTI4MTYwZTNlNDQ0XkEyXkFqcGdeQXVyMTAyOTE2ODg0._V1_QL75_UY562_CR7,0,380,562_.jpg
Cantando na Chuva;69. Cantando na Chuva;1952;8.3;Comédia;Uma produtora de cinema e elenco fazem uma transição difíci.;https://m.media-amazon.com/images/M/MV5BMWFmYmQ0YTEtMWExMi00ZjFmLTgyOTQtMDY3M2I2MDViNzgzXkEyXkFqcGdeQXVyMTAyOTE2ODg0._V1_QL75_UY562_CR21,0,380,562_.jpg
Hamilton;70. Hamilton;2020;8.3;Biografia;A vida de um dos maiores fundadores e primeiro secretário do Tesouro da América, Alexander Hamilton.;https://m.media-amazon.com/images/M/MV5BNjViNWRjYWEtZTI0NC00N2E3LTk0NGQtMjY4NTM3OGNkZjY0XkEyXkFqcGdeQXVyMjUxMTY3ODM@._V1_QL75_UX380_CR0,0,380,562_.jpg
Réquiem para um Sonho;71. Réquiem para um Sonho;2000;8.3;Drama;As utopias causadas pelo uso de drogas em quatro pessoas de Coney Island se rompem quando seus vícios as dominam.;https://m.media-amazon.com/images/M/MV5BZTRkYTQyZjktNjcxMC00MjU1LWEwMTktMTViNWMwY2UzZDcwXkEyXkFqcGdeQXVyMTAzMDM4MjM0._V1_QL75_UY562_CR32,0,380,562_.jpg
Toy Story 3;72. Toy Story 3;2010;8.3;Animação;Os brinquedos são dados por erro a uma creche, Woody junto com os outros brinquedos tentaram voltar a casa do Andy.;https://m.media-amazon.com/images/M/MV5BMTgxOTY4Mjc0MF5BMl5BanBnXkFtZTcwNTA4MDQyMw@@._V1_QL75_UY562_CR9,0,380,562_.jpg
Star Wars, Episódio VI: O Retorno do Jedi;73. Star Wars, Episódio VI: O Retorno do Jedi;1983;8.3;Ação;Depois de uma missão ousada para resgatar Han Solo da cabana de Jabba, os rebeldes partem para fazer Endor destruir a mais poderosa Estrela da Morte. Enquanto isso, Luke tenta trazer Darth Vader de volta do lado negro, sem cair na armadilha do Imperador.;https://m.media-amazon.com/images/M/MV5BMzI0NjA4MjEtNzE4Yi00ZWU5LThjNWItMzcyZjJhNDUzMjhlXkEyXkFqcGdeQXVyODc0OTEyNDU@._V1_QL75_UY562_CR7,0,380,562_.jpg
Brilho Eterno de uma Mente sem Lembranças;74. Brilho Eterno de uma Mente sem Lembranças;2004;8.3;Drama;Quando sua relaçao se volta complicada, um casal tenta um procedimento médico para que suas memorias sejam apagadas.;https://m.media-amazon.com/images/M/MV5BNGFlMWFlYjAtMjY5ZC00YzRiLWFiN2EtYTQ3ZjE0MWI0YWUxXkEyXkFqcGdeQXVyMTAyOTE2ODg0._V1_QL75_UY562_CR4,0,380,562_.jpg
2001: Uma Odisséia no Espaço;75. 2001: Uma Odisséia no Espaço;1968;8.3;Aventura;Trás descobrir um misterioso artefato na superfície da Lua, a humanidade tenta encontrar seus origens com a ajuda da inteligença do ordernador HAL 9000.;https://m.media-amazon.com/images/M/MV5BMzliZTc2NjItZTZkOC00MDFlLWEwNzAtYzUyZTkzZjhkNTU0XkEyXkFqcGdeQXVyMTAyOTE2ODg0._V1_QL75_UY562_CR11,0,380,562_.jpg
Pacto de Sangue;76. Pacto de Sangue;1944;8.3;Policial;Um agente de seguros se deixa convencer de um esquema de assassinato e fraude, o que desperta a suspeita de um investigador.;https://m.media-amazon.com/images/M/MV5BY2RlMTdiMmEtMWI2NS00NjdjLWI2ODItNzE1YzQzOTlkNGQ0XkEyXkFqcGdeQXVyMTAyOTE2ODg0._V1_QL75_UY562_CR4,0,380,562_.jpg
Se Meu Apartamento Falasse;77. Se Meu Apartamento Falasse;1960;8.3;Comédia;Um homem tenta subir na empresa permitindo que seus executivos usem seu apartamento para encontros, mas surgem complicações e um romance próprio.;https://m.media-amazon.com/images/M/MV5BNzkwODFjNzItMmMwNi00MTU5LWE2MzktM2M4ZDczZGM1MmViXkEyXkFqcGdeQXVyNDY2MTk1ODk@._V1_QL75_UX380_CR0,19,380,562_.jpg
Lawrence da Arábia;78. Lawrence da Arábia;1962;8.3;Aventura;A história de T. E. Lawrence, o oficial inglês que conseguiu unir e liderar várias tribos árabes, durante a Primeira Guerra Mundial para lutar contra os turcos.;https://m.media-amazon.com/images/M/MV5BZDIyYzBjZWEtZTc3YS00MDIxLTgwODctOGFmZjZhZDQ4ODA3XkEyXkFqcGdeQXVyMTY4MjE1MDA@._V1_QL75_UY562_CR3,0,380,562_.jpg
Cães de Aluguel;79. Cães de Aluguel;1992;8.3;Policial;Quando um simples roubo de jóias dá errado, os criminosos sobreviventes começam a suspeitar que um deles é um informante da polícia.;https://m.media-amazon.com/images/M/MV5BOWQwZGMwMWUtYzUwNy00NDk3LTk5YjktMGQ1M2E0NmI5M2MyXkEyXkFqcGdeQXVyMTAzMDM4MjM0._V1_QL75_UY562_CR9,0,380,562_.jpg
Intriga Internacional;80. Intriga Internacional;1959;8.3;Ação;Um executivo de publicidade de Nova Iorque tem que fugir quando é confundido por um agente de governo.;https://m.media-amazon.com/images/M/MV5BMmNjMDNkN2ItMTg5Ni00ZTE3LWJhNjMtYzg1ZjFiMzZjMzg2XkEyXkFqcGdeQXVyMTAyOTE2ODg0._V1_QL75_UY562_CR30,0,380,562_.jpg
Cidadão Kane;81. Cidadão Kane;1941;8.3;Drama;Após a morte de um magnata na indústria editorial, jornalistas correm para descobrir o significado da última palavra que ele pronunciou.;https://m.media-amazon.com/images/M/MV5BMjhjYzBiMzItZjgxNy00MGRmLTgyYjEtMDE1MjBiMDY4M2EwXkEyXkFqcGdeQXVyMTAyOTE2ODg0._V1_QL75_UX380_CR0,4,380,562_.jpg
Um Corpo que Cai;82. Um Corpo que Cai;1958;8.3;Mistério;Um ex-policial luta contra seus demônios enquanto está obcecado por uma mulher bonita.;https://m.media-amazon.com/images/M/MV5BMjA5YWI5YzktM2JmNS00OTJiLTg4ODctYjE2YTgwMWEwNGFiXkEyXkFqcGdeQXVyODc0OTEyNDU@._V1_QL75_UY562_CR28,0,380,562_.jpg
Scarface;83. Scarface;1983;8.3;Policial;Em Miamo em 1980, um imigrante cubano toma o control dum cartel de drogas.;https://m.media-amazon.com/images/M/MV5BOTlmOTAzOTAtM2Y5OC00NWMwLWI2ZWMtODlmMTNmNTZhNzJjXkEyXkFqcGdeQXVyMTAyOTE2ODg0._V1_QL75_UX380_CR0,4,380,562_.jpg
O Sol é para Todos;84. O Sol é para Todos;1962;8.3;Policial;Atticus Finch, um advogado no sul da era da Depressão, defende um homem negro contra uma acusação de estupro imerecida, e seus filhos contra o preconceito.;https://m.media-amazon.com/images/M/MV5BNmVmYzcwNzMtMWM1NS00MWIyLThlMDEtYzUwZDgzODE1NmE2XkEyXkFqcGdeQXVyNzkwMjQ5NzM@._V1_QL75_UX380_CR0,9,380,562_.jpg
Golpe de Mestre;85. Golpe de Mestre;1973;8.3;Comédia;Dois golpistas se reúnem para obter o melhor golpe.;https://m.media-amazon.com/images/M/MV5BNGU3NjQ4YTMtZGJjOS00YTQ3LThmNmItMTI5MDE2ODI3NzY3XkEyXkFqcGdeQXVyMjUzOTY1NTc@._V1_QL75_UX380_CR0,10,380,562_.jpg
Laranja Mecânica;86. Laranja Mecânica;1971;8.3;Policial;No futuro, um jovem líder de gang é levado para prisão e decide ser voluntário em um experimento, mas os resultados não são os esperados.;https://m.media-amazon.com/images/M/MV5BYTE0ZGFkZDMtZTA5Ny00NjI3LWJmNTgtMzRhMDE2Zjk3YWI2XkEyXkFqcGdeQXVyNzg5MzIyOA@@._V1_QL75_UY562_CR9,0,380,562_.jpg
Nascido para Matar;87. Nascido para Matar;1987;8.3;Drama;Um marinho dos Estados Unidos nota os deshumanizantes efeitos da guerra do Vietnã em seus colegas.;https://m.media-amazon.com/images/M/MV5BYjFjZWNiNTQtMWRmYy00NmMxLWFkOGMtYjJiMmIyYmE3YmQwXkEyXkFqcGdeQXVyMTAyOTE2ODg0._V1_QL75_UX380_CR0,22,380,562_.jpg
Fogo Contra Fogo;88. Fogo Contra Fogo;1995;8.3;Ação;Um grupo de profissionais roubando bancos sospeitam que a polícia está tráis deles quando deixam uma pista no seu último roubo.;https://m.media-amazon.com/images/M/MV5BYjZjNTJlZGUtZTE1Ny00ZDc4LTgwYjUtMzk0NDgwYzZjYTk1XkEyXkFqcGdeQXVyNjU0OTQ0OTY@._V1_QL75_UY562_CR6,0,380,562_.jpg
Julgamento em Nuremberg;89. Julgamento em Nuremberg;1961;8.3;Drama;Em 1948, um tribunal dos Estados Unidos na Alemanha ocupada julga quatro nazistas por crimes de guerra.;https://m.media-amazon.com/images/M/MV5BNDc2ODQ5NTE2MV5BMl5BanBnXkFtZTcwODExMjUyNA@@._V1_QL75_UX380_CR0,4,380,562_.jpg
Up: Altas Aventuras;90. Up: Altas Aventuras;2009;8.3;Animação;Carl Fredricksen, de 78 anos, viaja a Paraside Falls com sua casa e inadvertidamente leva um menino com ele.;https://m.media-amazon.com/images/M/MV5BYjBkM2RjMzItM2M3Ni00N2NjLWE3NzMtMGY4MzE4MDAzMTRiXkEyXkFqcGdeQXVyNDUzOTQ5MjY@._V1_QL75_UX380_CR0,1,380,562_.jpg
O Garoto;91. O Garoto;1921;8.2;Comédia;Um mendigo cuida de uma criança abandonada, mas os eventos ameaçam esse relacionamento.;https://m.media-amazon.com/images/M/MV5BZjhhMThhNDItNTY2MC00MmU1LTliNDEtNDdhZjdlNTY5ZDQ1XkEyXkFqcGdeQXVyNjc1NTYyMjg@._V1_QL75_UX380_CR0,5,380,562_.jpg
Indiana Jones e a Última Cruzada;92. Indiana Jones e a Última Cruzada;1989;8.2;Ação;"Em 1938, depois que seu pai, o professor Henry Jones, desaparece enquanto persegue o Santo Graal, o professor Henry ""Indiana"" Jones, Jr. se encontra contra os nazistas de Adolf Hitler.";https://m.media-amazon.com/images/M/MV5BNmU4ZDMzMDEtMWIwZS00ZGE5LWJmODUtYjUxM2VjZDcwMGE3XkEyXkFqcGdeQXVyMTAyOTE2ODg0._V1_QL75_UY562_CR11,0,380,562_.jpg
Snatch: Porcos e Diamantes;93. Snatch: Porcos e Diamantes;2000;8.2;Comédia;Segue a luta de criminais tráis um diamante como nenhum outro nu mundo.;https://m.media-amazon.com/images/M/MV5BNjYzMGNhYmItYjBhMi00YmMxLWExYTQtNmNjOWQ3MWE5YTI1XkEyXkFqcGdeQXVyMTAyOTE2ODg0._V1_QL75_UY562_CR9,0,380,562_.jpg
Duro de Matar;95. Duro de Matar;1988;8.2;Ação;John McClane, agente do departamento de polícia de Nova York, tenta salvar sua esposa, Holly Gennaro, e outras pessoas que o terrorista alemão Hans Gruber tomou como reféns durante a festa de Natal no Nakatomi Plaza, em Los Angeles.;https://m.media-amazon.com/images/M/MV5BNzU4MWNjYzQtMDEzNS00ZDA1LWI1YTQtM2ZlMzY2MTg1MmM3XkEyXkFqcGdeQXVyMTAyOTE2ODg0._V1_QL75_UY562_CR10,0,380,562_.jpg
Los Angeles: Cidade Proibida;96. Los Angeles: Cidade Proibida;1997;8.2;Policial;A corrupção cresce em Los Angeles nos anos 50. Três policiais estão investigando uma série de assassinatos com sua própria marca de justiça.;https://m.media-amazon.com/images/M/MV5BMDQ2YzEyZGItYWRhOS00MjBmLTkzMDUtMTdjYzkyMmQxZTJlXkEyXkFqcGdeQXVyNjU0OTQ0OTY@._V1_QL75_UY562_CR2,0,380,562_.jpg
1917;97. 1917;2019;8.2;Ação;Trama desconhecida. O filme será de 1917 durante a primeira guerra mundial.;https://m.media-amazon.com/images/M/MV5BZWRjZDc3OTctN2JlNi00MmQwLTljZGQtZjc0NjdhZjI2OGUzXkEyXkFqcGdeQXVyMTA3MDk2NDg2._V1_QL75_UX380_CR0,20,380,562_.jpg
