title_pt;title_en;year;rating;genre;sinopse;image
A Malvada;98. A Malvada;1950;8.2;Drama;Uma ingênua se insinua na vida de uma atriz de teatro, e de seu círculo de amigas de teatro.;https://m.media-amazon.com/images/M/MV5BYmE1M2Y3NTYtYTI0Mi00N2JlLTkzMzItOTY1MTlhNWNkMDgzXkEyXkFqcGdeQXVyMTUzMDUzNTI3._V1_QL75_UX380_CR0,7,380,562_.jpg
Taxi Driver: Motorista de Táxi;99. Taxi Driver: Motorista de Táxi;1976;8.2;Policial;Um veterano de guerra com problemas mentais trabalha de noite como condutor de táxi na cidade de Nova Iorque, onde experimenta violência e perigo ao tentar ajudar um trabalhador e uma prostituta.;https://m.media-amazon.com/images/M/MV5BM2M1MmVhNDgtNmI0YS00ZDNmLTkyNjctNTJiYTQ2N2NmYzc2XkEyXkFqcGdeQXVyNzkwMjQ5NzM@._V1_QL75_UX380_CR0,7,380,562_.jpg
Meu Pai;100. Meu Pai;2020;8.2;Drama;Um homem recusa toda a ajuda de sua filha à medida que envelhece. Ao tentar entender as mudanças nas circunstâncias, ele começa a duvidar dos seus entes queridos, da sua própria mente e até mesmo da estrutura de sua realidade.;https://m.media-amazon.com/images/M/MV5BODMwNmRiYjYtYmMyYi00MDQ4LWJkOWItYTY2MGVlNDBkYzA0XkEyXkFqcGdeQXVyMjcwMzM0OTI@._V1_QL75_UY562_CR91,0,380,562_.jpg
Quanto Mais Quente Melhor;101. Quanto Mais Quente Melhor;1959;8.2;Comédia;Dos músicos son testigos de un crimen y se dan a la fuga disfrazados de mujeres en una banda femenina, pero las cosas se complican.;https://m.media-amazon.com/images/M/MV5BNzAyOGIxYjAtMGY2NC00ZTgyLWIwMWEtYzY0OWQ4NDFjOTc5XkEyXkFqcGdeQXVyNjU0OTQ0OTY@._V1_QL75_UX380_CR0,13,380,562_.jpg
Batman Begins;102. Batman Begins;2005;8.2;Ação;Depois do treinamento, Batman comença a luta contra o crime e corrupçao en Gotham.;https://m.media-amazon.com/images/M/MV5BOTY4YjI2N2MtYmFlMC00ZjcyLTg3YjEtMDQyM2ZjYzQ5YWFkXkEyXkFqcGdeQXVyMTQxNzMzNDI@._V1_QL75_UY562_CR0,0,380,562_.jpg
Green Book: O Guia;103. Green Book: O Guia;2018;8.2;Biografia;Um valentão ítalo-americano se torna o motorista de um pianista afro-americano em um tour no sul dos Estados Unidos nos anos sessenta.;https://m.media-amazon.com/images/M/MV5BZjIwZTExNGMtM2IyOS00NDhjLThjNGYtMGE1NzQxNWU5NzYxXkEyXkFqcGdeQXVyMTAzMDM4MjM0._V1_QL75_UX380_CR0,56,380,562_.jpg
O Tesouro da Sierra Madre;105. O Tesouro da Sierra Madre;1947;8.2;Aventura;Dois americanos em busca de trabalho no México convencem um homem a ajudá-los a extrair ouro nas montanhas da Serra Madre.;https://m.media-amazon.com/images/M/MV5BOTJlZWMxYzEtMjlkMS00ODE0LThlM2ItMDI3NGQ2YjhmMzkxXkEyXkFqcGdeQXVyMDI2NDg0NQ@@._V1_QL75_UX380_CR0,5,380,562_.jpg
Ilha do Medo;106. Ilha do Medo;2010;8.2;Mistério;Em 1945, um policial federal dos Estados Unidos investiga o desaparecimento de um assassino que escapou de um hospital psiquiátrico.;https://m.media-amazon.com/images/M/MV5BMjI5ZDk0YWUtYzk0Mi00MWMyLTg5ZDUtNzc0NDNmOTI5NzY2XkEyXkFqcGdeQXVyMTAyOTE2ODg0._V1_QL75_UY562_CR10,0,380,562_.jpg
Cassino;107. Cassino;1995;8.2;Policial;Uma história de ganância, dinheiro e assassinato acontece entre dois melhores amigos: um mafioso e um executivo de cassino, que competem uns com os outros por um império de jogo e pelo amor de uma socialite.;https://m.media-amazon.com/images/M/MV5BOThkYjU3OWQtN2Y3OC00ZDk1LWI1MDQtZTkxZjZiZGU5N2Q0XkEyXkFqcGdeQXVyMTA3MzQ4MTc0._V1_QL75_UX380_CR0,4,380,562_.jpg
O Show de Truman: O Show da Vida;108. O Show de Truman: O Show da Vida;1998;8.2;Comédia;Um vendedor de seguros descobre que sua vida é um programa de televisão.;https://m.media-amazon.com/images/M/MV5BZmFjMjA4YjYtOTExYy00ZDM1LWIwZmYtZWY5Yjg4ODNkNjRiXkEyXkFqcGdeQXVyMTAyOTE2ODg0._V1_QL75_UY562_CR8,0,380,562_.jpg
Sangue Negro;109. Sangue Negro;2007;8.2;Drama;Uma história sobre familia, religião, ódio e loucura, centrada na vida de um explorador de petróleo nos primeiros anos do negócio.;https://m.media-amazon.com/images/M/MV5BMjAxODQ4MDU5NV5BMl5BanBnXkFtZTcwMDU4MjU1MQ@@._V1_QL75_UX380_CR0,0,380,562_.jpg
Os Imperdoáveis;110. Os Imperdoáveis;1992;8.2;Drama;O atirador do Velho Oeste, William Munny, relutantemente aceita um último trabalho com a ajuda de seu antigo amigo e um jovem.;https://m.media-amazon.com/images/M/MV5BODM3YWY4NmQtN2Y3Ni00OTg0LWFhZGQtZWE3ZWY4MTJlOWU4XkEyXkFqcGdeQXVyNjU0OTQ0OTY@._V1_QL75_UX380_CR0,4,380,562_.jpg
Uma Mente Brilhante;111. Uma Mente Brilhante;2001;8.2;Biografia;A vida do brilhante mas insociável matemático John Nash muda quando ele aceita um trabalho secreto em criptografia.;https://m.media-amazon.com/images/M/MV5BMzcwYWFkYzktZjAzNC00OGY1LWI4YTgtNzc5MzVjMDVmNjY0XkEyXkFqcGdeQXVyMTQxNzMzNDI@._V1_QL75_UX380_CR0,1,380,562_.jpg
O Sexto Sentido;112. O Sexto Sentido;1999;8.2;Drama;Um menino que consegue se comunicar com espíritos encontra ajuda de um psicólogo.;https://m.media-amazon.com/images/M/MV5BZjNhMDVmNWEtM2NmNC00ZDQxLTgxOTctZjU2NDE2OWZkZmQzXkEyXkFqcGdeQXVyMTU3NTI2OTky._V1_QL75_UX380_CR0,4,380,562_.jpg
Jurassic Park;113. Jurassic Park;1993;8.2;Ação;Durante um tour o parque sofre falta de energia eléctrica o que faz que um dinossauro clonado saia do seu claustro.;https://m.media-amazon.com/images/M/MV5BZTY4NjIxYTctZDcwNS00MjNmLTlhYTQtMzI3OWYyNzQwMjdkXkEyXkFqcGdeQXVyNTk2MDQ0MjA@._V1_QL75_UX380_CR0,4,380,562_.jpg
Fugindo do Inferno;114. Fugindo do Inferno;1963;8.2;Aventura;Prisioneiros de guerra aliados planejam uma fuga maciça de um campo alemão durante a Segunda Guerra Mundial.;https://m.media-amazon.com/images/M/MV5BNzA2NmYxMWUtNzBlMC00MWM2LTkwNmQtYTFlZjQwODNhOWE0XkEyXkFqcGdeQXVyNTIzOTk5ODM@._V1_QL75_UX380_CR0,16,380,562_.jpg
Monty Python em Busca do Cálice Sagrado;115. Monty Python em Busca do Cálice Sagrado;1975;8.2;Aventura;O Rei Arthur e seus Cavaleiros da Távola Redonda embarcam em uma busca surrealista e de baixo orçamento pelo Santo Graal, encontrando múltiplos obstáculos estúpidos.;https://m.media-amazon.com/images/M/MV5BYWZmNzcxZGQtYjg0OS00Yzk5LTkxZTEtOGNmMmMxOThhN2Q4XkEyXkFqcGdeQXVyMTAyOTE2ODg0._V1_QL75_UY562_CR8,0,380,562_.jpg
Homem-Aranha: Sem Volta para Casa;116. Homem-Aranha: Sem Volta para Casa;2021;8.2;Ação;Com a identidade do Homem-Aranha revelada, Peter pede ajuda ao Doutor Strange. Quando um feitiço corre mal, inimigos perigosos de outros mundos começam a aparecer, forçando Peter a descobrir o que realmente significa ser o Homem-Aranha.;https://m.media-amazon.com/images/M/MV5BMTJkYzI0M2QtMDhiOC00MDczLTgyYzQtZmUzMmUxNmVkN2VhXkEyXkFqcGdeQXVyMTA3MDk2NDg2._V1_QL75_UX380_CR0,0,380,562_.jpg
O Enigma de Outro Mundo;117. O Enigma de Outro Mundo;1982;8.2;Terror;Um team de investigação na Antartica é perseguido por extraterrestres.;https://m.media-amazon.com/images/M/MV5BNTliMTUwYWEtYWEyMS00OGY5LTk5MDQtZmNmNWUzZTc3M2RlXkEyXkFqcGdeQXVyMTAyOTE2ODg0._V1_QL75_UY562_CR29,0,380,562_.jpg
Onde os Fracos Não Têm Vez;118. Onde os Fracos Não Têm Vez;2007;8.2;Policial;Violência e caos surgem quando um caçador se depara com uma negociação de drogas que deu errado e mais de dois milhões de dólares perto do Rio Grande.;https://m.media-amazon.com/images/M/MV5BNmU2MTk4NjItNmE5Yi00NWZjLWIzNzUtMDM2Y2ZhY2U2NGU5XkEyXkFqcGdeQXVyODc0OTEyNDU@._V1_QL75_UY562_CR5,0,380,562_.jpg
Kill Bill: Volume 1;119. Kill Bill: Volume 1;2003;8.2;Ação;Depois de despertar de um coma de quatro anos, uma antiga assassina busca vingança contra o grupo de assassinos que a traiu.;https://m.media-amazon.com/images/M/MV5BMThlMGE3ODYtOGM4Mi00ZDc0LWE4ZDItMmU2Y2E0MGZjZTAzXkEyXkFqcGdeQXVyNzkwMjQ5NzM@._V1_QL75_UX380_CR0,4,380,562_.jpg
O Homem Elefante;120. O Homem Elefante;1980;8.2;Biografia;Um famoso médico estuda a um jovem com a cara deformada, conhecido como Homem Elefante, ele se da conta que o homem é inteligente e de bom coração.;https://m.media-amazon.com/images/M/MV5BYjExMjc2NDMtZjQ1MC00Yjc1LWEwYjMtZDNmMTg1NWY4YjdjXkEyXkFqcGdeQXVyMTAyOTE2ODg0._V1_QL75_UY562_CR8,0,380,562_.jpg
...E o Vento Levou;121. ...E o Vento Levou;1939;8.2;Drama;Uma mulher manipuladora e uma truhan embarcam em um romance turbulento durante a Guerra Civil Americana e o período da Reconstrução.;https://m.media-amazon.com/images/M/MV5BYjUyZWZkM2UtMzYxYy00ZmQ3LWFmZTQtOGE2YjBkNjA3YWZlXkEyXkFqcGdeQXVyNzkwMjQ5NzM@._V1_QL75_UX380_CR0,10,380,562_.jpg
Disque M para Matar;122. Disque M para Matar;1954;8.2;Policial;Um ex-tenista decide matar a esposa para herdar o dinheiro dela e se vingar de um caso que ela havia tido. A fim de se livrar de culpas, usa um antigo colega de faculdade. Mas as coisas não vão correr como estava planeado.;https://m.media-amazon.com/images/M/MV5BZDExY2U3NTgtNzUxZS00MjgwLTgzZmQtM2JlYWVjYjMyZmY4XkEyXkFqcGdeQXVyMTAyOTE2ODg0._V1_QL75_UY562_CR11,0,380,562_.jpg
Procurando Nemo;123. Procurando Nemo;2003;8.2;Animação;Quando seu filho é capturado, um peixe-palhaço tímido embarca em uma viagem para trazê-lo para casa.;https://m.media-amazon.com/images/M/MV5BOGZkYmMwMGMtMDA2Zi00MmUzLTgyODctOTg1Yjg4NTI3NDFjXkEyXkFqcGdeQXVyODc0OTEyNDU@._V1_QL75_UY562_CR11,0,380,562_.jpg
Chinatown;124. Chinatown;1974;8.2;Drama;Um detetive particular contratado para desmascarar um adúltero é pego em uma teia de fraude, corrupção e assassinato.;https://m.media-amazon.com/images/M/MV5BMjJkMDZhYzItZTFhMi00ZGI4LThlNTAtZDNlYmEwNjFkNDYzXkEyXkFqcGdeQXVyMjUzOTY1NTc@._V1_QL75_UX380_CR0,7,380,562_.jpg
V de Vingança;125. V de Vingança;2005;8.2;Ação;Em um futuro da tirania britânica, um lutador clandestino conhecido como V trama um plano para derrubá-la com a ajuda de uma jovem mulher.;https://m.media-amazon.com/images/M/MV5BOTI5ODc3NzExNV5BMl5BanBnXkFtZTcwNzYxNzQzMw@@._V1_QL75_UX380_CR0,0,380,562_.jpg
Touro Indomável;126. Touro Indomável;1980;8.1;Biografia;A vida do boxeador Jake LaMotta, que vê como a violência e temperamento que o levam ao topo do ringue, destroem sua vida fora dele.;https://m.media-amazon.com/images/M/MV5BOGVkMzI0MGQtOTk4ZS00YjNjLWI1OWItODYyY2ZhZDhlNjE5XkEyXkFqcGdeQXVyMTAyOTE2ODg0._V1_QL75_UY562_CR8,0,380,562_.jpg
A Ponte do Rio Kwai;127. A Ponte do Rio Kwai;1957;8.1;Aventura;Depois de resolver suas diferenças com um japonês, o comandante do campo, um coronel britânico, coopera para supervisionar a construção de uma ponte ferroviária.;https://m.media-amazon.com/images/M/MV5BOGY5NmNlMmQtYzRlYy00NGQ5LWFkYjYtNzExZmQyMTg0ZDA0XkEyXkFqcGdeQXVyNDIzMzcwNjc@._V1_QL75_UX380_CR0,13,380,562_.jpg
Jogos, Trapaças e Dois Canos Fumegantes;128. Jogos, Trapaças e Dois Canos Fumegantes;1998;8.1;Ação;Um jogo de cartas em Londres desencadeia um confronto entre quatro amigos, plantadores de maconha, agiotas e cobradores de dívidas em uma série de eventos curiosos, tudo por algo de maria, dinheiro e duas pistolas antigas.;https://m.media-amazon.com/images/M/MV5BMTAyN2JmZmEtNjAyMy00NzYwLThmY2MtYWQ3OGNhNjExMmM4XkEyXkFqcGdeQXVyNDk3NzU2MTQ@._V1_QL75_UX380_CR0,4,380,562_.jpg
Divertida Mente;129. Divertida Mente;2015;8.1;Animação;Quando o jovem Riley se muda á San Francisco deberá lidiar com suas emoções.;https://m.media-amazon.com/images/M/MV5BOGQzMjI5MTctNzUwMC00OTJmLWJhYzUtNWRlYmQ3YmMzMWU1XkEyXkFqcGdeQXVyMTAyOTE2ODg0._V1_QL75_UY562_CR7,0,380,562_.jpg
Os Suspeitos;130. Os Suspeitos;2013;8.1;Policial;Quando a filha de Keller Dover e sua amiguinha desaparecem, ele decide investigar o caso por sua conta enquanto a polícia segue múltiplas pistas e a pressão para resolver o caso aumenta.;https://m.media-amazon.com/images/M/MV5BOWE2OTMyZDctMjVlOC00NDcwLWE5ZGQtNmZjYmZhZmIwZDE5XkEyXkFqcGdeQXVyMTAyOTE2ODg0._V1_QL75_UY562_CR2,0,380,562_.jpg
Klaus;131. Klaus;2019;8.2;Animação;Um simples ato de bondade sempre provoca outro, mesmo em um lugar gelado e distante. Quando o novo carteiro de Smeerensburg faz amizade com o fabricante de brinquedos Klaus, seus presentes derreteram uma antiga inimizade.;https://m.media-amazon.com/images/M/MV5BMWYwOThjM2ItZGYxNy00NTQwLWFlZWEtM2MzM2Q5MmY3NDU5XkEyXkFqcGdeQXVyMTkxNjUyNQ@@._V1_QL75_UX380_CR0,0,380,562_.jpg
Guerreiro;132. Guerreiro;2011;8.1;Ação;O filho pequeno de um exboxer alcoólatra volta para casa, onde seu pai o treina para um torneio de artes marciais mistas.;https://m.media-amazon.com/images/M/MV5BZDI1YzliOTEtYzgxYi00NDJhLTlmYTUtY2FjOWZmMmI2ODZhXkEyXkFqcGdeQXVyMTAyOTE2ODg0._V1_QL75_UY562_CR11,0,380,562_.jpg
Três Anúncios para um Crime;133. Três Anúncios para um Crime;2017;8.1;Comédia;Uma mãe desafia pessoalmente as autoridades locais para resolver o assassinato de sua filha.;https://m.media-amazon.com/images/M/MV5BZjhiNGQwODMtMTA0ZS00OWQwLWFjNGEtNTE0MjY4NmY5ZDZhXkEyXkFqcGdeQXVyMTAzMDM4MjM0._V1_QL75_UY562_CR2,0,380,562_.jpg
Trainspotting: Sem Limites;134. Trainspotting: Sem Limites;1996;8.1;Drama;Renton, profundamente imerso no mundo das drogas em Edimburgo, tenta sair do ambiente apesar da má influência dos amigos.;https://m.media-amazon.com/images/M/MV5BZDY5NTdjOTYtNTI2Yy00ODBlLWJiNmEtMTQwMTg1MTRhODg4XkEyXkFqcGdeQXVyMTAyOTE2ODg0._V1_QL75_UY562_CR9,0,380,562_.jpg
Ser ou Não Ser;135. Ser ou Não Ser;1942;8.2;Comédia;Durante a ocupação nazista da Polônia, uma trupe de atuação se envolve nos esforços de um soldado polonês para rastrear um espião alemão.;https://m.media-amazon.com/images/M/MV5BMGY3ZDgzY2MtNTllNi00ZWI1LTk1NTUtNWEzN2Q4YTA1ZGZiXkEyXkFqcGdeQXVyNzI1NzMxNzM@._V1_QL75_UY562_CR5,0,380,562_.jpg
Fargo: Uma Comédia de Erros;136. Fargo: Uma Comédia de Erros;1996;8.1;Policial;O crime de Jerry Lundegaard se desfaz devido à falta de sorte dele e de seus colegas e ao persistente trabalho polícia.;https://m.media-amazon.com/images/M/MV5BNDJiZDgyZjctYmRjMS00ZjdkLTkwMTEtNGU1NDg3NDQ0Yzk1XkEyXkFqcGdeQXVyNzkwMjQ5NzM@._V1_QL75_UY562_CR1,0,380,562_.jpg
A Mulher Faz o Homem;137. A Mulher Faz o Homem;1939;8.1;Comédia;Um homem ingênuo é eleito para ocupar uma vaga no Senado dos Estados Unidos. Seus planos colidem rapidamente com a corrupção política, mas ele não desiste.;https://m.media-amazon.com/images/M/MV5BZTYwYjYxYzgtMDE1Ni00NzU4LWJlMTEtODQ5YmJmMGJhZjI5L2ltYWdlXkEyXkFqcGdeQXVyMDI2NDg0NQ@@._V1_QL75_UX380_CR0,6,380,562_.jpg
Barry Lyndon;138. Barry Lyndon;1975;8.1;Aventura;Um irlandês conquista o coração de uma viúva rica e assume a posição aristocrática de seu falecido marido na Inglaterra do século XVIII.;https://m.media-amazon.com/images/M/MV5BNmY0MWY2NDctZDdmMi00MjA1LTk0ZTQtZDMyZTQ1NTNlYzVjXkEyXkFqcGdeQXVyMjUzOTY1NTc@._V1_QL75_UX380_CR0,8,380,562_.jpg
Gran Torino;139. Gran Torino;2008;8.1;Drama;Walt Kowalski, um ranzinza veterano da guerra da Coreia, tenta dar uma lição em seu vizinho quando este tentar roubar seu bem mais precioso: um Gran Torino de 1972.;https://m.media-amazon.com/images/M/MV5BMTc5NTk2OTU1Nl5BMl5BanBnXkFtZTcwMDc3NjAwMg@@._V1_QL75_UY562_CR0,0,380,562_.jpg
Sindicato de Ladrões;140. Sindicato de Ladrões;1954;8.1;Policial;Um ex-lutador que virou lutador enfrenta seus chefes corruptos.;https://m.media-amazon.com/images/M/MV5BY2I0MWFiZDMtNWQyYy00Njk5LTk3MDktZjZjNTNmZmVkYjkxXkEyXkFqcGdeQXVyNjc1NTYyMjg@._V1_QL75_UX380_CR0,6,380,562_.jpg
Prenda-me se for Capaz;141. Prenda-me se for Capaz;2002;8.1;Biografia;Um agente do FBI persegue Frank Abagnale, que antes de seus 19 anos consegue ganhar milhões de dólares fingindo ser um piloto, um médico e um advogado.;https://m.media-amazon.com/images/M/MV5BN2E4OWRkZDctNTNhMi00MTQzLTg1MDQtNGYyZDE5NTkxMThiXkEyXkFqcGdeQXVyMTAyOTE2ODg0._V1_QL75_UY562_CR26,0,380,562_.jpg
Harry Potter e as Relíquias da Morte - Parte 2;142. Harry Potter e as Relíquias da Morte - Parte 2;2011;8.1;Aventura;Harry, Ron e Hermione devem escapar a Voldemort e tentar trabalhar em conjunto para localizar e aniquilar os Horcruxes, que contêm pedaços da alma de Voldemort.;https://m.media-amazon.com/images/M/MV5BMDdhYWE4YWQtNzhjOS00OTExLTg1ZmQtMzY3YWY3YjI5MGIxXkEyXkFqcGdeQXVyMTAyOTE2ODg0._V1_QL75_UY562_CR6,0,380,562_.jpg
Ben-Hur;143. Ben-Hur;1959;8.1;Aventura;Quando um príncipe de Jerusalém é traído e enviado à escravidão por um amigo romano, ele recupera sua liberdade e retorna para se vingar.;https://m.media-amazon.com/images/M/MV5BNjgxY2JiZDYtZmMwOC00ZmJjLWJmODUtMTNmNWNmYWI5ODkwL2ltYWdlL2ltYWdlXkEyXkFqcGdeQXVyNjc1NTYyMjg@._V1_QL75_UX380_CR0,7,380,562_.jpg
Os Melhores Anos de Nossa Vida;144. Os Melhores Anos de Nossa Vida;1946;8.1;Drama;Três veteranos da Segunda Guerra Mundial voltam para casa na cidade pequena da América para descobrir que eles e suas famílias foram mudados irreparavelmente.;https://m.media-amazon.com/images/M/MV5BZjU4MDc0NDItM2I1Ni00MGJiLTg1ZWUtMDY3NmJkNjk3YzQ1XkEyXkFqcGdeQXVyMTAyOTE2ODg0._V1_QL75_UY562_CR10,0,380,562_.jpg
Antes do Amanhecer;145. Antes do Amanhecer;1995;8.1;Drama;Um jovem e uma mulher se conhecem num trem em Europa é passam uma noite juntos em Viena.;https://m.media-amazon.com/images/M/MV5BMDEwYjkxZTgtZDcwYy00NTI5LTllMTktMDI3NmY2NGNlYzU0XkEyXkFqcGdeQXVyMTAyOTE2ODg0._V1_QL75_UY562_CR11,0,380,562_.jpg
Em Nome do Pai;146. Em Nome do Pai;1993;8.1;Biografia;Em 1974, uma explosão a bomba acontece em Guilford, próximo de Londres. Gerry Conlon e amigos são acusados pelo crime e presos. Giuseppe Conlon, pai de Gerry, pede ajuda à advogada Gareth Peirce, que investiga as irregularidades do caso.;https://m.media-amazon.com/images/M/MV5BMmYyOTgwYWItYmU3Ny00M2E2LTk0NWMtMDVlNmQ0MWZiMTMxXkEyXkFqcGdeQXVyNzkwMjQ5NzM@._V1_QL75_UX380_CR0,2,380,562_.jpg
Menina de Ouro;147. Menina de Ouro;2004;8.1;Drama;Uma mulher determinada se prepara para se tornar numa pugilista profissional.;https://m.media-amazon.com/images/M/MV5BOTY1MWEzYzQtMTUwNy00MTk2LWI5MDMtNTA5NTY5MzY3Zjc3XkEyXkFqcGdeQXVyMTAyOTE2ODg0._V1_QL75_UX380_CR0,1,380,562_.jpg
O 3º Homem;148. O 3º Homem;1949;8.1;Filme noir;O romancista Holly Martins viaja para sombria, Viena pós-guerra, apenas para ele mesmo investigar a misteriosa morte de um velho amigo, Harry Lime;https://m.media-amazon.com/images/M/MV5BYjE2OTdhMWUtOGJlMy00ZDViLWIzZjgtYjZkZGZmMDZjYmEyXkEyXkFqcGdeQXVyNzkwMjQ5NzM@._V1_QL75_UX380_CR0,4,380,562_.jpg
Blade Runner: O Caçador de Androides;149. Blade Runner: O Caçador de Androides;1982;8.1;Ação;Um corredor deberá perseguir é acabar com quatro replicantes que roubaram uma nave no espaço, e deberá regresar á Terra e encontrar seu criador.;https://m.media-amazon.com/images/M/MV5BNjIwZTVkOWMtNTk0My00NDRkLWI3ZDktOWMzOWRmOGViMzBkXkEyXkFqcGdeQXVyMTAzMDM4MjM0._V1_QL75_UY562_CR2,0,380,562_.jpg
Mary e Max: Uma Amizade Diferente;150. Mary e Max: Uma Amizade Diferente;2009;8.1;Animação;Relata a estranha história de uma amizade entre dois amigos por correspondência: Mary, uma garota solitária de oito anos que vive nos subúrbios de Melbourne, e Max, um homem obeso de quarenta e quatro anos que vive em Nova York.;https://m.media-amazon.com/images/M/MV5BNGFiMjFjYjMtYjExOC00NzU2LTk2ZTItMjA0Njc2ZjFiNjRhXkEyXkFqcGdeQXVyMTAyOTE2ODg0._V1_QL75_UY562_CR9,0,380,562_.jpg
12 Anos de Escravidão;151. 12 Anos de Escravidão;2013;8.1;Biografia;Solomon Northup, um homem preto livre de Nova Iorque, é raptado e vendido como escravo.;https://m.media-amazon.com/images/M/MV5BMGUzNmY2MzMtNjYzOS00ZTMyLWFiMTctZTAwNzczZjE1OWRjXkEyXkFqcGdeQXVyMTAzMDM4MjM0._V1_QL75_UY562_CR2,0,380,562_.jpg
O Grande Hotel Budapeste;153. O Grande Hotel Budapeste;2014;8.1;Aventura;As aventuras de Gustave H, um lendário porteiro dum famoso hotel da ficcional República de Zubrowka entre a primeira y a segunda guerra mundial.;https://m.media-amazon.com/images/M/MV5BNGE0YjdkOWMtYzA2ZS00NTJlLWE3NTYtODI3YjUzZmFkYTViXkEyXkFqcGdeQXVyMTAyOTE2ODg0._V1_QL75_UY562_CR3,0,380,562_.jpg
Garota Exemplar;155. Garota Exemplar;2014;8.1;Drama;Desde que o desaparecimento de sua esposa se tornou o foco de um intenso circo da mídia, um homem vê como esta se concentra nele quando suspeitam que pode não ser inocente.;https://m.media-amazon.com/images/M/MV5BY2UwMWYzZjEtZjQyZS00MmQ0LTg5ZmItNDEyNDg3ZDdjMWQ5XkEyXkFqcGdeQXVyMTAzMDM4MjM0._V1_QL75_UY562_CR2,0,380,562_.jpg
Sociedade dos Poetas Mortos;156. Sociedade dos Poetas Mortos;1989;8.1;Comédia;O professor de Inglés John Keating inspira a seus estudantes a ver a poesia duma perspectiva diferente.;https://m.media-amazon.com/images/M/MV5BMDhhMzA0YmItODRiZi00ZTYxLWE3YzgtNmUxZmQ0NGVhNWI0XkEyXkFqcGdeQXVyMTAyOTE2ODg0._V1_QL75_UY562_CR11,0,380,562_.jpg
Como Treinar o Seu Dragão;157. Como Treinar o Seu Dragão;2010;8.1;Animação;Um jovem e desafortunado viking que aspira a caçar dragões se torna o improvável amigo de um jovem dragão, e descobre que pode haver mais nas criaturas do que ele supunha.;https://m.media-amazon.com/images/M/MV5BMjA5NDQyMjc2NF5BMl5BanBnXkFtZTcwMjg5ODcyMw@@._V1_QL75_UX380_CR0,1,380,562_.jpg
Mad Max: Estrada da Fúria;158. Mad Max: Estrada da Fúria;2015;8.1;Ação;Num mundo apocalíptico, uma mulher se rebela contra um tirano ao procurar uma nova casa para um grupo de mulheres prisioneiras com a ajuda dum homem chamado Max.;https://m.media-amazon.com/images/M/MV5BNTA2ZTM0MGEtMWRkNC00ZTRkLWI1MTEtZjYzMzJhZTNiOTU2XkEyXkFqcGdeQXVyMTAyOTE2ODg0._V1_QL75_UX380_CR0,4,380,562_.jpg
Ford vs Ferrari;159. Ford vs Ferrari;2019;8.1;Ação;Um designer de carros e um motorista combatem a interferência corporativa, as leis da física e seus próprios demônios pessoais para construir um carro de corrida revolucionário para a Ford e desafiar a Ferrari nas 24 Horas de Le Mans em 1966.;https://m.media-amazon.com/images/M/MV5BMzliNDUxMDMtYjM4Ny00Y2U2LWE4ZTUtNTE3MjhmNWQ5YTFkXkEyXkFqcGdeQXVyMTAzMDM4MjM0._V1_QL75_UX380_CR0,0,380,562_.jpg
Monstros S.A.;160. Monstros S.A.;2001;8.1;Animação;Para poder dar electricidade a sua cidade, os monstros tem que assustar a crianças. Pensando que as crianças são perigosas para eles, dois monstros acham que as coisas podem ser diferentes.;https://m.media-amazon.com/images/M/MV5BZGViZDY3N2QtNTU1OS00NTkzLWJlZGMtYzE3NDEyMDQxNmYzXkEyXkFqcGdeQXVyNzg5MzIyOA@@._V1_QL75_UY562_CR12,0,380,562_.jpg
As Vinhas da Ira;161. As Vinhas da Ira;1940;8.1;Drama;Uma família pobre no Centro-Oeste é forçada a abandonar suas terras. Eles viajam para a Califórnia, sofrendo os infortúnios dos sem-teto na Grande Depressão.;https://m.media-amazon.com/images/M/MV5BNzJiOGI2MjctYjUyMS00ZjkzLWE2ZmUtOTg4NTZkOTNhZDc1L2ltYWdlXkEyXkFqcGdeQXVyNjc1NTYyMjg@._V1_QL75_UX380_CR0,1,380,562_.jpg
Tubarão;162. Tubarão;1975;8.1;Aventura;Quando um tubarão desencadea caos numa praia, um xerife, um biologista e um marinheiro daram caça ao animal.;https://m.media-amazon.com/images/M/MV5BNWJiMGQ5YTQtZDk2Mi00ZDExLTgzMGUtM2M2ODVkYmNlYWJkXkEyXkFqcGdeQXVyMTAyOTE2ODg0._V1_QL75_UY562_CR7,0,380,562_.jpg
O Quarto de Jack;163. O Quarto de Jack;2015;8.1;Drama;Um menino é mantido preso em um quarto com sua mãe desde seu nascimento, por isso sua visão do mundo é muito reduzida.;https://m.media-amazon.com/images/M/MV5BZTBlM2RlMWMtMDNmNi00MzE1LTgxOTMtZTM3MDJiYWE3NzMxXkEyXkFqcGdeQXVyMTAyOTE2ODg0._V1_QL75_UY562_CR1,0,380,562_.jpg
Vai! Índia;164. Vai! Índia;2007;8.1;Drama;Kabir Khan, treinadora da Seleção Indiana Feminina de Hóquei, sonha em fazer com que sua equipe feminina saia vitoriosa contra todas as probabilidades.;https://m.media-amazon.com/images/M/MV5BMTUzODMyNzk4NV5BMl5BanBnXkFtZTgwNTk1NTYyNTM@._V1_QL75_UY562_CR21,0,380,562_.jpg
O Grande Lebowski;165. O Grande Lebowski;1998;8.1;Comédia;Jeff The Dude Lebowski, foi confundido por um millonário do mesmo nome e procurará restituçao com a ajuda do seus amigos.;https://m.media-amazon.com/images/M/MV5BMDQxOTk1YmUtNDg3NC00ZGY5LTkzYTUtOTExMDgzMzE0YTUzXkEyXkFqcGdeQXVyMTAyOTE2ODg0._V1_QL75_UY562_CR18,0,380,562_.jpg
Os Sapatinhos Vermelhos;166. Os Sapatinhos Vermelhos;1948;8.1;Drama;Uma jovem bailarina está dividida entre o homem que ama e sua busca para se tornar uma dançarina.;https://m.media-amazon.com/images/M/MV5BOWRmNGEwZjUtZjEwNS00OGZmLThhMmEtZTJlMTU5MGQ3ZWUwXkEyXkFqcGdeQXVyNjc1NTYyMjg@._V1_QL75_UX380_CR0,0,380,562_.jpg
Hotel Ruanda;167. Hotel Ruanda;2004;8.1;Biografia;Paul Rusesabagina era o gerente de um hotel que abrigava mais de mil refugiados tutsis durante sua luta contra a milícia hutu em Ruanda.;https://m.media-amazon.com/images/M/MV5BMDA2ODZhYTktMjI3MC00N2NlLTk5ZjgtNGQ1OGI1MWIyOTk0XkEyXkFqcGdeQXVyMTAyOTE2ODg0._V1_QL75_UY562_CR7,0,380,562_.jpg
Sem Novidade no Front;168. Sem Novidade no Front;1930;8.1;Drama;Um jovem alemão entra na Primeira Guerra Mundial com entusiasmo, mas seu entusiasmo se desvanece quando ele vê o horror em primeira mão.;https://m.media-amazon.com/images/M/MV5BMDY5NTllNWYtNzY2Zi00NTBiLWFkMmEtMDNmZGE0YmI3YTMzXkEyXkFqcGdeQXVyODc0OTEyNDU@._V1_QL75_UY562_CR7,0,380,562_.jpg
Ratatouille;169. Ratatouille;2007;8.1;Animação;Um rato que pode cozinhar forja uma aliança incomum com um jovem garoto em um famoso restaurante em Paris.;https://m.media-amazon.com/images/M/MV5BMjdkM2Y5YTEtNDgyYS00YzU2LTgwYjQtNjQxOGYwYTRmMzNmXkEyXkFqcGdeQXVyMTAyOTE2ODg0._V1_QL75_UY562_CR2,0,380,562_.jpg
Rede de Intrigas;170. Rede de Intrigas;1976;8.1;Drama;Uma rede de televisão explora os delírios e revelações de um homem perturbado.;https://m.media-amazon.com/images/M/MV5BNzY0NjU5ODUtOTAzMC00NTU5LWJkZjctYWMyOWY2MTZmOWM1XkEyXkFqcGdeQXVyMTI3ODAyMzE2._V1_QL75_UX380_CR0,9,380,562_.jpg
Rocky: Um Lutador;171. Rocky: Um Lutador;1976;8.1;Drama;Um boxer pouco conhecido tem uma grande oportunidade de enfrentar o campeão dos pesos pesados em uma partida em que ele esperaele espera estar à altura da tarefa e divulgar seu nome.;https://m.media-amazon.com/images/M/MV5BZGJhOTdkZWMtNmIyYi00NDY4LThiODUtNWIxNTIyYmNhN2FmXkEyXkFqcGdeQXVyMTAyOTE2ODg0._V1_QL75_UX380_CR0,8,380,562_.jpg
Logan;172. Logan;2017;8.1;Ação;Em um futuro em que os mutantes estão quase extintos, um velho e cansado Logan leva uma vida tranquila. Mas quando Laura, uma garota mutante perseguida por cientistas, pede ajuda a ele, ele deve colocá-la em segurança.;https://m.media-amazon.com/images/M/MV5BYThiM2VjYWItM2NlYi00NDk3LTk2YjItYTg4OGM3YWE5MWI2XkEyXkFqcGdeQXVyNjczOTE0MzM@._V1_QL75_UX380_CR0,4,380,562_.jpg
