title_pt;title_en;year;rating;genre;sinopse
O Sexto Sentido;144. The Sixth Sense;1999;8.2;Drama;Um menino que consegue se comunicar com espíritos encontra ajuda de um psicólogo.
Uma Mente Brilhante;146. A Beautiful Mind;2001;8.2;Biografia;A vida do brilhante mas insociável matemático John Nash muda quando ele aceita um trabalho secreto em criptografia.
O Tesouro da Sierra Madre;147. The Treasure of the Sierra Madre;1947;8.2;Aventura;Dois americanos em busca de trabalho no México convencem um homem a ajudá-los a extrair ouro nas montanhas da Serra Madre.
Yojimbo, o Guarda-Costas;148. Yojimbo;1961;8.2;Ação;Um astuto ronin chega a uma cidade dividida por duas quadrilhas criminosas e decide se confrontar para libertar a cidade.
Onde os Fracos Não Têm Vez;149. No Country for Old Men;2007;8.2;Policial;Violência e caos surgem quando um caçador se depara com uma negociação de drogas que deu errado e mais de dois milhões de dólares perto do Rio Grande.
Monty Python em Busca do Cálice Sagrado;150. Monty Python and the Holy Grail;1975;8.2;Aventura;O Rei Arthur e seus Cavaleiros da Távola Redonda embarcam em uma busca surrealista e de baixo orçamento pelo Santo Graal, encontrando múltiplos obstáculos estúpidos.
Kill Bill: Volume 1;151. Kill Bill: Vol. 1;2003;8.2;Ação;Depois de despertar de um coma de quatro anos, uma antiga assassina busca vingança contra o grupo de assassinos que a traiu.
Fugindo do Inferno;152. The Great Escape;1963;8.2;Aventura;Prisioneiros de guerra aliados planejam uma fuga maciça de um campo alemão durante a Segunda Guerra Mundial.
O Enigma de Outro Mundo;153. The Thing;1982;8.2;Terror;Um team de investigação na Antartica é perseguido por extraterrestres.
Rashomon;154. Rashomon;1950;8.2;Policial;A violação de uma noiva e o assassinato de seu marido samurai são lembrados desde a perspectiva de um bandido, da noiva, do fantasma do samurai e de um lenhador.
Procurando Nemo;155. Finding Nemo;2003;8.2;Animação;Quando seu filho é capturado, um peixe-palhaço tímido embarca em uma viagem para trazê-lo para casa.
O Homem Elefante;156. The Elephant Man;1980;8.2;Biografia;Um famoso médico estuda a um jovem com a cara deformada, conhecido como Homem Elefante, ele se da conta que o homem é inteligente e de bom coração.
Chinatown;157. Chinatown;1974;8.2;Drama;Um detetive particular contratado para desmascarar um adúltero é pego em uma teia de fraude, corrupção e assassinato.
Homem-Aranha: Sem Volta para Casa;158. Spider-Man: No Way Home;2021;8.2;Ação;Com a identidade do Homem-Aranha revelada, Peter pede ajuda ao Doutor Strange. Quando um feitiço corre mal, inimigos perigosos de outros mundos começam a aparecer, forçando Peter a descobrir o que realmente significa ser o Homem-Aranha.
V de Vingança;159. V for Vendetta;2005;8.2;Ação;Em um futuro da tirania britânica, um lutador clandestino conhecido como V trama um plano para derrubá-la com a ajuda de uma jovem mulher.
...E o Vento Levou;160. Gone with the Wind;1939;8.2;Drama;Uma mulher manipuladora e uma truhan embarcam em um romance turbulento durante a Guerra Civil Americana e o período da Reconstrução.
Touro Indomável;161. Raging Bull;1980;8.1;Biografia;A vida do boxeador Jake LaMotta, que vê como a violência e temperamento que o levam ao topo do ringue, destroem sua vida fora dele.
Disque M para Matar;162. Dial M for Murder;1954;8.2;Policial;Um ex-tenista decide matar a esposa para herdar o dinheiro dela e se vingar de um caso que ela havia tido. A fim de se livrar de culpas, usa um antigo colega de faculdade. Mas as coisas não vão correr como estava planeado.
O Castelo Animado;163. Howl's Moving Castle;2004;8.2;Animação;Uma jovem sem autoconfiança é amaldiçoada com um corpo envelhecido por uma bruxa odiosa. Sua única chance de quebrar o feitiço é um jovem feiticeiro em um castelo itinerante.
Jogos, Trapaças e Dois Canos Fumegantes;164. Lock, Stock and Two Smoking Barrels;1998;8.1;Ação;Um jogo de cartas em Londres desencadeia um confronto entre quatro amigos, plantadores de maconha, agiotas e cobradores de dívidas em uma série de eventos curiosos, tudo por algo de maria, dinheiro e duas pistolas antigas.
O Segredo dos Seus Olhos;165. The Secret in Their Eyes;2009;8.2;Drama;Um assessor jurídico aposentado escreve um romance com a esperança de fechar um de seus antigos casos de homicídio, que permanece sem solução, e superar o amor não correspondido que sentia por seu chefe. Décadas depois, ambas as memórias continuam a persegui-lo.
Divertida Mente;166. Inside Out;2015;8.1;Animação;Quando o jovem Riley se muda á San Francisco deberá lidiar com suas emoções.
Os Suspeitos;167. Prisoners;2013;8.1;Policial;Quando a filha de Keller Dover e sua amiguinha desaparecem, ele decide investigar o caso por sua conta enquanto a polícia segue múltiplas pistas e a pressão para resolver o caso aumenta.
Três Anúncios para um Crime;168. Three Billboards Outside Ebbing, Missouri;2017;8.1;Comédia;Uma mãe desafia pessoalmente as autoridades locais para resolver o assassinato de sua filha.
A Ponte do Rio Kwai;169. The Bridge on the River Kwai;1957;8.1;Aventura;Depois de resolver suas diferenças com um japonês, o comandante do campo, um coronel britânico, coopera para supervisionar a construção de uma ponte ferroviária.
Trainspotting: Sem Limites;170. Trainspotting;1996;8.1;Drama;Renton, profundamente imerso no mundo das drogas em Edimburgo, tenta sair do ambiente apesar da má influência dos amigos.
Fargo: Uma Comédia de Erros;171. Fargo;1996;8.1;Policial;O crime de Jerry Lundegaard se desfaz devido à falta de sorte dele e de seus colegas e ao persistente trabalho polícia.
Guerreiro;172. Warrior;2011;8.1;Ação;O filho pequeno de um exboxer alcoólatra volta para casa, onde seu pai o treina para um torneio de artes marciais mistas.
Gran Torino;173. Gran Torino;2008;8.1;Drama;Walt Kowalski, um ranzinza veterano da guerra da Coreia, tenta dar uma lição em seu vizinho quando este tentar roubar seu bem mais precioso: um Gran Torino de 1972.
Prenda-me se for Capaz;174. Catch Me If You Can;2002;8.1;Biografia;Um agente do FBI persegue Frank Abagnale, que antes de seus 19 anos consegue ganhar milhões de dólares fingindo ser um piloto, um médico e um advogado.
Meu Amigo Totoro;175. My Neighbor Totoro;1988;8.1;Animação;Quando duas meninas se mudam para o campo para ficar perto de sua mãe doente, elas têm aventuras com os maravilhosos espíritos da floresta que moram nas proximidades.
Menina de Ouro;176. Million Dollar Baby;2004;8.1;Drama;Uma mulher determinada se prepara para se tornar numa pugilista profissional.
Klaus;177. Klaus;2019;8.2;Animação;Um simples ato de bondade sempre provoca outro, mesmo em um lugar gelado e distante. Quando o novo carteiro de Smeerensburg faz amizade com o fabricante de brinquedos Klaus, seus presentes derreteram uma antiga inimizade.
Filhos do Paraíso;178. Children of Heaven;1997;8.2;Drama;Depois que uma criança perde o par de sapatos de sua irmã, ele embarca em uma série de aventuras para encontrá-los. Quando não consegue, ele tenta uma nova maneira de procurá-los.
Harry Potter e as Relíquias da Morte - Parte 2;179. Harry Potter and the Deathly Hallows: Part 2;2011;8.1;Aventura;Harry, Ron e Hermione devem escapar a Voldemort e tentar trabalhar em conjunto para localizar e aniquilar os Horcruxes, que contêm pedaços da alma de Voldemort.
Blade Runner: O Caçador de Androides;180. Blade Runner;1982;8.1;Ação;Um corredor deberá perseguir é acabar com quatro replicantes que roubaram uma nave no espaço, e deberá regresar á Terra e encontrar seu criador.
12 Anos de Escravidão;181. 12 Years a Slave;2013;8.1;Biografia;Solomon Northup, um homem preto livre de Nova Iorque, é raptado e vendido como escravo.
Antes do Amanhecer;182. Before Sunrise;1995;8.1;Drama;Um jovem e uma mulher se conhecem num trem em Europa é passam uma noite juntos em Viena.
Em Busca do Ouro;183. The Gold Rush;1925;8.1;Aventura;Um garimpeiro vai ao Klondike em busca de ouro e encontra muito mais que isso.
O Grande Hotel Budapeste;184. The Grand Budapest Hotel;2014;8.1;Aventura;As aventuras de Gustave H, um lendário porteiro dum famoso hotel da ficcional República de Zubrowka entre a primeira y a segunda guerra mundial.
Ben-Hur;185. Ben-Hur;1959;8.1;Aventura;Quando um príncipe de Jerusalém é traído e enviado à escravidão por um amigo romano, ele recupera sua liberdade e retorna para se vingar.
Garota Exemplar;186. Gone Girl;2014;8.1;Drama;Desde que o desaparecimento de sua esposa se tornou o foco de um intenso circo da mídia, um homem vê como esta se concentra nele quando suspeitam que pode não ser inocente.
Sindicato de Ladrões;187. On the Waterfront;1954;8.1;Policial;Um ex-lutador que virou lutador enfrenta seus chefes corruptos.
Barry Lyndon;188. Barry Lyndon;1975;8.1;Aventura;Um irlandês conquista o coração de uma viúva rica e assume a posição aristocrática de seu falecido marido na Inglaterra do século XVIII.
Até o Último Homem;189. Hacksaw Ridge;2016;8.1;Biografia;O médico amaericano da Segunda Guerra Mundial, Desmond T. Doss, se recusa a matar pessoas e se torna o primeiro homem na história dos Estados Unidos a receber a Medalha de Honra sem atirar um tiro.
Em Nome do Pai;190. In the Name of the Father;1993;8.1;Biografia;Em 1974, uma explosão a bomba acontece em Guilford, próximo de Londres. Gerry Conlon e amigos são acusados pelo crime e presos. Giuseppe Conlon, pai de Gerry, pede ajuda à advogada Gareth Peirce, que investiga as irregularidades do caso.
A General;191. The General;1926;8.1;Ação;Uns espiões roubam a amada locomotiva de um engenheiro, ele a persegue sozinho através das linhas inimigas.
O Franco Atirador;192. The Deer Hunter;1978;8.1;Drama;Um retrato detalhado das maneiras pelas quais a Guerra do Vietnã interrompeu a vida dos habitantes de uma pequena cidade industrial na Pensilvânia.
Morangos Silvestres;193. Wild Strawberries;1957;8.1;Drama;Depois de viver uma vida marcada pela frieza, um professor idoso é forçado a confrontar o vazio de sua existência.
Memórias de um Assassino;194. Memories of Murder;2003;8.1;Policial;Em uma pequena província coreana em 1986, três detetives estão procurando o culpado de uma série de estupros e assassinatos de mulheres jovens.
O 3º Homem;195. The Third Man;1949;8.1;Filme noir;O romancista Holly Martins viaja para sombria, Viena pós-guerra, apenas para ele mesmo investigar a misteriosa morte de um velho amigo, Harry Lime
O Salário do Medo;196. The Wages of Fear;1953;8.2;Aventura;Em uma aldeia da América do Sul, quatro homens são contratados para transportar uma remessa urgente de nitroglicerina, mas sem o equipamento de segurança.
Relatos Selvagens;197. Wild Tales;2014;8.1;Comédia;Sies historias curtas que exploram o comportamento humano de pessoas desesperadas.
Bancando o Águia;198. Sherlock Jr.;1924;8.2;Ação;Um projecionista de cinema deseja ser um detetive e coloca suas magras habilidades em prática quando um rival o incrimina por roubar o relógio de bolso do pai de sua namorada.
Mad Max: Estrada da Fúria;199. Mad Max: Fury Road;2015;8.1;Ação;Num mundo apocalíptico, uma mulher se rebela contra um tirano ao procurar uma nova casa para um grupo de mulheres prisioneiras com a ajuda dum homem chamado Max.
Sociedade dos Poetas Mortos;200. Dead Poets Society;1989;8.1;Comédia;O professor de Inglés John Keating inspira a seus estudantes a ver a poesia duma perspectiva diferente.
A Mulher Faz o Homem;201. Mr. Smith Goes to Washington;1939;8.1;Comédia;Um homem ingênuo é eleito para ocupar uma vaga no Senado dos Estados Unidos. Seus planos colidem rapidamente com a corrupção política, mas ele não desiste.
Monstros S.A.;202. Monsters, Inc.;2001;8.1;Animação;Para poder dar electricidade a sua cidade, os monstros tem que assustar a crianças. Pensando que as crianças são perigosas para eles, dois monstros acham que as coisas podem ser diferentes.
Como Treinar o Seu Dragão;203. How to Train Your Dragon;2010;8.1;Animação;Um jovem e desafortunado viking que aspira a caçar dragões se torna o improvável amigo de um jovem dragão, e descobre que pode haver mais nas criaturas do que ele supunha.
Mary e Max: Uma Amizade Diferente;204. Mary and Max;2009;8.1;Animação;Relata a estranha história de uma amizade entre dois amigos por correspondência: Mary, uma garota solitária de oito anos que vive nos subúrbios de Melbourne, e Max, um homem obeso de quarenta e quatro anos que vive em Nova York.
Tubarão;205. Jaws;1975;8.1;Aventura;Quando um tubarão desencadea caos numa praia, um xerife, um biologista e um marinheiro daram caça ao animal.
O Sétimo Selo;206. The Seventh Seal;1957;8.1;Drama;Um homem procura respostas sobre a vida, a morte e a existência de Deus enquanto joga xadrez contra a morte durante a Morte Negra.
O Quarto de Jack;207. Room;2015;8.1;Drama;Um menino é mantido preso em um quarto com sua mãe desde seu nascimento, por isso sua visão do mundo é muito reduzida.
O Grande Lebowski;208. The Big Lebowski;1998;8.1;Comédia;Jeff The Dude Lebowski, foi confundido por um millonário do mesmo nome e procurará restituçao com a ajuda do seus amigos.
Ford vs Ferrari;209. Ford v Ferrari;2019;8.1;Ação;Um designer de carros e um motorista combatem a interferência corporativa, as leis da física e seus próprios demônios pessoais para construir um carro de corrida revolucionário para a Ford e desafiar a Ferrari nas 24 Horas de Le Mans em 1966.
Era uma Vez em Tóquio;210. Tokyo Story;1953;8.1;Drama;Um casal de idosos visita seus filhos e netos na cidade, mas recebe pouca atenção.
Ratatouille;211. Ratatouille;2007;8.1;Animação;Um rato que pode cozinhar forja uma aliança incomum com um jovem garoto em um famoso restaurante em Paris.
Hotel Ruanda;212. Hotel Rwanda;2004;8.1;Biografia;Paul Rusesabagina era o gerente de um hotel que abrigava mais de mil refugiados tutsis durante sua luta contra a milícia hutu em Ruanda.
O Martírio de Joana D'Arc;213. The Passion of Joan of Arc;1928;8.2;Biografia;Em 1431, Joana D'Arc é julgada sob acusações de heresia. Os advogados da Igreja tentam forçar Jeanne a retractar suas reivindicações de visões sagradas.
Rocky: Um Lutador;214. Rocky;1976;8.1;Drama;Um boxer pouco conhecido tem uma grande oportunidade de enfrentar o campeão dos pesos pesados em uma partida em que ele esperaele espera estar à altura da tarefa e divulgar seu nome.
Logan;215. Logan;2017;8.1;Ação;Em um futuro em que os mutantes estão quase extintos, um velho e cansado Logan leva uma vida tranquila. Mas quando Laura, uma garota mutante perseguida por cientistas, pede ajuda a ele, ele deve colocá-la em segurança.
Platoon;216. Platoon;1986;8.1;Drama;Um jovem soldado do Vietnã se confronta com uma crisis moral frete aos horrores da guerra.
Spotlight: Segredos Revelados;217. Spotlight;2015;8.1;Biografia;A verdadeira historia de como o jornal Boston Globe revelou o escândalo de abuso sexual infantil dentro da igreja católica da cidade e que agitou a toda igreja católica no mundo.
O Exterminador do Futuro;218. The Terminator;1984;8.1;Ação;Um indestrutível robô é enviado de 2029 a 1984 para assassinar a uma jovem garçonete que vai ter um filho que vai liderar uma guerra contra máquinas maa um soldado humano também é enviado para protege-lha.
Jai Bhim;219. Jai Bhim;2021;8.8;Policial;Quando um homem tribal é preso por um caso de suposto roubo, sua esposa recorre a um advogado de direitos humanos para ajudá-lo a fazer justiça.
Antes do Pôr do Sol;220. Before Sunset;2004;8.1;Drama;Nove anos depois de se conhecer, o Jesse e a Celine se encontram novamente na França.
Rush: No Limite da Emoção;221. Rush;2013;8.1;Ação;A história da rivalidade impiedosa nos anos 70 entre os rivais de Fórmula 1 James Hunt e Niki Lauda.
Rede de Intrigas;222. Network;1976;8.1;Drama;Uma rede de televisão explora os delírios e revelações de um homem perturbado.
Conta Comigo;223. Stand by Me;1986;8.1;Aventura;Depois da morte de um de seus velhos amigos, um escritor relembra sua viagem com os amigos de infância para encontrar o corpo de um menino desaparecido.
Os Melhores Anos de Nossa Vida;224. The Best Years of Our Lives;1946;8.1;Drama;Três veteranos da Segunda Guerra Mundial voltam para casa na cidade pequena da América para descobrir que eles e suas famílias foram mudados irreparavelmente.
O Mágico de Oz;225. The Wizard of Oz;1939;8.1;Aventura;A Dorothy Gale é levada por um tornado até a mágica cidade de Oz e vá numa viagem com novos amigos que la ajudar a voltar para casa.
Na Natureza Selvagem;226. Into the Wild;2007;8.1;Aventura;Depois de terminar a universidade, Christopher McCandless deixa pra trás suas posses e vai para o Alasca viver na natureza.
O Ódio;227. La haine;1995;8.1;Policial;24 horas na vida de três jovens nos subúrbios franceses no dia seguinte a uma rebelião violenta.
O Exorcista;228. The Exorcist;1973;8.1;Terror;Quando uma adolescente é possuída por uma entidade misteriosa, sua mãe busca a ajuda de um padre, que também é um psiquiatra, para salvar sua filha.
Piratas do Caribe: A Maldição do Pérola Negra;229. Pirates of the Caribbean: The Curse of the Black Pearl;2003;8.1;Ação;O ferreiro Will Turner se junta ao capitão Jack Sparrow para salvar seu amor, a filha do governador, dos ex-aliados piratas de Jack, que agora estão vivos.
Os Incríveis;230. The Incredibles;2004;8.0;Animação;Uma familia de heróis encobertos tentando viver uma vida tranquila se vem obrigados a salvar o mundo.
Ser ou Não Ser;231. To Be or Not to Be;1942;8.2;Comédia;Durante a ocupação nazista da Polônia, uma trupe de atuação se envolve nos esforços de um soldado polonês para rastrear um espião alemão.
Meu Pai e Meu Filho;232. My Father and My Son;2005;8.2;Drama;A família de um jornalista de esquerda é separada após o golpe militar na Turquia em 1980.
Feitiço do Tempo;233. Groundhog Day;1993;8.0;Comédia;Um homem vive o mesmo dia uma e outra vez.
As Vinhas da Ira;234. The Grapes of Wrath;1940;8.1;Drama;Uma família pobre no Centro-Oeste é forçada a abandonar suas terras. Eles viajam para a Califórnia, sofrendo os infortúnios dos sem-teto na Grande Depressão.
Sempre ao Seu Lado;235. Hachi: A Dog's Tale;2009;8.1;Biografia;Um professor universitário se liga a um cachorro abandonado que ele leva para casa.
A Batalha de Argel;236. The Battle of Algiers;1966;8.1;Drama;Nos anos 50, o medo e a violência aumentam à medida que o povo de Argel lutava pela independência do governo francês.
A Criada;237. The Handmaiden;2016;8.1;Drama;Uma mulher é contratada como criada de uma herdeira japonesa, mas secretamente esta envolvida em um plano para defraudá-la.
Amores Brutos;238. Amores Perros;2000;8.1;Drama;Um terrível acidente de carro conecta três histórias, cada uma envolvendo personagens que lidam com a perda, o arrependimento e as duras realidades da vida, tudo em nome do amor.
Rebecca, a Mulher Inesquecível;239. Rebecca;1940;8.1;Drama;Uma mulher autoconsciente faz malabarismos para se ajustar a seu novo papel de esposa de um aristocrata e evitar ser intimidada pela presença espectral de sua primeira esposa.
Rebeldia Indomável;240. Cool Hand Luke;1967;8.1;Policial;Um sulista quieto é condenado a dois anos em uma prisão rural, mas se recusa a obedecer.
A Canção da Estrada;241. Pather Panchali;1955;8.2;Drama;O padre Harihar Ray, sonhando com uma vida melhor para si e sua família, deixa sua aldeia rural de Bengala em busca de trabalho.
A Noviça Rebelde;242. The Sound of Music;1965;8.1;Biografia;Uma mulher deixa um convento austríaco para se tornar a instrutora dos filhos de um oficial da marinha viúvo.
Aconteceu Naquela Noite;243. It Happened One Night;1934;8.1;Comédia;Uma herdeira mimada que foge de sua família é ajudada por um homem que na verdade é um repórter que precisa de uma história.
O Gigante de Ferro;244. The Iron Giant;1999;8.1;Animação;Um jovem faz amizade com um robô gigante do espaço, um paranóico agente do governo quer que seja destruído.
Os Incompreendidos;245. The 400 Blows;1959;8.1;Policial;Uma criança, sem atenção, entra em uma vida de pequenos crimes.
Histórias Cruzadas;246. The Help;2011;8.1;Drama;Uma aspirante a escritora durante o movimento dos direitos civis nos anos 60 nos Estados Unidos decide escrever um livro sobre as experiências das criadas negras que trabalhavam para as famílias brancas.
Quando Duas Mulheres Pecam;247. Persona;1966;8.1;Drama;Uma enfermeira é encarregada de uma atriz silenciosa e descobre que sua personalidade parece convergir em uma.
A Vida de Brian;248. Life of Brian;1979;8.0;Comédia;Nascido no Natal original no estábulo ao lado de Jesus, Brian de Nazaret passa a vida confundido com um messias.
Aladdin;249. Aladdin;1992;8.0;Animação;Um menino de rua bondoso e um Vizir competem por uma lâmpada mágica que tem o poder de realizar seus mais profundos desejos.
A Chantagem;250. Drishyam;2015;8.2;Policial;Um homem toma medidas desesperadas para tentar salvar sua família do lado negro da lei depois que eles cometem um crime inesperado.
Super-Heróis: A Liga da Injustiça;1. Disaster Movie;2008;1.9;Comédia;Durante uma noite um grupo de jovens se ve invadido por uma série de desastres naturais e eventos catastróficos.
Manos: As Mãos do Destino;2. Manos: The Hands of Fate;1966;1.6;Terror;Uma família se perde na estrada e tropeça em um culto oculto, subterrâneo e adorador do diabo, liderado pelo temível Mestre e seu servo Torgo.
Birdemic: Choque e Terror;3. Birdemic: Shock and Terror;2010;1.7;Terror;Uma horda de pássaros mutantes desce na cidade de Half Moon Bay, Califórnia. Com o número de mortos a aumentar, dois cidadãos conseguem defender-se, mas será que eles vão sobreviver?
Bebês Geniais 2: Super Bebês;4. Superbabies: Baby Geniuses 2;2004;1.5;Comédia;Um grupo de crianças que falam inteligentemente se encontra no centro da experiência de um magnata da mídia para decifrar o código da conversa do bebê. Os bebês devem correr contra o tempo para o bem deles em todos os lugares.
A Gostosa e a Gosmenta;5. The Hottie & the Nottie;2008;1.9;Comédia;Uma mulher concorda em sair com um homem apenas se ele encontrar um pretendente para seu melhor amiga pouco atraente.
Salvando o Natal;6. Kirk Cameron's Saving Christmas;2014;1.3;Comédia;His annual Christmas party faltering thanks to his cynical brother-in-law, former Growing Pains star Kirk Cameron attempts to save the day by showing him that Jesus Christ remains a crucial component of the over-commercialized holiday..
House of the Dead: O Filme;7. House of the Dead;2003;2.1;Ação;Um grupo de jovens visita a misteriosa Ilha da Morte, que há séculos abriga um padre banido da Espanha por inventar um soro que engana a morte, e acabam se refugiando numa casa antiga a fim de se defenderem de criaturas semimortas.
O Filho do Máskara;8. Son of the Mask;2005;2.2;Comédia;"Tim Avery, um aspirante a cartunista, se envolve em uma situação difícil quando seu cão encontra a máscara de Loki. Depois de conceber um filho ""que nasce da máscara"", ele descobre como pode ser uma loucura criar uma criança."
Deu a Louca em Hollywood;9. Epic Movie;2007;2.4;Aventura;Uma paródia dos filmes épicos dos anos anteriores (O Código Da Vinci (2006), As Crônicas de Nárnia: O Leão,a Feiticeira e o Guarda-Roupa (2005) + 20 mais), séries de TV, vídeos musicais e celebridades. 4 órfãos em uma aventura épica.
Radhe;10. Radhe;2021;1.9;Ação;Depois de tomar o temido gângster Gani Bhai, ACP Rajveer Shikawat, também conhecido como Radhe, vai em uma caçada para encontrar o homem mais rico da cidade secretamente comandando um sindicato do crime.
A Reconquista;11. Battlefield Earth;2000;2.5;Ação;No ano 3000 a Terra perdeu a batalha contra os Psiclos e a humanidade foi escravizada, mas em silêncio ja planejam a rebelião.
Universidade do Prazer;12. Pledge This!;2006;1.7;Comédia;Na Universidade de South Beach, uma bela presidente de fraternidade hospeda um grupo de estudantes não convencionais que procuram aceitação em sua casa.
Alone in the Dark: O Despertar do Mal;13. Alone in the Dark;2005;2.4;Ação;Um detetive paranormal revela eventos misteriosos com resultados mortais.
Dragonball Evolution;14. Dragonball Evolution;2009;2.5;Ação;O jovem guerreiro Son Goku embarca em uma missão, correndo contra o tempo e o vingativo rei Piccolo, para coletar um conjunto de sete esferas mágicas que concederão ao seu portador poder ilimitado.
Race 3;15. Race 3;2018;1.9;Ação;Relationships and loyalties of a criminal family planning its next big heist are tested when some shocking revelations strike them.
De Justin para Kelly;16. From Justin to Kelly;2003;1.9;Comédia;A waitress from Texas and a college student from Pennsylvania meet during spring break in Fort Lauderdale, Florida and come together through their shared love of singing.
Ir ao mar;17. Going Overboard;1989;1.8;Comédia;Um jovem comediante angustiado faz um trabalho humilde em um cruzeiro, esperando sua grande oportunidade de ter sucesso no mundo da comédia.
A Guerra das Comidas;18. Foodfight!;2012;1.3;Animação;A má Brand X entra em um supermercado que se transforma em uma cidade após o horário de fechamento.
Dünyayi Kurtaran Adam'in Oglu;19. Turks in Space;2006;1.5;Ação;A family of Turks try to adapt to life in a new solar system.
Espartalhões;20. Meet the Spartans;2008;2.8;Comédia;Uma paródia de 300 (2006) e muitos outros filmes, séries de TV/programas/comerciais, videogames e celebridades.
Contato de Risco;21. Gigli;2003;2.6;Comédia;Larry Gigli é designado por um chefe do crime para sequestrar o irmão de um proeminente promotor público. Uma linda mulher, conhecida apenas como Ricki, é enviada para acompanhá-lo e garantir que ele não faça nada de errado.
