title_pt;title_en;year;rating;genre;sinopse;image
Os Sete Samurais;22. Os Sete Samurais;1954;8.6;Ação;Uma aldeia pobre sob a ameaça de bandidos recruta sete samurais para ajudá-los a se defenderem.;https://m.media-amazon.com/images/M/MV5BNWQ3OTM4ZGItMWEwZi00MjI5LWI3YzgtNTYwNWRkNmIzMGI5XkEyXkFqcGdeQXVyNDY2MTk1ODk@._V1_QL75_UY562_CR11,0,380,562_.jpg
Cidade de Deus;26. Cidade de Deus;2002;8.6;Policial;Os caminhos de duas crianças divergem nas favelas do Rio, enquanto um se esforça para se tornar um fotógrafo e o outro um chefe do tráfico.;https://m.media-amazon.com/images/M/MV5BOTMwYjc5ZmItYTFjZC00ZGQ3LTlkNTMtMjZiNTZlMWQzNzI5XkEyXkFqcGdeQXVyNzkwMjQ5NzM@._V1_QL75_UX380_CR0,2,380,562_.jpg
A Vida é Bela;27. A Vida é Bela;1997;8.6;Comédia;Quando um bibliotecário judeu e seu filho se tornarem vítimas do Holocausto, ele usará uma mistura perfeita de vontade, humor e imaginação para proteger seu filho dos perigos do campo de concentração.;https://m.media-amazon.com/images/M/MV5BYTY3M2NhODAtMTRiNC00OThlLTg3YTAtNjIwNjU2Zjg1MDFhXkEyXkFqcGdeQXVyMTAyOTE2ODg0._V1_QL75_UY562_CR7,0,380,562_.jpg
A Viagem de Chihiro;32. A Viagem de Chihiro;2001;8.6;Animação;Durante a mudança de casa, uma menina de dez anos se maravilha num mundo de dioses, bruxas e espíritus e onde os humanos são transformados em bestas.;https://m.media-amazon.com/images/M/MV5BMjlmZmI5MDctNDE2YS00YWE0LWE5ZWItZDBhYWQ0NTcxNWRhXkEyXkFqcGdeQXVyMTMxODk2OTU@._V1_QL75_UX380_CR0,0,380,562_.jpg
Parasita;35. Parasita;2019;8.5;Drama;Desempregados, a família de Ki-taek (Song Kang-ho) nutre um interesse peculiar pela família Park até que eles se veem presos em um inesperado incidente.;https://m.media-amazon.com/images/M/MV5BNDhhZjkyNGItY2VmZi00NjJhLWI0MzMtZTBlMjhlNzE0NzNiXkEyXkFqcGdeQXVyMTA4NjE0NjEy._V1_QL75_UY562_CR4,0,380,562_.jpg
Túmulo dos Vagalumes;45. Túmulo dos Vagalumes;1988;8.5;Animação;Um menino e sua irmã tentam sobreviver no Japão durante a Segunda Guerra Mundial.;https://m.media-amazon.com/images/M/MV5BNDU1OWExYjYtOTZlMy00MWY5LThkOGMtZjBhNDdiYTY4YTM0XkEyXkFqcGdeQXVyMTAyOTE2ODg0._V1_QL75_UY562_CR9,0,380,562_.jpg
Harakiri;46. Harakiri;1962;8.6;Ação;Um velho samurai ronin chega à casa de um senhor feudal e pede um lugar honroso para cometer suicídio. Mas quando o ronin pede um samurai mais jovem que chegou antes, os eventos seguem um curso inesperado.;https://m.media-amazon.com/images/M/MV5BYjBmYTQ1NjItZWU5MS00YjI0LTg2OTYtYmFkN2JkMmNiNWVkXkEyXkFqcGdeQXVyMTMxMTY0OTQ@._V1_QL75_UY562_CR17,0,380,562_.jpg
Intocáveis;48. Intocáveis;2011;8.5;Biografia;Depois de ficar tetraplégico num acidente, um aristocrata contrata um jovem de um bairro pobre para cuidar dele.;https://m.media-amazon.com/images/M/MV5BMTYxNDA3MDQwNl5BMl5BanBnXkFtZTcwNTU4Mzc1Nw@@._V1_QL75_UX380_CR0,0,380,562_.jpg
Cinema Paradiso;50. Cinema Paradiso;1988;8.5;Drama;Um diretor de cinema lembra como, em sua infância, ele se apaixonou pelo cinema de sua cidade e iniciou uma profunda amizade com o projecionista.;https://m.media-amazon.com/images/M/MV5BM2FhYjEyYmYtMDI1Yy00YTdlLWI2NWQtYmEzNzAxOGY1NjY2XkEyXkFqcGdeQXVyNTA3NTIyNDg@._V1_QL75_UX380_CR0,0,380,562_.jpg
Era uma Vez no Oeste;51. Era uma Vez no Oeste;1968;8.5;Faroeste;Um misterioso estranhoe se junta com um bandido para proteger a uma viúva.;https://m.media-amazon.com/images/M/MV5BNzZiNjA5NzMtOGU1My00NjRiLTg4ODQtMTllNTNlZjYxNjQ3XkEyXkFqcGdeQXVyMTAyOTE2ODg0._V1_QL75_UY562_CR9,0,380,562_.jpg
Luzes da Cidade;54. Luzes da Cidade;1931;8.5;Comédia;Com a ajuda de um homem rico, bêbado e imprevisível, um vagabundo ingênuo que se apaixonou por uma florista cega tenta conseguir dinheiro para fornecer ajuda médica.;https://m.media-amazon.com/images/M/MV5BY2I4MmM1N2EtM2YzOS00OWUzLTkzYzctNDc5NDg2N2IyODJmXkEyXkFqcGdeQXVyNzkwMjQ5NzM@._V1_QL75_UX380_CR0,4,380,562_.jpg
A Vida dos Outros;60. A Vida dos Outros;2006;8.4;Drama;Em 1984, em Berlim Oriental, um agente da polícia secreta que cuida de um escritor e sua mulher se vê cada vez mais absorvido em suas vidas.;https://m.media-amazon.com/images/M/MV5BZmIxNDBhMTEtMTM0OS00OGM5LTlkZjYtNzNlOTk4MTM0NGQ4XkEyXkFqcGdeQXVyMTAyOTE2ODg0._V1_QL75_UY562_CR8,0,380,562_.jpg
Oldboy;73. Oldboy;2003;8.4;Ação;Depois de ter sido raptado e preso por quinze anos, Oh Dae-Su é libertado, e descobre que tem 5 dias para encontrar seu sequestrador.;https://m.media-amazon.com/images/M/MV5BMTI3NTQyMzU5M15BMl5BanBnXkFtZTcwMTM2MjgyMQ@@._V1_QL75_UX380_CR0,0,380,562_.jpg
O Barco: Inferno no Mar;77. O Barco: Inferno no Mar;1981;8.4;Drama;O mundo claustrofóbico de um submarino da Segunda Guerra Mundial, cheio de tédio, sujeira e terror.;https://m.media-amazon.com/images/M/MV5BMGEwNzBiMWItNmQ1Yi00MzEwLWFkY2ItNWE3NGJhYjEwZmVjXkEyXkFqcGdeQXVyMTAyOTE2ODg0._V1_QL75_UY562_CR8,0,380,562_.jpg
Princesa Mononoke;81. Princesa Mononoke;1997;8.3;Animação;Numa viagem para descobrir a cura contra a maldição de Tatarigami, Ashitaka, se encontra uma guerra entre os deuses da foresta e Tatara, uma colônia mineira.;https://m.media-amazon.com/images/M/MV5BNTZkYmI0MmEtNGFlZC00OWZjLWFjMmItMjk1OWZkOWJiZGVjXkEyXkFqcGdeQXVyMTMxODk2OTU@._V1_QL75_UX380_CR0,4,380,562_.jpg
Your Name.;84. Your Name.;2016;8.4;Animação;Dois estranhos estão ligados de uma maneira bizarra, mais quando uma conexão é formada, a distância será a única coisa que os manterá separados?;https://m.media-amazon.com/images/M/MV5BODRmZDVmNzUtZDA4ZC00NjhkLWI2M2UtN2M0ZDIzNDcxYThjL2ltYWdlXkEyXkFqcGdeQXVyNTk0MzMzODA@._V1_QL75_UX380_CR0,0,380,562_.jpg
3 Idiotas;85. 3 Idiotas;2009;8.4;Comédia;Dois amigos procuram seu companheiro perdido. Eles se lembram de seus dias de faculdade e como seu amigo os inspirou a pensar de maneira diferente, mesmo quando o resto do mundo os chamava idiotas.;https://m.media-amazon.com/images/M/MV5BNTkyOGVjMGEtNmQzZi00NzFlLTlhOWQtODYyMDc2ZGJmYzFhXkEyXkFqcGdeQXVyNjU0OTQ0OTY@._V1_QL75_UY562_CR5,0,380,562_.jpg
Céu E Inferno;86. Céu E Inferno;1963;8.4;Policial;Um executivo de uma empresa de calçados torna-se vítima de extorsão quando o filho de seu motorista é sequestrado e retido para resgate.;https://m.media-amazon.com/images/M/MV5BOTI4NTNhZDMtMWNkZi00MTRmLWJmZDQtMmJkMGVmZTEzODlhXkEyXkFqcGdeQXVyNjc1NTYyMjg@._V1_QL75_UX380_CR0,4,380,562_.jpg
Cafarnaum;89. Cafarnaum;2018;8.4;Drama;Ao cumprir uma sentença de cinco anos por um crime violento, uma criança de 12 anos processou seus pais por negligência.;https://m.media-amazon.com/images/M/MV5BMDU2NTYyMTMtZTY0YS00ZWVlLTg3OTktOTY1NmM4MzExOTZhXkEyXkFqcGdeQXVyMTAzMDM4MjM0._V1_QL75_UY562_CR2,0,380,562_.jpg
Vá e Veja;91. Vá e Veja;1985;8.4;Drama;Depois de encontrar uma arma, um jovem se une as forças da resistença russa contra os alemães na segunda guerra mundial.;https://m.media-amazon.com/images/M/MV5BZmU4YzNkNTEtYThkYS00YWIxLTg5OTgtZGNhMWYwMjY1ZDhlXkEyXkFqcGdeQXVyMTAyOTE2ODg0._V1_QL75_UY562_CR11,0,380,562_.jpg
A Caça;95. A Caça;2012;8.3;Drama;Um professor vive uma vida solitária enquanto luta pela custódia de seu filho. Sua vida melhora lentamente quando ele encontra o amor e recebe boas notícias de seu filho, mas sua sorte está prestes a mudar por uma pequena mentira inocente.;https://m.media-amazon.com/images/M/MV5BYjg2Nzg3MzQtZDk0Mi00OTJjLWI4YTAtNzUwZTI3N2E0ZDIzXkEyXkFqcGdeQXVyMTAyOTE2ODg0._V1_QL75_UY562_CR2,0,380,562_.jpg
Viver;97. Viver;1952;8.3;Drama;Depois de descobrir que tem câncer terminal, um burocrata tenta encontrar um sentido para sua vida.;https://m.media-amazon.com/images/M/MV5BYWM1YmZkNTctZDAwNy00ZTY4LWFjMTktYzU4ZjViMmU1OTJmXkEyXkFqcGdeQXVyMTA0MTM5NjI2._V1_QL75_UX380_CR0,4,380,562_.jpg
M, o Vampiro de Dusseldorf;100. M, o Vampiro de Dusseldorf;1931;8.3;Policial;Quando a polícia de uma cidade alemã não consegue encontrar um assassino de crianças, outros criminosos decidem ajudar na caçada humana.;https://m.media-amazon.com/images/M/MV5BODA4ODk3OTEzMF5BMl5BanBnXkFtZTgwMTQ2ODMwMzE@._V1_QL75_UX380_CR0,4,380,562_.jpg
O Fabuloso Destino de Amélie Poulain;105. O Fabuloso Destino de Amélie Poulain;2001;8.3;Comédia;Amélie é uma parisiense ingênua com seu próprio senso de justiça. Ela decide ajudar as pessoas ao seu redor e, no caminho, descobre o amor.;https://m.media-amazon.com/images/M/MV5BZGEwNjkzYzktNzRkZC00OGUwLWE2OWEtZDg4YzE2MGRlOGQxXkEyXkFqcGdeQXVyMTU3NTI2OTky._V1_QL75_UX380_CR0,4,380,562_.jpg
Incêndios;109. Incêndios;2010;8.3;Drama;Os gêmeos viajam para o Oriente Médio para descobrir sua história familiar e cumprir os últimos desejos de sua mãe.;https://m.media-amazon.com/images/M/MV5BMWE3MGYzZjktY2Q5Mi00Y2NiLWIyYWUtMmIyNzA3YmZlMGFhXkEyXkFqcGdeQXVyMTMxODk2OTU@._V1_QL75_UX380_CR0,4,380,562_.jpg
A Separação;115. A Separação;2011;8.3;Drama;Um casal é confrontado com uma decisão difícil, melhorar a vida de seu filho mudando-se para outro país ou ficar no Irã e cuidar de um pai que se deteriora e com Alzheimer.;https://m.media-amazon.com/images/M/MV5BN2JmMjViMjMtZTM5Mi00ZGZkLTk5YzctZDg5MjFjZDE4NjNkXkEyXkFqcGdeQXVyMTMxODk2OTU@._V1_QL75_UX380_CR0,0,380,562_.jpg
Metrópolis;117. Metrópolis;1927;8.3;Drama;Numa cidade futurística dividida entre os trabalhadores e os planejadores, o filho do maior planejador se apaixona por uma trabalhadora.;https://m.media-amazon.com/images/M/MV5BMTg5YWIyMWUtZDY5My00Zjc1LTljOTctYmI0MWRmY2M2NmRkXkEyXkFqcGdeQXVyMTMxODk2OTU@._V1_QL75_UY562_CR0,0,380,562_.jpg
Ladrões de Bicicletas;119. Ladrões de Bicicletas;1948;8.3;Drama;Na Itália da pós-guerra a bicicleta de um homem da classe trabalhadora é roubada. Ele e o filho partiram para encontrá-la.;https://m.media-amazon.com/images/M/MV5BNmI1ODdjODctMDlmMC00ZWViLWI5MzYtYzRhNDdjYmM3MzFjXkEyXkFqcGdeQXVyMTMxODk2OTU@._V1_QL75_UY562_CR5,0,380,562_.jpg
Como Estrelas na Terra;122. Como Estrelas na Terra;2007;8.3;Drama;Um garoto de oito anos é acusado de ser problemático e preguiçoso, até que o novo professor de arte tem a paciência e compaixão para descobrir o verdadeiro problema por trás de suas lutas na escola.;https://m.media-amazon.com/images/M/MV5BYjY0MGU3MmQtMGVhOS00M2IyLWI1MTktZGUxMzBjMTE5ZDA3XkEyXkFqcGdeQXVyNjU0OTQ0OTY@._V1_QL75_UY562_CR5,0,380,562_.jpg
A Queda! As Últimas Horas de Hitler;125. A Queda! As Últimas Horas de Hitler;2004;8.2;Biografia;O último secretário de Hitler relata seus últimos dias em seu bunker de Berlim no final da Segunda Guerra Mundial.;https://m.media-amazon.com/images/M/MV5BMWM2Y2ZlZDYtZTEwOC00M2NhLTgzNTYtN2Y5NDQ1NmFmN2Y5XkEyXkFqcGdeQXVyMTAyOTE2ODg0._V1_QL75_UX380_CR0,3,380,562_.jpg
Dangal;126. Dangal;2016;8.3;Ação;O lutador Mahavir e suas filhas lutadoras procuram a gloria contra a opressão social nos jogos do Commonwealth.;https://m.media-amazon.com/images/M/MV5BMTQ4MzQzMzM2Nl5BMl5BanBnXkFtZTgwMTQ1NzU3MDI@._V1_QL75_UY562_CR11,0,380,562_.jpg
Por uns Dólares a Mais;128. Por uns Dólares a Mais;1965;8.2;Drama;Dois caçadores de recompensas com as mesmas intenções se reúnem para encontrar um criminoso ocidental.;https://m.media-amazon.com/images/M/MV5BMzJlZTNkYjQtMTE1OS00YTJlLTgxNjItYzg4NTllODdkMzBiXkEyXkFqcGdeQXVyMjUzOTY1NTc@._V1_QL75_UX380_CR0,7,380,562_.jpg
Ran;139. Ran;1985;8.2;Ação;No Japão medieval, um senhor feudal decide abdicar e entregar seus domínios aos seus três filhos. Mas ele não é capaz de ver que esses novos poderes irão corrompê-los e levá-los a enfrentar um ao outro, e contra ele.;https://m.media-amazon.com/images/M/MV5BMmU1NGYwZWYtOWExNi00ZTEyLTgwMmUtM2ZlMDVjNWM4YjVlXkEyXkFqcGdeQXVyMjUzOTY1NTc@._V1_QL75_UX380_CR0,8,380,562_.jpg
O Labirinto do Fauno;142. O Labirinto do Fauno;2006;8.2;Drama;Na Espanha de 1944, a filha dum oficial do exército escapa a um mundo de fantasia.;https://m.media-amazon.com/images/M/MV5BMTM2NzM3MzMtODk4NC00NjJiLWFmMGUtOTYwZTE4NjI1NzMxXkEyXkFqcGdeQXVyMTU3NTI2OTky._V1_QL75_UX380_CR0,4,380,562_.jpg
Yojimbo, o Guarda-Costas;148. Yojimbo, o Guarda-Costas;1961;8.2;Ação;Um astuto ronin chega a uma cidade dividida por duas quadrilhas criminosas e decide se confrontar para libertar a cidade.;https://m.media-amazon.com/images/M/MV5BZThiZjAzZjgtNDU3MC00YThhLThjYWUtZGRkYjc2ZWZlOTVjXkEyXkFqcGdeQXVyNTA4NzY1MzY@._V1_QL75_UX380_CR0,4,380,562_.jpg
Rashomon;154. Rashomon;1950;8.2;Policial;A violação de uma noiva e o assassinato de seu marido samurai são lembrados desde a perspectiva de um bandido, da noiva, do fantasma do samurai e de um lenhador.;https://m.media-amazon.com/images/M/MV5BMjEzMzA4NDE2OF5BMl5BanBnXkFtZTcwNTc5MDI2NQ@@._V1_QL75_UX380_CR0,1,380,562_.jpg
O Castelo Animado;160. O Castelo Animado;2004;8.2;Animação;Uma jovem sem autoconfiança é amaldiçoada com um corpo envelhecido por uma bruxa odiosa. Sua única chance de quebrar o feitiço é um jovem feiticeiro em um castelo itinerante.;https://m.media-amazon.com/images/M/MV5BNmM4YTFmMmItMGE3Yy00MmRkLTlmZGEtMzZlOTQzYjk3MzA2XkEyXkFqcGdeQXVyMTMxODk2OTU@._V1_QL75_UX380_CR0,4,380,562_.jpg
O Segredo dos Seus Olhos;165. O Segredo dos Seus Olhos;2009;8.2;Drama;Um assessor jurídico aposentado escreve um romance com a esperança de fechar um de seus antigos casos de homicídio, que permanece sem solução, e superar o amor não correspondido que sentia por seu chefe. Décadas depois, ambas as memórias continuam a persegui-lo.;https://m.media-amazon.com/images/M/MV5BNDFiZWMwYTItYjk2NC00YmI4LTkwYmQtMWRlODE3OWQ4ZjllXkEyXkFqcGdeQXVyMTAyOTE2ODg0._V1_QL75_UY562_CR6,0,380,562_.jpg
Meu Amigo Totoro;175. Meu Amigo Totoro;1988;8.1;Animação;Quando duas meninas se mudam para o campo para ficar perto de sua mãe doente, elas têm aventuras com os maravilhosos espíritos da floresta que moram nas proximidades.;https://m.media-amazon.com/images/M/MV5BZWEwZmYxNTEtNmExMi00ZWExLWI0MTYtOTM3ZTIxZDk1MmZmXkEyXkFqcGdeQXVyNzg5MzIyOA@@._V1_QL75_UY562_CR9,0,380,562_.jpg
Filhos do Paraíso;179. Filhos do Paraíso;1997;8.2;Drama;Depois que uma criança perde o par de sapatos de sua irmã, ele embarca em uma série de aventuras para encontrá-los. Quando não consegue, ele tenta uma nova maneira de procurá-los.;https://m.media-amazon.com/images/M/MV5BZmY2ZWNmNjUtZmIwZC00M2Q0LWE1MGMtNjVkNTNjNTA4NWZkXkEyXkFqcGdeQXVyMTAyOTE2ODg0._V1_QL75_UY562_CR6,0,380,562_.jpg
Em Busca do Ouro;183. Em Busca do Ouro;1925;8.1;Aventura;Um garimpeiro vai ao Klondike em busca de ouro e encontra muito mais que isso.;https://m.media-amazon.com/images/M/MV5BZjEyOTE4MzMtNmMzMy00Mzc3LWJlOTQtOGJiNDE0ZmJiOTU4L2ltYWdlXkEyXkFqcGdeQXVyNTAyODkwOQ@@._V1_QL75_UY562_CR16,0,380,562_.jpg
A General;191. A General;1926;8.1;Ação;Uns espiões roubam a amada locomotiva de um engenheiro, ele a persegue sozinho através das linhas inimigas.;https://m.media-amazon.com/images/M/MV5BYmRiMDFlYjYtOTMwYy00OGY2LWE0Y2QtYzQxOGNhZmUwNTIxXkEyXkFqcGdeQXVyNzkwMjQ5NzM@._V1_QL75_UX380_CR0,1,380,562_.jpg
Memórias de um Assassino;192. Memórias de um Assassino;2003;8.1;Policial;Em uma pequena província coreana em 1986, três detetives estão procurando o culpado de uma série de estupros e assassinatos de mulheres jovens.;https://m.media-amazon.com/images/M/MV5BZGExZTdiYzktMDk3Mi00N2U2LThiMWMtZjZiNDcxMmU2MDM5XkEyXkFqcGdeQXVyMTAyOTE2ODg0._V1_QL75_UY562_CR8,0,380,562_.jpg
Morangos Silvestres;194. Morangos Silvestres;1957;8.1;Drama;Depois de viver uma vida marcada pela frieza, um professor idoso é forçado a confrontar o vazio de sua existência.;https://m.media-amazon.com/images/M/MV5BZWQ0YzM3MTUtOGQ5YS00ZGY0LWIzMTUtY2JmNGFmMWE0MTczXkEyXkFqcGdeQXVyMTAyOTE2ODg0._V1_QL75_UY562_CR9,0,380,562_.jpg
O Salário do Medo;195. O Salário do Medo;1953;8.2;Aventura;Em uma aldeia da América do Sul, quatro homens são contratados para transportar uma remessa urgente de nitroglicerina, mas sem o equipamento de segurança.;https://m.media-amazon.com/images/M/MV5BMTIwZWMzOTQtZTJjYy00ZTYwLThlODEtNjkxNzhiNGU0MWQ5XkEyXkFqcGdeQXVyMTAyOTE2ODg0._V1_QL75_UY562_CR11,0,380,562_.jpg
Relatos Selvagens;197. Relatos Selvagens;2014;8.1;Comédia;Sies historias curtas que exploram o comportamento humano de pessoas desesperadas.;https://m.media-amazon.com/images/M/MV5BODVkZjVjMGYtYzY3NS00YzBkLWE4NDEtODc4YmJlODRmNTI1XkEyXkFqcGdeQXVyMTAyOTE2ODg0._V1_QL75_UY562_CR2,0,380,562_.jpg
Bancando o Águia;198. Bancando o Águia;1924;8.2;Ação;Um projecionista de cinema deseja ser um detetive e coloca suas magras habilidades em prática quando um rival o incrimina por roubar o relógio de bolso do pai de sua namorada.;https://m.media-amazon.com/images/M/MV5BZWFhOGU5NDctY2Q3YS00Y2VlLWI1NzEtZmIwY2ZiZjY4OTA2XkEyXkFqcGdeQXVyMDI2NDg0NQ@@._V1_QL75_UX380_CR0,18,380,562_.jpg
O Sétimo Selo;206. O Sétimo Selo;1957;8.1;Drama;Um homem procura respostas sobre a vida, a morte e a existência de Deus enquanto joga xadrez contra a morte durante a Morte Negra.;https://m.media-amazon.com/images/M/MV5BZjczMjliYTEtZmI0My00NDk3LTlmOGUtY2U1ZDgzZTkzYTYxXkEyXkFqcGdeQXVyMTE2OTczNjU4._V1_QL75_UY562_CR52,0,380,562_.jpg
Era uma Vez em Tóquio;210. Era uma Vez em Tóquio;1953;8.1;Drama;Um casal de idosos visita seus filhos e netos na cidade, mas recebe pouca atenção.;https://m.media-amazon.com/images/M/MV5BZmQwYmRmOTgtYmNjZC00NGZkLTg0ZGItMWMwY2ExMDllYWRiXkEyXkFqcGdeQXVyMjgyNjk3MzE@._V1_QL75_UY562_CR7,0,380,562_.jpg
O Martírio de Joana D'Arc;214. O Martírio de Joana D'Arc;1928;8.1;Biografia;Em 1431, Joana D'Arc é julgada sob acusações de heresia. Os advogados da Igreja tentam forçar Jeanne a retractar suas reivindicações de visões sagradas.;https://m.media-amazon.com/images/M/MV5BNjBjNDJiYTUtOWY0OS00OGVmLTg2YzctMTE0NzVhODM1ZWJmXkEyXkFqcGdeQXVyNjU0OTQ0OTY@._V1_QL75_UX380_CR0,16,380,562_.jpg
Jai Bhim;219. Jai Bhim;2021;8.8;Policial;Quando um homem tribal é preso por um caso de suposto roubo, sua esposa recorre a um advogado de direitos humanos para ajudá-lo a fazer justiça.;https://m.media-amazon.com/images/M/MV5BNzFkM2FhMzQtYjUwZi00N2Y3LWFkZWItMmZmMjQxNGQwZmNhXkEyXkFqcGdeQXVyODEyNjEwMDk@._V1_QL75_UY562_CR35,0,380,562_.jpg
O Ódio;225. O Ódio;1995;8.1;Policial;24 horas na vida de três jovens nos subúrbios franceses no dia seguinte a uma rebelião violenta.;https://m.media-amazon.com/images/M/MV5BOTQxOGU0OWUtMzExYy00ZjIxLWJmMzAtNTI1Y2YxYTMxN2RkXkEyXkFqcGdeQXVyMjUzOTY1NTc@._V1_QL75_UX380_CR0,1,380,562_.jpg
Meu Pai e Meu Filho;235. Meu Pai e Meu Filho;2005;8.2;Drama;A família de um jornalista de esquerda é separada após o golpe militar na Turquia em 1980.;https://m.media-amazon.com/images/M/MV5BNzEzMWYyYjEtNmVjZS00YTAyLWIyOTgtMzEzNzQxMTQzZTgwXkEyXkFqcGdeQXVyMTA0MTM5NjI2._V1_QL75_UX380_CR0,4,380,562_.jpg
A Criada;236. A Criada;2016;8.1;Drama;Uma mulher é contratada como criada de uma herdeira japonesa, mas secretamente esta envolvida em um plano para defraudá-la.;https://m.media-amazon.com/images/M/MV5BY2JjYjYwYTUtZjNkYi00MjgzLTliYjEtMWQ4YjdhNDFkNzUyXkEyXkFqcGdeQXVyMjgyOTI1ODY@._V1_QL75_UY562_CR5,0,380,562_.jpg
A Batalha de Argel;237. A Batalha de Argel;1966;8.1;Drama;Nos anos 50, o medo e a violência aumentam à medida que o povo de Argel lutava pela independência do governo francês.;https://m.media-amazon.com/images/M/MV5BN2M4YTA4ZTEtN2EyNy00YTlmLWE4YzYtYjYyYjRkMWM4ZDM0XkEyXkFqcGdeQXVyMjUzOTY1NTc@._V1_QL75_UX380_CR0,7,380,562_.jpg
Amores Brutos;238. Amores Brutos;2000;8.1;Drama;Um terrível acidente de carro conecta três histórias, cada uma envolvendo personagens que lidam com a perda, o arrependimento e as duras realidades da vida, tudo em nome do amor.;https://m.media-amazon.com/images/M/MV5BZjUxNmEwOGItMTBmYi00MWQ1LWExY2MtNDUxMjI0OWM4M2NiXkEyXkFqcGdeQXVyMjUzOTY1NTc@._V1_QL75_UX380_CR0,3,380,562_.jpg
A Canção da Estrada;242. A Canção da Estrada;1955;8.2;Drama;O padre Harihar Ray, sonhando com uma vida melhor para si e sua família, deixa sua aldeia rural de Bengala em busca de trabalho.;https://m.media-amazon.com/images/M/MV5BMmFkNDY5OTktNzY3Yy00OTFlLThhNjktOTRhMmZjZmIxYjAxXkEyXkFqcGdeQXVyNTgyNTA4MjM@._V1_QL75_UX380_CR0,4,380,562_.jpg
Os Incompreendidos;246. Os Incompreendidos;1959;8.1;Policial;Uma criança, sem atenção, entra em uma vida de pequenos crimes.;https://m.media-amazon.com/images/M/MV5BYjZmOWI1NTEtZjczYi00NTZhLTkyZTQtZjAyMWRkNzZkYTE5XkEyXkFqcGdeQXVyMTY3NTY5OTcx._V1_QL75_UY562_CR17,0,380,562_.jpg
Quando Duas Mulheres Pecam;247. Quando Duas Mulheres Pecam;1966;8.1;Drama;Uma enfermeira é encarregada de uma atriz silenciosa e descobre que sua personalidade parece convergir em uma.;https://m.media-amazon.com/images/M/MV5BYmFlOTcxMWUtZTMzMi00NWIyLTkwOTEtNjIxNmViNzc2Yzc1XkEyXkFqcGdeQXVyMjUzOTY1NTc@._V1_QL75_UX380_CR0,8,380,562_.jpg
O Poderoso Chefão II;4. O Poderoso Chefão II;1974;9.0;Policial;Em 1950, Michael Corleone, agora à frente da família, tenta expandir o negócio do crime a Las Vegas, Los Angeles e Cuba. Paralelamente, é revelada a história de Vito Corleone, e de como saiu da Sicília e chegou a Nova Iorque.;https://m.media-amazon.com/images/M/MV5BOGM2M2Q0ZWQtZjc5NC00NDY4LWIxYTktMDE4ZjIyYTRlNTIyXkEyXkFqcGdeQXVyODc0OTEyNDU@._V1_QL75_UY562_CR11,0,380,562_.jpg
12 Homens e uma Sentença;5. 12 Homens e uma Sentença;1957;9.0;Policial;O julgamento de um assassinato em Nova Iorque é frustrado por um único membro, cujo ceticismo força o júri a considerar cuidadosamente as evidências antes de dar o veredito.;https://m.media-amazon.com/images/M/MV5BODRmNWRiYmUtNGM2Yy00NTgwLTgxNzMtMGExYzI5NjllNjBhXkEyXkFqcGdeQXVyMTAzMDM4MjM0._V1_QL75_UY562_CR7,0,380,562_.jpg
A Lista de Schindler;6. A Lista de Schindler;1993;9.0;Biografia;Na Polônia ocupada pelos alemães durante a Segunda Guerra Mundial, o industrial Oskar Schindler começa a ser preocupar com seus trabalhadores judeus depois de testemunhar sua perseguição pelos nazistas.;https://m.media-amazon.com/images/M/MV5BYjM5ZjYxNjQtZjdhYi00NzBiLTgyNGItOGU3YTYwYWE0NmEzXkEyXkFqcGdeQXVyMTAzMDM4MjM0._V1_QL75_UX380_CR0,0,380,562_.jpg
O Senhor dos Anéis: O Retorno do Rei;7. O Senhor dos Anéis: O Retorno do Rei;2003;9.0;Ação;Gandalf e Aragorn lideram o Mundo dos Homens contra o exército de Sauron para desviar o olhar de Frodo e Sam quando eles se aproximam á Montanha da Perdição com o Um Anel.;https://m.media-amazon.com/images/M/MV5BNzZiOTI4MWItZGMxZC00NjZkLWJlOWUtMDY5YzE1NzhiNGRhXkEyXkFqcGdeQXVyODc0OTEyNDU@._V1_QL75_UY562_CR9,0,380,562_.jpg
Pulp Fiction - Tempo de Violência;8. Pulp Fiction - Tempo de Violência;1994;8.9;Policial;As vidas de dois assassinos da máfia, um boxeador, um gângster e sua esposa, e um par de bandidos se entrelaçam em quatro histórias de violência e redenção.;https://m.media-amazon.com/images/M/MV5BN2RiMTA1ZGQtOTNhYi00MjQyLTk0MzAtMWE1OTM2NWUxNzBkXkEyXkFqcGdeQXVyMTAzMDM4MjM0._V1_QL75_UX380_CR0,1,380,562_.jpg
O Senhor dos Anéis: A Sociedade do Anel;9. O Senhor dos Anéis: A Sociedade do Anel;2001;8.8;Ação;Um manso hobbit do Condado e oito companheiros partem em uma jornada para destruir o poderoso Um Anel e salvar a Terra-média das Trevas.;https://m.media-amazon.com/images/M/MV5BNDEyMzU0ODUtMTdjOS00Y2E2LWJlZmEtYmJjMmQ2NWZlNGQ1XkEyXkFqcGdeQXVyMTAzMDM4MjM0._V1_QL75_UY562_CR4,0,380,562_.jpg
Três Homens em Conflito;10. Três Homens em Conflito;1966;8.8;Aventura;Um impostor se junta com dois homens para encontrar fortuna num remoto cemitério.;https://m.media-amazon.com/images/M/MV5BNzE2MDJkNTktMzVkYS00ZWFlLWIzOWYtYzRhYjcyYzBmM2MwXkEyXkFqcGdeQXVyMTAyOTE2ODg0._V1_QL75_UY562_CR8,0,380,562_.jpg
Forrest Gump: O Contador de Histórias;11. Forrest Gump: O Contador de Histórias;1994;8.8;Drama;Os governos dos presidentes Kennedy e Johnson, os eventos do Vietnã e Watergate e outras histórias são mostradas através da perspectiva de um homem do Alabama com baixo quociente intelectual.;https://m.media-amazon.com/images/M/MV5BYWYwNWY0ZjMtYzUxZS00ODI3LTllNzctODNiNjhlNjcyNWM0XkEyXkFqcGdeQXVyMjcwMzM0OTI@._V1_QL75_UX380_CR0,4,380,562_.jpg
Clube da Luta;12. Clube da Luta;1999;8.8;Drama;Um trabalhador de escritório e um fabricante de sabonetes formam um clube de luta clandestino que evolui para algo muito maior.;https://m.media-amazon.com/images/M/MV5BNDVhNjJlZmMtODJhOS00OWE4LTgxMzAtNjVlMzI0ZjI0OTMzXkEyXkFqcGdeQXVyMTAzMDM4MjM0._V1_QL75_UY562_CR10,0,380,562_.jpg
O Senhor dos Anéis: As Duas Torres;13. O Senhor dos Anéis: As Duas Torres;2002;8.8;Ação;Enquanto Frodo e Sam estão perto de Mordor com a ajuda de Gollum, a divida comunhão luta contra Saruman e os Isengards.;https://m.media-amazon.com/images/M/MV5BZGMxZTdjZmYtMmE2Ni00ZTdkLWI5NTgtNjlmMjBiNzU2MmI5XkEyXkFqcGdeQXVyNjU0OTQ0OTY@._V1_QL75_UX380_CR0,14,380,562_.jpg
Star Wars: Episódio V - O Império Contra-Ataca;15. Star Wars: Episódio V - O Império Contra-Ataca;1980;8.7;Ação;Os rebeldes derrotaram o Império no planeta congelado Hoth. Luke Skywalker começa a treinar como um Jedi com Yoda, enquanto seus amigos são perseguidos por Darth Vader.;https://m.media-amazon.com/images/M/MV5BNDQxYTExOWQtMzE4Zi00Yzg2LWEzYjUtMTBjMDdiYmY3ZTdjXkEyXkFqcGdeQXVyODc0OTEyNDU@._V1_QL75_UX380_CR0,0,380,562_.jpg
Matrix;17. Matrix;1999;8.7;Ação;Um hacker aprende com os misteriosos rebeldes sobre a verdadeira natureza de sua realidade e seu papel na guerra contra seus controladores.;https://m.media-amazon.com/images/M/MV5BMzYxZGIyM2MtZDQ0NC00Y2M5LTk0NTAtNDk5ZTg1MjZjMTFiXkEyXkFqcGdeQXVyMTY4MjE1MDA@._V1_QL75_UX380_CR0,1,380,562_.jpg
Os Bons Companheiros;18. Os Bons Companheiros;1990;8.7;Biografia;A historia do Henry Hill e sua vida na máfia, sua relação com sua esposa Karen Hill e seus colegas da máfia Jimmy Conway e Tommy DeVito no sindicato italo-americano do crime.;https://m.media-amazon.com/images/M/MV5BOTI1ZWU1MWUtYzRjZC00ZjA3LTliOTMtZjkxYTczYTE2N2YwXkEyXkFqcGdeQXVyMTAzMDM4MjM0._V1_QL75_UY562_CR9,0,380,562_.jpg
Um Estranho no Ninho;19. Um Estranho no Ninho;1975;8.7;Drama;Um criminoso alega insanidade para ser enviado a um centro de saúde mental, onde se rebela contra a opressiva enfermeira e mobiliza os pacientes a quem ela atemoriza.;https://m.media-amazon.com/images/M/MV5BYjBlZjA2OTctZjVjMS00YzYzLTk3NDYtNjc4ZWVmNzQyNjZkXkEyXkFqcGdeQXVyMTAyOTE2ODg0._V1_QL75_UY562_CR9,0,380,562_.jpg
