title_pt;title_en;year;rating;genre;sinopse
Uma Comédia Nada Romântica;22. Date Movie;2006;2.8;Comédia;Paródia de comédias românticas que focalizam um homem, seu amor platônico, seus pais e o pai da menina.
Cats;23. Cats;2019;2.8;Comédia;"Uma tribo de gatos chamados de Jellicles devem decidir qual deles irá para um lugar especial chamado ""Heavyside"", e assim passar para uma nova vida."
Daniel der Zauberer;24. Daniel the Wizard;2004;1.2;Comédia;Evil assassins want to kill Daniel Kublbock, the third runner up for the German Idols.
Bebês Geniais;25. Baby Geniuses;1999;2.5;Comédia;Os cientistas mantêm bebês super inteligentes falando em cativeiro, mas as coisas pioram quando um gênio bebê se confunde com seu gêmeo.
Glitter: O Brilho de uma Estrela;26. Glitter;2001;2.4;Drama;A young singer dates a disc jockey who helps her get into the music business, but their relationship become complicated as she ascends to super stardom.
A Centopéia Humana 3;27. The Human Centipede III (Final Sequence);2015;2.7;Comédia;Na prisão, Bill Boss lida com prisioneiros rebeldes e um governador incompetente. Dwight, o seu braço-direito, surge com uma ideia capaz de revolucionar o sistema penitenciário americano: a criação de uma centopeia humana de 500 pessoas.
Tubarão 4: A Vingança;28. Jaws: The Revenge;1987;3.0;Aventura;A viúva do chefe Brody acredita que sua família está sendo deliberadamente atacada por outro tubarão em busca de vingança.
Invasão Cósmica;29. Cosmic Sin;2021;2.5;Ação;Sete soldados desonestos lançam um ataque preventivo contra uma civilização alienígena recém-descoberta, na esperança de encerrar uma guerra interestelar, antes que ela comece.
Trolls II;30. Troll 2;1990;2.9;Comédia;Uma família em férias descobre que toda a cidade é habitada por trasgos disfarçados de humanos, que planejam comê-los.
BloodRayne;31. BloodRayne;2005;3.0;Ação;No século XVIII, uma vampira escapa do show de aberrações, do qual ela participou. Ela se junta a um grupo de caçadores de vampiros para matar o homem que estuprou sua mãe.
365 Dias: Hoje;32. 365 Days: This Day;2022;2.6;Drama;Laura e Massimo estão de volta, mais intensos do que nunca. Mas a família de Massimo e um homem disposto a fazer de tudo para conquistar Laura complicam a vida do casal.
Hobgoblins;33. Hobgoblins;1988;2.2;Comédia;A young security guard must track down diminutive aliens who kill people even as they make their fantasies come true.
O Apocalipse;34. Left Behind;2014;3.1;Ação;Um pequeno grupo de sobreviventes é deixado para trás depois que milhões de pessoas desaparecem repentinamente e o mundo mergulha no caos e na destruição.
Olhos Famintos: Renascimento;35. Jeepers Creepers: Reborn;2022;2.5;Terror;Forçada a viajar com o seu namorado, Laine começa a experimentar premonições associadas com o mito urbano de The Creeper. Laine acredita que algo de sobrenatural foi convocado, e que ela está no centro de tudo isto.
365 dni;36. 365 Days;2020;3.3;Drama;Massimo é membro da família mafiosa da Sicília e Laura é diretora de vendas. Ela não espera que em uma viagem à Sicília Massimo a sequestre e lhe dê 365 dias para se apaixonar por ele.
Elk*rtuk;37. The Cost of Deception;2021;1.5;Ação;When a young, ambitious market researcher finds out her boss is involved in the leaking of a scandalous Prime Minister speech, she decides to investigate the case to gain a position among the big-shots. Based on actual events.
Enes Batur Hayal mi Gerçek mi?;38. Enes Batur: Imagination or Reality?;2018;2.0;Comédia;Enes Batur has to decide between going to college or being a professional YouTuber.
Tudo pela Honra do Meu Pai;39. Who's Your Caddy?;2007;2.2;Comédia;When a rap mogul from Atlanta tries to join a conservative country club in the Carolinas he runs into fierce opposition from the board President- but it's nothing that he and his entourage can't handle.
Cada um tem a Gêmea que Merece;40. Jack and Jill;2011;3.3;Comédia;Jack, um publicitário de sucesso com uma linda família, enlouquece com a visita de sua irmã gêmea Jill no dia de Ação de Graças. As coisas ficam ainda mais fora de controle quando Jill decide ficar mais tempo.
Rollerball;41. Rollerball;2002;3.1;Ação;Um esporte violento que pode ter sérias consequências torna-se moda em 2005.
Papai Noel Conquista os Marcianos;42. Santa Claus Conquers the Martians;1964;2.7;Aventura;The Martians kidnap Santa Claus because there is nobody on Mars to give their children presents.
Slender Man: Pesadelo Sem Rosto;43. Slender Man;2018;3.2;Terror;Em uma pequena cidade de Massachusetts, um grupo de amigos, fascinado pela tradição da Internet do Slender Man, tenta provar que ele realmente não existe, até que um deles desaparece misteriosamente.
Mulher-Gato;44. Catwoman;2004;3.4;Ação;Uma mulher tímida, dotada de velocidade, reflexos e sentidos de um felino, está entre a criminalidade e o heroísmo, mesmo enquanto um detetive a persegue insistentemente, fascinado por suas duas personas.
Kazaam;45. Kazaam;1996;3.1;Comédia;Uma criança perturbada inadvertidamente libera um gênio, que deve conceder a ele quaisquer três desejos que ele solicitar.
Adipurush;46. Adipurush;2023;3.3;Ação;Uma adaptação moderna do épico indiano Ramayana que acompanha a jornada do príncipe exilado Raghav para resgatar sua esposa Janaki do rei demônio Lankesh.
Os Vampiros Que Se Mordam;47. Vampires Suck;2010;3.4;Comédia;Uma paródia de filmes com temática vampiresca. Adolescente, Becca encontra-se dividida entre 2 meninos. Enquanto ela e seus amigos lutam com uma série de dramas diferentes, tudo vem à tona no baile.
Emoji: O Filme;48. The Emoji Movie;2017;3.4;Animação;Gene, um emoji multi-expressão, faz uma jornada para se tornar um emoji normal.
Steel - O Homem De Aço;49. Steel;1997;2.9;Ação;A scientist for the military turns himself into a cartoon-like superhero when a version of one of his own weapons is being used against enemies.
Jogos Famintos;50. The Starving Games;2013;3.2;Aventura;Nesta paródia dos Jogos Vorazes, Kantmiss Evershot deve lutar por sua vida nos 75os Jogos Anuais da Fome, onde também poderá ganhar um presunto velho, um cupom para um submarino de pés compridos e um picles parcialmente comido.
Student of the Year 2;51. Student of the Year 2;2019;2.2;Ação;A student must face off against bullies and overcome hurdles, both academic and romantic, to win his college's coveted Student of the Year trophy.
Vende-se Esta Casa;52. The Open House;2018;3.3;Terror;Um adolescente e sua mãe são assediados por forças ameaçadoras quando se mudam para um novo lar.
Laxmii;53. Laxmii;2020;2.5;Ação;Um fantasma procura vingança por ter sido prejudicado e assombra todos os que ficam na casa.
Ameaça no Espaço;54. Breach;2020;2.9;Ação;Na cúspide da paternidade, um jovem mecânico a bordo de uma arca interestelar para a Nova Terra deve superar um terror cósmico malévolo que tenta usar a nave espacial como arma.
Tees Maar Khan;55. Tees Maar Khan;2010;2.6;Comédia;Posando como produtor de cinema, um vigarista tenta enganar uma vila inteira para ajudá-lo a roubar um trem carregado de tesouros.
Ursinho Pooh: Sangue e Mel;56. Winnie the Pooh: Blood and Honey;2023;2.9;Terror;Após serem abandonados por Christopher, que foi para a faculdade, Ursinho Pooh e Leitão enlouquecem e juram vingança contra os seres humanos, partindo para uma caçada sangrenta em busca de uma nova fonte de comida.
Todo Mundo em Pânico 5;57. Scary Movie V;2013;3.5;Comédia;Um casal começa a experimentar certa atividade incomum depois de trazer para casa suas sobrinhas e sobrinhos perdidos. Com a ajuda de câmeras de vigilância doméstica, eles descobrem que estão sendo perseguidos por um demônio nefasto.
Debi & Lóide 2: Quando Debi Conheceu Lóide;58. Dumb and Dumberer: When Harry Met Lloyd;2003;3.4;Comédia;Estabelecido nos anos 80 quando Harry conheceu Lloyd na escola secundária, onde eles se cruzaram com um diretor malvado e um grupo de outros marginalizados como eles.
O Massacre da Serra Elétrica: O Retorno;59. Texas Chainsaw Massacre: The Next Generation;1995;3.3;Comédia;Um grupo de adolescentes sofre um acidente de carro no bosque do Texas na noite do baile de formatura e, em seguida, entra em uma antiga fazenda que é o lar de Leatherface e sua louca família de psicopatas-canibais.
Gunday;60. Gunday;2014;2.7;Ação;The lives of Calcutta's most powerful Gunday, Bikram and Bala, changes when Nandita enters it. Then a counter-force takes charge and a thriller unfolds.
The Room;61. The Room;2003;3.6;Drama;Johnny é um banqueiro de sucesso que vive feliz em uma casa em São Francisco com sua noiva Lisa, mas um dia ela fica entediada com ele e decide seduzir sua melhor amiga, Mark. A partir desse momento, nada será o mesmo novamente.
Mestre do Disfarce;62. The Master of Disguise;2002;3.3;Aventura;An Italian waiter fights off a criminal mastermind with his inherited powers of disguise.
Loucademia de Polícia 7: Missão Moscou;63. Police Academy: Mission to Moscow;1994;3.5;Comédia;O governo russo contrata veteranos da Academia de Polícia (1984) para ajudar a lidar com a máfia.
Acampamento do Papai;64. Daddy Day Camp;2007;3.2;Comédia;Seeking to offer his son the satisfying summer camp experience that eluded him as a child, the operator of a neighborhood day care center opens his own camp, only to face financial hardship and stiff competition from a rival camp.
Bratz: O Filme;65. Bratz;2007;3.1;Comédia;Durante o seu primeiro ano de liceu, quatro melhores namoradas confrontam-se com o presidente do corpo estudantil dominador, que as quer dividir em diferentes cliques sociais.
Hercules in New York;66. Hercules in New York;1970;3.3;Aventura;Hércules é enviado para a Terra onde encontra o amor verdadeiro e começa uma carreira promissora no fisiculturismo.
Far Cry: Fugindo do Inferno;67. Far Cry;2008;3.2;Ação;A trama segue o soldado Jack Carver e a repórter Valerie Constantine, que estão investigando uma ilha cheia de super soldados geneticamente modificados.
Mortal Kombat: A Aniquilação;68. Mortal Kombat: Annihilation;1997;3.6;Ação;Um grupo de guerreiros de artes marciais tem apenas seis dias para salvar a Terra de uma invasão.
Barb Wire - A Justiceira;69. Barb Wire;1996;3.5;Ação;Durante a Segunda Guerra Civil Americana, em 2017, Barb Wire é dona de uma boate chamada Hammerhead. As coisas se complicam quando seu ex-amante, Axel Hood, que é casado com a fugitiva Corrina Devonshire, volta novamente para sua vida.
Medo Ponto com Br;70. Feardotcom;2002;3.4;Policial;Um detetive de Nova York investiga mortes misteriosas que ocorrem 48 horas depois que os usuários acessam um site de nome fear dotcom.
Smolensk;71. Smolensk;2016;1.2;Drama;An inspired story of people affected by the 2010 crash of Polish Air Force Flight 101 in Smolensk, Russia. Fiery reporter Nina won't accept the story she's been given and is determined to find the truth.
3 Ninjas: Aventura na Mega Mountain;72. 3 Ninjas: High Noon at Mega Mountain;1998;2.9;Ação;The three unstoppable Ninja brothers fight to save their hero (Hulk Hogan) and Mega Mountain Amusement Park from the vicious kid-hating Medusa (Loni Anderson).
Batman & Robin;73. Batman & Robin;1997;3.8;Ação;Batman e Robin tentam manter seu relacionamento juntos, mesmo quando devem evitar que o Sr. Cold e Poison Ivy congelem Gotham City.
Baaghi 3;74. Baaghi 3;2020;2.1;Ação;A man embarks on a bloody rampage to save his kidnapped brother.
Cinquenta Tons de Preto;75. Fifty Shades of Black;2016;3.5;Comédia;Uma inexperiente estudante universitária conhece um rico empresário cujas práticas sexuais prejudicam o relacionamento dos dois.
Capitão América;76. Captain America;1990;3.2;Ação;"Congelado por décadas, o Capitão América é libertado para combater o criminoso ""Red Skull""."
Crossroads: Amigas para Sempre;77. Crossroads;2002;3.6;Comédia;Três melhores amigos de infância e um rapaz que acabaram de conhecer fazem uma viagem de carro pelo país, encontrando-se a se mesmos e sua amizade no processo.
Pequenos Espiões 4;78. Spy Kids 4: All the Time in the World;2011;3.5;Ação;Uma espià aposentada é chamada de volta à ativa, e para melhorar sua relaçào com seus novos enteados, os convida para a aventura de ajudá-la a impedir o maligno Timekeeper de assumir o controle do mundo.
O Mundo das Spice Girls;79. Spice World;1997;3.6;Comédia;O grupo pop mundialmente famoso, Spice Girls, percorre Londres em seu luxuoso ônibus de turismo com dois andares, vivendo várias aventuras e se apresentando para os fàs.
A História sem Fim 3;80. The NeverEnding Story III;1994;3.2;Aventura;Um menino deve restaurar a ordem quando um grupo de valentões rouba o livro mágico que funciona como um portal entre a Terra e o mundo imaginário de Fantasia.
Tubarão 3;81. Jaws 3-D;1983;3.7;Aventura;Um tubarào gigante de dez metros fica preso em um parque temático do SeaWorld e cabe aos filhos do chefe de polícia Brody resgatar a todos.
Superman IV: Em Busca da Paz;82. Superman IV: The Quest for Peace;1987;3.7;Ação;O Homem de Aço se encontra em cruzadas para o desarmamento nuclear e conhece a última criação de Lex Luthor, o Homem Nuclear.
Dungeons & Dragons - A Aventura Começa Agora;83. Dungeons & Dragons;2000;3.6;Ação;Profion, um tirano, tenta derrubar um reino pacífico governado por uma imperatriz cruel.
O Sacrifício;84. The Wicker Man;2006;3.8;Terror;Um xerife que investiga o desaparecimento de uma garota de uma pequena ilha descobre que há um mistério maior a ser resolvido entre a comunidade secreta da ilha.
Natal Sangrento;85. Black Christmas;2019;3.5;Terror;"Um grupo de estudantes é assediado por um estranho durante as férias de Natal. Um remake do filme de 1974 ""Noite do Terror""."
A Névoa;86. The Fog;2005;3.7;Terror;Um denso nevoeiro cheio de espíritos vingativos persegue uma próspera cidade insular ao largo da costa do Oregon, enquanto os seus habitantes tentam desvendar o segredo obscuro da sua cidade a fim de a deter.
D-War: Guerra dos Dragões;87. Dragon Wars: D-War;2007;3.5;Ação;Once in 500 years, ancient mythical creatures come to Earth, wreaking havoc and destruction. This time they must be stopped.
Mac - O Extraterrestre;88. Mac and Me;1988;3.4;Aventura;An alien trying to escape from NASA is befriended by a wheelchair-bound boy.
Dotado para Brilhar;89. Bucky Larson: Born to Be a Star;2011;3.3;Comédia;Um garoto do Meio-Oeste se muda para Hollywood para seguir os passos de seus pais e se tornar uma estrela pornô.
As Aventuras de Sharkboy e Lavagirl;90. The Adventures of Sharkboy and Lavagirl 3-D;2005;3.7;Ação;Um menino é recrutado por seus amigos imaginários Sharkboy e Lavagirl para ajudar a salvar seu planeta.
Piranha 2;91. Piranha 3DD;2012;3.8;Comédia;Após os eventos no Lago Vitória, a escola pré-histórica de piranhas sanguinárias se transforma em um parque aquático recém-inaugurado.
Eu Sei Quem me Matou;92. I Know Who Killed Me;2007;3.6;Terror;Uma pequena cidade fica em sobressalto quando Aubrey Fleming, uma jovem brilhante e promissora, é sequestrada e torturada. Quando foge e reaparece, afirma não ser a verdadeira Aubrey e que esta ainda está em perigo, às mãos do assassino.
O Guru do Amor;93. The Love Guru;2008;3.8;Comédia;Pitka, um americano criado fora de seu país por gurus, retorna aos Estados Unidos com o objetivo de entrar no negócio de autoajuda.
Se Beber, Não Entre no Jogo;94. The Hungover Games;2014;3.5;Aventura;A spoof on Se Beber, Não Case! (2009), Jogos Vorazes (2012) and other movies, TV series etc. 4 men, with hangovers after a bachelor party, find themselves in a future, dystopian, kill or be killed game.
Em Nome do Rei;95. In the Name of the King: A Dungeon Siege Tale;2007;3.8;Ação;Um homem chamado Farmer decide resgatar sua esposa sequestrada e vingar a morte de seu filho, dois atos cometidos pelos Krugs, uma raça de guerreiros animais controlados pelo malvado Galliano.
Os Vingadores;96. The Avengers;1998;3.8;Ação;Dois agentes britânicos se reúnem para impedir que Sir August de Wynter destrua o mundo com uma máquina que muda o clima.
Os Flintstones em Viva Rock Vegas;97. The Flintstones in Viva Rock Vegas;2000;3.7;Comédia;Os Flintstones e os Rubbles viajam para o Rock Vegas, onde Wilma é perseguida pelo playboy Chip Rockefeller.
A Centopeia Humana 2;98. The Human Centipede 2 (Full Sequence);2011;3.8;Terror;Inspirado pelo fictício Dr. Heiter, o perturbado Martin sonha em criar uma centopéia de 12 pessoas e pretende realizar sua fantasia.
Street Fighter: A Lenda de Chun-Li;99. Street Fighter: The Legend of Chun-Li;2009;3.7;Ação;Quando adolescente, Chun-Li testemunha seu pai ser sequestrado por um chefe do crime. Quando adulta, ela embarca em uma jornada de vingança e se torna a combatente vigilante do crime.
Stan Helsing;100. Stan Helsing;2009;3.6;Comédia;Terminando seu turno no aluguel de vídeos, Stan é pego por seu melhor amigo e 2 garotas bonitas, todos indo a uma festa de Halloween. Será que eles chegarão lá?
Você Não Tá Convidada pro Meu Bat Mitzvá!;You Are So Not Invited to My Bat Mitzvah;2023;6.0;Comédia;Stacey Friedman se prepara para seu bat mitzvah, mas seus planos se desfazem comicamente e ameaçam arruinar o evento.
Oppenheimer;Oppenheimer;2023;8.6;Biografia;A história do cientista americano J. Robert Oppenheimer e o seu papel no desenvolvimento da bomba atômica.
Barbie;Barbie;2023;7.3;Aventura;Viver na Terra da Barbie é ser um ser perfeito em um lugar perfeito. A menos que você tenha uma crise existencial completa. Ou que você seja um Ken.
The Flash;The Flash;2023;6.8;Ação;Barry Allen usa sua supervelocidade para mudar o passado, mas sua tentativa de salvar sua família cria um mundo sem super-heróis, forçando-o a correr por sua vida para salvar o futuro.
Rebel Moon - Parte 1: A Menina do Fogo;Rebel Moon;2023;;Ação;Uma jovem sai em busca de guerreiros de outros planetas para enfrentar um exército de invasores que aterrorizam a pacífica colônia onde vive.
Besouro Azul;Blue Beetle;2023;6.7;Ação;Jaime Reyes, um adolescente de origem mexicana que encontra um artefato alienígena que lhe dá um exoesqueleto mecanizado e poderes, tornando-o no Besouro Azul.
Drácula: A Última Viagem do Deméter;The Last Voyage of the Demeter;2023;6.2;Fantasia;"Baseado no livro ""Drácula"" de Bram Stoker, a história se passa a bordo do navio Demeter, onde uma tripulação condenada enfrenta eventos estranhos e aterrorizantes durante a viagem."
Megatubarão 2;Meg 2: The Trench;2023;5.2;Ação;Segue um piloto de submersível e um grupo de cientistas em águas profundas para explorar uma trincheira desconhecida na Fossa das Marianas. No caminho, eles encontrarão o Megalodon, um gigante tubarão pré-histórico.
Indiana Jones e a Relíquia do Destino;Indiana Jones and the Dial of Destiny;2023;6.7;Ação;O famoso arqueólogo e professor Jones regressa com novos desafios, perigos e aventuras, mas desta vez ele tem o sangue de uma nova geração para o ajudar nas suas descobertas e na sua luta contra um novo vilão.
Gran Turismo - De Jogador a Corredor;Gran Turismo;2023;7.4;Ação;A história real da realização de um sonho de um jogador de Gran Turismo, cujas habilidades no jogo o levaram a vencer uma série de competições da Nissan e a se tornar um piloto profissional de corrida. Baseado em uma história real.
O Protetor: Capítulo Final;The Equalizer 3;2023;7.1;Ação;Robert McCall se sente em casa no sul da Itália, mas descobre que seus amigos estão sob o controle do crime local. À medida que os eventos se tornam mortais, McCall sabe que deve tornar-se o protetor de seus amigos enfrentando a máfia.
Que Horas Eu Te Pego?;No Hard Feelings;2023;6.4;Comédia;Maddie, à beira da falência, é contratada por pais superprotetores para ajudar seu filho introvertido a se tornar mais confiante antes da faculdade. Ela tem apenas um verão para completar sua missão.
The Killer;The Killer;2023;7.4;Ação;Um assassino começa a colapsar psicologicamente enquanto começa a desenvolver uma consciência, mesmo enquanto seus clientes continuam a solicitar seus serviços.
Vermelho, Branco e Sangue Azul;Red, White & Royal Blue;2023;7.0;Comédia;Quando sua mãe foi eleita presidente dos Estados Unidos, Alex Claremont-Diaz se tornou o novo queridinho da mídia estadunidense. Bonito, carismático e com personalidade forte, Alex tem tudo para seguir os passos de seus pais.
Agente Stone;Heart of Stone;2023;5.7;Ação;Uma agente de inteligência de uma sombria agência global que trabalha pela manutenção da paz corre para impedir um hacker de roubar sua arma mais valiosa e perigosa.
Bottoms;Bottoms;2023;7.7;Comédia;Duas garotas queer e nada populares decidem começar um clube da luta para conseguir fazer sexo antes de suas formaturas.
As Tartarugas Ninja: Caos Mutante;Teenage Mutant Ninja Turtles: Mutant Mayhem;2023;7.4;Animação;Os irmãos Tartaruga trabalham para conquistar o amor da cidade de Nova York enquanto enfrentam um exército de mutantes.
Dungeons & Dragons: Honra Entre Rebeldes;Dungeons & Dragons: Honor Among Thieves;2023;7.3;Ação;Um ladrão encantador e um grupo de aventureiros improváveis embarcam em uma jornada épica para recuperar uma relíquia perdida, mas as coisas saem perigosamente do controle quando eles se envolvem com as pessoas erradas.
Fale Comigo;Talk to Me;2022;7.4;Terror;Um grupo de amigos descobre uma mão embalsamada que lhes permite conjurar espíritos. Viciado na emoção, um deles vai longe demais e abre a porta para o mundo espiritual.
Boogeyman: Seu Medo é Real;The Boogeyman;2023;6.0;Terror;Ainda se recuperando da trágica morte de sua mãe, uma adolescente e sua irmã mais nova se veem atormentados por uma presença sádica em sua casa e lutam para fazer com que seu pai de luto preste atenção antes que seja tarde demais.
Guardiões da Galáxia Vol. 3;Guardians of the Galaxy Vol. 3;2023;8.0;Ação;Após a perda de Gamora, Peter Quill ainda está chateado e deve reunir os Guardiões da Galáxia em uma missão para defender o universo e proteger Rocket.
Ferrari;Ferrari;2023;7.0;Biografia;A história de vida do empreendedor italiano de carros esportivos Enzo Ferrari.
Som da Liberdade;Sound of Freedom;2023;7.8;Ação;A incrível história real de um ex-agente governamental que se transforma em um vigilante e que embarca em uma missão perigosa para resgatar centenas de crianças das mãos de traficantes sexuais.
Five Nights at Freddy's - O Pesadelo Sem Fim;Five Nights at Freddy's;2023;;Terror;Mike Schmidt, um guarda de segurança na pior, decide arranjar emprego em uma pizzaria local. Porem, após fazer uma descoberta terrível sobre os animatrônicos do local, Mike é forçado a sobreviver e encarar o passado.
Homem-Aranha: Através do Aranhaverso;Spider-Man: Across the Spider-Verse;2023;8.8;Animação;Miles Morales, o amigão da vizinhança Homem-Aranha, é transporado através do multiverso para unir forças com Gwen Stacy e um novo time de Pessoas-Aranha para enfrentar um vilão mais poderoso do que qualquer coisa que já tenham encontrado.
Saltburn;Saltburn;2023;7.6;Comédia;A student at Oxford University finds himself drawn into the world of a charming and aristocratic classmate, who invites him to his eccentric family's sprawling estate for a summer never to be forgotten.
Amigos De Férias 2;Vacation Friends 2;2023;5.3;Ação;Segue um casal que se encontra com outro casal durante as férias no México e vê a amizade deles tomar um rumo estranho quando voltam para casa.
Missão: Impossível - Acerto de Contas Parte Um;Mission: Impossible - Dead Reckoning Part One;2023;8.0;Ação;Ethan Hunt e seu grupo do IMF embarcam na missão mais arriscada até agora: localizar uma nova arma aterrorizante que ameaça toda a humanidade antes que caia nas mãos erradas.
A Noite das Bruxas;A Haunting in Venice;2023;;Policial;Na Veneza pós-Segunda Guerra Mundial, Poirot, agora aposentado e vivendo em seu próprio exílio, relutantemente vai a uma sessão espírita. Mas quando um dos convidados é assassinado, cabe ao ex-detetive descobrir mais uma vez o assassino.
Vidas Passadas;Past Lives;2023;8.1;Drama;Dois amigos de infância, Nora e Hae Sung, são separados quando a família de Nora emigra da Coreia do Sul. Vinte anos depois, eles se reencontram e exploram o amor e o destino.
Asteroid City;Asteroid City;2023;6.7;Comédia;O itinerário de uma convenção Junior Stargazer é espetacularmente interrompido por eventos que mudam o mundo.
Ruim Pra Cachorro;Strays;2023;6.4;Animação;Um cachorro abandonado se une a outros vira-latas para se vingar de seu antigo dono.
X: A Marca da Morte;X;2022;6.6;Terror;Em 1979, um grupo de jovens cineastas se propôs a fazer um filme adulto na zona rural do Texas, mas quando seus solitários e idosos anfitriões os pegam em flagrante, o elenco se vê lutando por suas vidas.
Pobres Criaturas;Poor Things;2023;8.1;Romance;A incrível história sobre a evolução fantástica de Bella Baxter, uma jovem trazida de volta à vida pelo brilhante e não convencional cientista Dr. Godwin Baxter.
Super Mario Bros. - O Filme;The Super Mario Bros. Movie;2023;7.1;Animação;Um encanador chamado Mario precisa salvar seu irmão Luigi das garras do rei dos Koopas, Bowser. Para isso, ele conta com a ajuda da princesa do Reino dos Cogumelos, Peach, e de seus amigos Toad e Donkey Kong.
O Protetor;The Equalizer;2014;7.2;Ação;Robert McCall, um homem misterioso que costumava trabalhar como oficial da polícia, motivado pelas injustiças sociais, ajuda vítimas e qualquer pessoa em perigo. A protegida da vez é Teri, jovem explorada sexualmente por mafiosos russos.
