title_pt;title_en;year;rating;genre;sinopse
Elementos;Elemental;2023;7.0;Animação;Em uma cidade onde cidadãos de fogo, água, terra e ar vivem juntos, Ember, uma jovem impetuosa, e Wade, um cara que segue o fluxo da vida, irão descobrir algo elementar: o quanto eles têm em comum.
Assassinos da Lua das Flores;Killers of the Flower Moon;2023;;Policial;Membros da tribo Osage nos Estados Unidos são assassinados em circunstâncias misteriosas na década de 1920, o que levou a uma grande investigação envolvendo J. Edgar Hoover.
A Grande Aposta;The Big Short;2015;7.8;Biografia;Entre o 2006 e o 2007, um grupo de investidores apostaram contra o mercado de hipotecas dos Estados Unidos, no processo descobriram o errado e corrupto que é o mercado verdaderamente.
Toc Toc Toc: Ecos do Além;Cobweb;2023;5.9;Terror;Peter, de oito anos, é atormentado por um barulho que vem da parede de seu quarto, que seus pais insistem estar só em sua imaginação. Conforme o medo de Peter se intensifica, ele acredita que seus pais podem estar escondendo um segredo.
O Exorcista do Papa;The Pope's Exorcist;2023;6.1;Terror;Baseado nos arquivos reais do padre Gabriele Amorth, conhecido como o exorcista chefe do Vaticano, que enquanto investigava a posse de um jovem, descobre que durante séculos no Vaticano tentaram a todo custo manter a verdade escondida.
Interestelar;Interstellar;2014;8.7;Aventura;Uma equipe de exploradores viaja através de um buraco de minhoca no espaço, na tentativa de garantir a sobrevivência da humanidade.
Megatubarão;The Meg;2018;5.6;Ação;Um grupo de cientistas da Fossa das Marianas encontram ao maior predador da historia, o Megalodon.
Tenet;Tenet;2020;7.3;Ação;O projeto é descrito como um épico de ação que gira em torno do mundo da espionagem internacional.
O Clube de Leitores Assassinos;Killer Book Club;2023;4.6;Terror;Um grupo de oito amigos fãs de terror precisarão lutar por suas vidas ao fugir da perseguição de um palhaço assassino, que sabe mais segredos deles do que os amigos podem imaginar.
A Chamada;Retribution;2023;5.5;Ação;Um executivo se prepara para levar os filhos na escola. Ao ligar o carro, ele recebe uma ligação anônima informando que há uma bomba embaixo do seu assento e não poderão sair do carro.
The Dive;The Dive;2023;5.6;Suspense;Duas irmãs decidem fazer mergulho em um lugar remoto. Uma delas fica presa em uma rocha e, sem poder se mover, terá que lutar por sua vida enquanto lida com um nível perigosamente baixo de oxigênio e baixa temperatura.
Os Mercenários 4;Expend4bles;2023;;Ação;The Expendables will square up against: an arms dealer who commands the might of a massive private army.
Babilônia;Babylon;2022;7.1;Comédia;Um conto de ambições exageradas e excessos escandalosos, ele traça a ascensão e queda de múltiplos personagens durante uma era de desenfreada decadência e depravação no início de Hollywood.
John Wick 4: Baba Yaga;John Wick: Chapter 4;2023;7.8;Ação;John Wick descobre um modo para derrotar a Alta Cúpula. Mas, antes que possa conquistar a sua liberdade, Wick deve enfrentar um novo inimigo com alianças poderosas no mundo todo e forças que transformam velhos amigos em inimigos.
O Pior Vizinho do Mundo;A Man Called Otto;2022;7.5;Comédia;Otto é um grunhido que desistiu da vida após a perda de sua esposa e quer acabar com tudo isso. Quando uma jovem família se muda para as redondezas, ele encontra seu par na engenhosa Marisol, levando a uma amizade que mudará seu mundo.
Transformers: O Despertar das Feras;Transformers: Rise of the Beasts;2023;6.1;Ação;Uma nova aventura que envolverá os Maximals, Predacons e Terrorcons na luta existente na Terra entre Autobots e Decepticons.
Amizade de Férias;Vacation Friends;2021;6.3;Aventura;Um casal conhece outro casal em férias no México, mas sua amizade toma um rumo incômodo quando voltam para casa.
O Pacto;The Covenant;2023;7.5;Ação;Durante a guerra no Afeganistão, um intérprete local arrisca sua própria vida para carregar um sargento ferido por quilômetros de terreno extenuante.
O Poderoso Chefão;The Godfather;1972;9.2;Policial;O patriarca idoso de uma dinastia do crime organizado transfere o controle de seu império clandestino para seu filho relutante.
Um Sonho de Liberdade;The Shawshank Redemption;1994;9.3;Drama;Dois homens presos se reúnem ao longo de vários anos, encontrando consolo e eventual redenção através de atos de decência comum.
Duna;Dune;2021;8.0;Ação;Paul Atreides é um jovem prodígio com um futuro grandioso e envolto em mistério que precisa viajar para o planeta mais perigoso do universo para garantir o futuro de sua família e seu povo.
A Freira 2;The Nun II;2023;;Terror;França, 1956. Um padre é assassinado. Um mal está se espalhando. A sequência de The Nun (2018) segue a irmã Irene quando ela mais uma vez fica cara a cara com a força demoníaca Valak, a Freira.
A Pequena Sereia;The Little Mermaid;2023;7.2;Aventura;A filha do rei Tritão, Ariel, se apaixona loucamente por um príncipe que salvou de um naufrágio. Ela decide ir procurá-lo em terra firme e pede ajuda à bruxa do mar, Úrsula.
Avatar: O Caminho da Água;Avatar: The Way of Water;2022;7.6;Ação;Jake Sully vive com sua nova família na lua extrassolar Pandora. Uma vez que uma ameaça familiar retorna para terminar o que foi iniciado anteriormente, Jake deve trabalhar com Neytiri e o exército da raça Na'vi para proteger sua casa.
OMG 2;OMG 2;2023;8.1;Comédia;Um civil insatisfeito pede ao tribunal que determine a educação integral nas escolas em uma peça dramática e divertida no tribunal.
George Foreman: Sua História;Big George Foreman;2023;6.6;Biografia;A vida e carreira no boxe de George Foreman.
The Book of Clarence;The Book of Clarence;2023;;Aventura;A down on his luck Jerusalemite embarks on a misguided attempt to capitalize on the rise of celebrity and influence the Messiah for his own personal gain. The journey leads him on an exploration of faith and an unexpected path.
Batman;The Batman;2022;7.8;Ação;Sinopse desconhecida.
A Baleia;The Whale;2022;7.7;Drama;Um professor de inglês recluso que vive com obesidade severa tenta se reconectar com sua distante filha adolescente para uma última chance de redenção.
O Urso do Pó Branco;Cocaine Bear;2023;5.9;Comédia;Conta a história de um traficante de drogas cujo avião cai com uma carga de cocaína encontrada por um urso negro, que a come.
Batman: O Cavaleiro das Trevas;The Dark Knight;2008;9.0;Ação;Quando a ameaça conhecida como O Coringa surge de seu passado, causa estragos e caos nas pessoas de Gotham. O Cavaleiro das Trevas deve aceitar um dos maiores testes para combater a injustiça.
Jawan;Jawan;2023;;Ação;Um thriller de ação de alta octanagem que descreve a jornada emocional de um homem que está determinado a corrigir os erros da sociedade.
The Hill;The Hill;2023;6.7;Biografia;A notável história real da improvável jornada de Ricky Hill para jogar na Major League Baseball.
Jailer;Jailer;2023;7.5;Ação;Um carcereiro aposentado sai em uma caçada para encontrar os assassinos de seu filho. Mas o caminho o leva a um lugar familiar, embora um pouco mais sombrio. Será que ele conseguirá sair dessa situação complexa com sucesso?
Foe;Foe;2023;;Drama;Hen and Junior farm a secluded piece of land that has been in Junior's family for generations, but their quiet life is thrown into turmoil when an uninvited stranger shows up at their door with a startling proposal.
Sede Assassina;To Catch a Killer;2023;6.6;Ação;Baltimore. Véspera de Ano Novo. Uma policial talentosa, mas problemática, é recrutada pelo investigador-chefe do FBI para ajudar a traçar o perfil e rastrear um indivíduo perturbado que está aterrorizando a cidade.
Resistência;The Creator;2023;;Ação;Em meio a uma futura guerra entre humanos e inteligência artificial, Joshua é recrutado para localizar e matar o Criador - misterioso arquiteto responsável por desenvolver uma arma capaz de acabar com o confronto e com toda a humanidade.
O Lugar Onde Tudo Termina;The Place Beyond the Pines;2012;7.3;Policial;Um motorista rouba bancos para fornecer para sua familia, situação que faz conflito com um novo policial que procura limpar sua cidade.
O Protetor 2;The Equalizer 2;2018;6.7;Ação;Robert McCall é um justiceiro implacável que defende os explorados e os oprimidos, mas até onde ele irá se um deles for alguém que ele ama?
Mansão Mal-Assombrada;Haunted Mansion;2023;6.2;Comédia;Uma mãe e seu filho de nove anos estão tentando começar uma nova vida. Eles aproveitam uma oportunidade imperdível, uma adorável mansão em Nova Orleans.
Velozes e Furiosos 10;Fast X;2023;5.8;Ação;Dom Toretto e sua família são alvo do filho vingativo do traficante Hernan Reyes.
A Origem;Inception;2010;8.8;Ação;Um ladrão que rouba segredos corporativos através da tecnologia de entrar no subconsciente recebe a tarefa inversa de plantar uma idéia na mente do diretor de uma grande empresa.
M3gan;M3GAN;2022;6.4;Terror;Uma engenheira de robótica de uma empresa de brinquedos constrói uma boneca realista que começa a ganhar vida própria.
Mob Land;Mob Land;2023;5.3;Ação;Um jovem pai se mete em confusão depois que um assalto dá errado. Algumas dívidas não podem ser pagas com dinheiro.
Jurassic Park;Jurassic Park;1993;8.2;Ação;Durante um tour o parque sofre falta de energia eléctrica o que faz que um dinossauro clonado saia do seu claustro.
Harry Potter e a Pedra Filosofal;Harry Potter and the Sorcerer's Stone;2001;7.6;Aventura;Uma criança órfã se enrolla em uma escola de magia, onde ele aprende a verdade sobre si mesmo, sua família e o terrível mal que se esconde no mundo mágico.
Puppy Love;Puppy Love;2023;6.3;Comédia;Depois de um primeiro encontro desastroso, Nicole e Max prometem perder os números um do outro até descobrirem que seus cachorros são um casal amoroso com filhotes a caminho.
O Lobo de Wall Street;The Wolf of Wall Street;2013;8.2;Biografia;Baseada na verdadeira história de Jordan Belfort, desde sua ascensão como corretor de valores até a sua queda e envolvimento no crime e corrupção com o governo.
Tombstone: A Justiça Está Chegando;Tombstone;1993;7.8;Biografia;Os planos de um oficial da lei bem sucedido para se aposentar anonimamente em Tombstone, Arizona, são perturbados pelo tipo de fora-da-lei que ele costumava eliminar.
Fogo Contra Fogo;Heat;1995;8.3;Ação;Um grupo de profissionais roubando bancos sospeitam que a polícia está tráis deles quando deixam uma pista no seu último roubo.
Titanic;Titanic;1997;7.9;Drama;Uma aristocrata de dezessete anos se apaixona por um artista gentil mas pobre a bordo do luxuoso e desafortunado Titanic.
Reptile;Reptile;2023;;Policial;Nichols, a hardened New England detective unflinching in his pursuit of a case where nothing is as it seems, one that begins to dismantle the illusions in his own life.
Top Gun: Maverick;Top Gun: Maverick;2022;8.3;Ação;Após mais de trinta anos de serviço como um dos melhores aviadores da Marinha, Pete Mitchell está onde pertence, ultrapassando os limites como um piloto de teste intrépido e evitando a promoção de posto que o manteria em terra.
Casamento Grego 3;My Big Fat Greek Wedding 3;2023;;Comédia;After travelling to Greece for a family reunion, a woman attempts to locate her deceased father's childhood friends.
Duna: Parte Dois;Dune: Part Two;2024;;Ação;Um menino se torna o Messias dos nômades em um planeta deserto, com vermes gigantes que protegem uma mercadoria chamada Spice.
Minha Culpa;My Fault;2023;6.2;Drama;Uma jovem tem que deixar sua cidade, namorado e amigos para trás e se mudar para a mansão do novo marido rico de sua mãe. Lá ela conhece Nick, seu novo meio-irmão. Eles se apaixonam loucamente em segredo.
Era Uma Vez Em... Hollywood;Once Upon a Time in Hollywood;2019;7.6;Comédia;Um ator de televisão apagado e seu dublê se esforçam para alcançar a fama e o sucesso na indústria cinematográfica durante os anos finais da Era de Ouro de Hollywood.
Pulp Fiction - Tempo de Violência;Pulp Fiction;1994;8.9;Policial;As vidas de dois assassinos da máfia, um boxeador, um gângster e sua esposa, e um par de bandidos se entrelaçam em quatro histórias de violência e redenção.
Tudo em Todo o Lugar ao Mesmo Tempo;Everything Everywhere All at Once;2022;7.8;Ação;Uma imigrante chinesa de meia idade se envolve em uma aventura louca, onde só ela pode salvar o mundo explorando outros universos que se conectam com as vidas que ela poderia ter levado.
Homem-aranha: Lotus;Spider-Man: Lotus;2023;3.4;Ação;Após a morte de sua namorada, Peter Parker se culpa, questionando se seu alter-ego deve ser esquecido. Ele recebe a notícia de que uma criança doente, queria conhecer o incrível, Homem-Aranha, em seus últimos momentos.
The Marsh King's Daughter;The Marsh King's Daughter;2023;;Policial;A woman seeks revenge against the man who kidnapped her mother.
O Rei Macaco;The Monkey King;2023;5.8;Animação;Segue um macaco cheio de carisma e seu bastão mágico. Os dois embarcam em uma aventura épica, lutando contra 100 demônios, um excêntrico Rei Dragão e o maior inimigo do macaco: seu próprio ego.
Gladiador;Gladiator;2000;8.5;Ação;Um general romano planeja a melhor vingança contra o imperador corrupto que matou sua familia e o fez escravo.
Midsommar: O Mal Não Espera a Noite;Midsommar;2019;7.1;Drama;Casal viaja a Suécia para conhecer lendário festival do solstício de verão numa vila rural. O que começa como um retiro idílico se transforma rapidamente em uma competição cada vez mais violenta e bizarra nas mãos de uma seita pagã.
